https://docs.google.com/spreadsheets/d/1Qy3el1DFIpxtm3-VIAdZlBmEHual1CU39oB_urGxiyI/edit#gid=508940504,,,,,,,,,,,,,,,,,,,,,,,,,,,,,,,,,,,,,,,,,,,,,,,,,,,,,,,,,,,,,,
40,n処理終了,,,,,,,,,,,,d08_import_license_datas,完了,,,,,,,,,,,,,,,,,,,,,,,,,,,,,,,,,,,,,,,,,,,,,,,,
,施設名,施設-住所1,施設-マンション名,施設-電話番号1,業種,申請者1,申請-電話番号1,開業年月日,許可年月日,,申請区分,確認番号,ここまで,,,,,,,,,,,,,,,,,,,,,,,,,,,,,,,,,,,,,,,,,,,,,,,,,
No.,営業所名,営業所所在地,営業所方書,営業所TEL,業種,申請者名,申請者電話番号①,初回許可年月日,許可年月日,許可決定日,申請区分,許可番号,,管轄保健所,名称,市外局番,電話番号,施設の郵便番号,緯度,経度,施設の住所（元住所）,施設の住所（整備）,施設マンション名,施設-住所コード,施設-都道府県,施設-郡・政令市・市区町村名,施設-大字名・字名,申請年月日,開業年月日,許可年月日,許可期間開始日,許可期間終了日,申請法人,申請者氏名(個人名),申請者（開設者）の電話番号,申請者の住所（元住所）,申請者の住所（整備）,申請マンション名,申請-住所コード,申請-都道府県,申請-郡・政令市・市区町村名,申請-大字名・字名,確認番号,申請区分,業種,業態,その他,法人番号,シート名,産業分類大,産業分類中,産業分類小,産業分類詳細,facility_idを識別するための文字列,店舗コード,company_idを識別するための文字列,法人コード,ライセンスコード,検索用日付,整備名称,整備名称2,整備申請法人
1,湘和会堂　片瀬鵠沼,神奈川県藤沢市片瀬373番地2,,0466-26-7581,1飲食店営業,平安レイサービス株式会社,0463-34-2771,令和3年11月1日,令和3年11月1日,令和3年11月1日,新規,2021-901-0251,,145,湘和会堂　片瀬鵠沼,0466,0466-26-7581,,,,神奈川県藤沢市片瀬373番地2,神奈川県藤沢市片瀬３７３番地２,,81639,14,14205,片瀬３,,2021/11/01,2021/11/01,,,平安レイサービス株式会社,,0463-34-2771,,,,,,,,2021-901-0251,新規,飲食店営業,,,,145_神奈川県_藤沢市保健所_食品衛生()_2021年11月_末日_新規、廃止,M,76,,,湘和会堂片瀬鵠沼0466-26-75818163914205,6269d2f6-10c1-4208-8f91-55279915c0ff,平安レイサービス株式会社,06c829e4-63d5-42f5-b127-e5684cd934ee,b5388e58-6900-46c9-86e0-179ab04f1096,2021/11/01,湘和会堂　片瀬鵠沼,湘和会堂片瀬鵠沼,平安レイサービス株式会社
2,有限会社小塚食品,神奈川県藤沢市善行一丁目21番地5,,0466-81-7955,22豆腐製造業,有限会社小塚食品,0466-81-7955,令和3年11月1日,令和3年11月1日,令和3年11月1日,新規,2021-922-0001,,145,有限会社小塚食品,0466,0466-81-7955,,,,神奈川県藤沢市善行一丁目21番地5,神奈川県藤沢市善行１丁目２１番地５,,81698,14,14205,善行１,,2021/11/01,2021/11/01,,,有限会社小塚食品,,0466-81-7955,,,,,,,,2021-922-0001,新規,豆腐製造業,,,,145_神奈川県_藤沢市保健所_食品衛生()_2021年11月_末日_新規、廃止,E,9,,,有限会社小塚食品0466-81-79558169814205,74d9e362-a7c0-4111-899c-c41ee655da7b,有限会社小塚食品,164d24b0-40e0-44ff-8b76-ca1e94b8183a,fe0fd7f3-9534-486b-8b00-fd2f568d017a,2021/11/01,有限会社小塚食品,有限会社小塚食品,有限会社小塚食品
3,やきとりセンター　辻堂駅前店,神奈川県藤沢市辻堂神台一丁目2番12号,Luz湘南辻堂　6F,0466-31-0894,1飲食店営業,株式会社レインズインターナショナル,045-274-5970,令和3年11月4日,令和3年11月4日,令和3年11月4日,新規,2021-901-0254,,145,やきとりセンター　辻堂駅前店,0466,0466-31-0894,,,,神奈川県藤沢市辻堂神台一丁目2番12号,神奈川県藤沢市辻堂神台１丁目２番１２号,Luz湘南辻堂　6F,81719,14,14205,辻堂神台１,,2021/11/04,2021/11/04,,,株式会社レインズインターナショナル,,045-274-5970,,,,,,,,2021-901-0254,新規,飲食店営業,,,,145_神奈川県_藤沢市保健所_食品衛生()_2021年11月_末日_新規、廃止,M,76,,,やきとりセンタ辻堂駅前店0466-31-08948171914205,1b03bc5c-46d2-44f3-8c40-07c1eb08f9d5,株式会社レインズインターナショナル,ad07a8e1-a75a-4a23-8e65-e46d3328cf44,7a86d45c-6359-4abe-85ee-2f8015f8f186,2021/11/04,やきとりセンター　辻堂駅前店,やきとりセンタ辻堂駅前店,株式会社レインズインターナショナル
4,ヨークフーズ　藤沢六会店,神奈川県藤沢市亀井野一丁目3番地9,,0466-81-2133,1飲食店営業,株式会社ヨーク,03-5520-9556,令和3年11月5日,令和3年11月5日,令和3年11月5日,新規,2021-901-0257,,145,ヨークフーズ　藤沢六会店,0466,0466-81-2133,,,,神奈川県藤沢市亀井野一丁目3番地9,神奈川県藤沢市亀井野１丁目３番地９,,81652,14,14205,亀井野１,,2021/11/05,2021/11/05,,,株式会社ヨーク,,03-5520-9556,,,,,,,,2021-901-0257,新規,飲食店営業,,,,145_神奈川県_藤沢市保健所_食品衛生()_2021年11月_末日_新規、廃止,M,76,,,ヨクフズ藤沢六会店0466-81-21338165214205,9c88dca7-ceab-4635-afc7-42ab053ba919,株式会社ヨーク,a936f83b-0669-4d59-b924-84a0a8ed7f9a,a4a6f786-4e50-4525-88f2-8637be40f6db,2021/11/05,ヨークフーズ　藤沢六会店,ヨクフズ藤沢六会店,株式会社ヨーク
5,ヨークフーズ　藤沢六会店,神奈川県藤沢市亀井野一丁目3番地9,,0466-81-2133,1飲食店営業,株式会社ヨーク,03-5520-9556,令和3年11月5日,令和3年11月5日,令和3年11月5日,新規,2021-901-0258,,145,ヨークフーズ　藤沢六会店,0466,0466-81-2133,,,,神奈川県藤沢市亀井野一丁目3番地9,神奈川県藤沢市亀井野１丁目３番地９,,81652,14,14205,亀井野１,,2021/11/05,2021/11/05,,,株式会社ヨーク,,03-5520-9556,,,,,,,,2021-901-0258,新規,飲食店営業,,,,145_神奈川県_藤沢市保健所_食品衛生()_2021年11月_末日_新規、廃止,M,76,,,ヨクフズ藤沢六会店0466-81-21338165214205,9c88dca7-ceab-4635-afc7-42ab053ba919,株式会社ヨーク,a936f83b-0669-4d59-b924-84a0a8ed7f9a,39c7db7d-3e85-4f76-bf91-cffd4e22fe09,2021/11/05,ヨークフーズ　藤沢六会店,ヨクフズ藤沢六会店,株式会社ヨーク
6,ヨークフーズ　藤沢六会店,神奈川県藤沢市亀井野一丁目3番地9,,0466-81-2133,11 菓子製造業,株式会社ヨーク,03-5520-9556,令和3年11月5日,令和3年11月5日,令和3年11月5日,新規,2021-911-0018,,145,ヨークフーズ　藤沢六会店,0466,0466-81-2133,,,,神奈川県藤沢市亀井野一丁目3番地9,神奈川県藤沢市亀井野１丁目３番地９,,81652,14,14205,亀井野１,,2021/11/05,2021/11/05,,,株式会社ヨーク,,03-5520-9556,,,,,,,,2021-911-0018,新規,菓子製造業,,,,145_神奈川県_藤沢市保健所_食品衛生()_2021年11月_末日_新規、廃止,E,9,,,ヨクフズ藤沢六会店0466-81-21338165214205,9c88dca7-ceab-4635-afc7-42ab053ba919,株式会社ヨーク,a936f83b-0669-4d59-b924-84a0a8ed7f9a,196c14cb-3be8-4771-80fa-cd455384c6ad,2021/11/05,ヨークフーズ　藤沢六会店,ヨクフズ藤沢六会店,株式会社ヨーク
7,すき家　藤沢菖蒲沢店,神奈川県藤沢市菖蒲沢730番地1,,,1飲食店営業,株式会社すき家,03-5783-8850,令和3年11月5日,令和3年11月5日,令和3年11月5日,新規,2021-901-0259,,145,すき家　藤沢菖蒲沢店,0466,,,,,神奈川県藤沢市菖蒲沢730番地1,神奈川県藤沢市菖蒲沢７３０番地１,,81692,14,14205,菖蒲沢,,2021/11/05,2021/11/05,,,株式会社すき家,,03-5783-8850,,,,,,,,2021-901-0259,新規,飲食店営業,,,,145_神奈川県_藤沢市保健所_食品衛生()_2021年11月_末日_新規、廃止,M,76,,,すき家藤沢菖蒲沢店8169214205,57523679-4ee0-4793-a319-b32485475cf3,株式会社すき家,c7b6fbed-bd7a-49bc-809e-36eca60a1976,07303ade-8624-42b7-9fa8-115cae3abdda,2021/11/05,すき家　藤沢菖蒲沢店,すき家藤沢菖蒲沢店,株式会社すき家
8,炉ばた情緒かっこ　藤沢南口店,神奈川県藤沢市鵠沼石上一丁目2番2号,ASCAビル　2F,0466-52-2022,1飲食店営業,株式会社オーイズミフーズ,046-297-2511,令和3年11月8日,令和3年11月8日,令和3年11月8日,新規,2021-901-0262,,145,炉ばた情緒かっこ　藤沢南口店,0466,0466-52-2022,,,,神奈川県藤沢市鵠沼石上一丁目2番2号,神奈川県藤沢市鵠沼石上１丁目２番２号,ASCAビル　2F,81789,14,14205,鵠沼石上１,,2021/11/08,2021/11/08,,,株式会社オーイズミフーズ,,046-297-2511,,,,,,,,2021-901-0262,新規,飲食店営業,,,,145_神奈川県_藤沢市保健所_食品衛生()_2021年11月_末日_新規、廃止,M,76,,,炉ばた情緒かっこ藤沢南口店0466-52-20228178914205,9d5c3e14-9cb6-4869-ab45-5cf91404583d,株式会社オーイズミフーズ,4065ac5b-b2ce-4bea-84a0-5f42f021cde8,ffcd9e74-08bf-47c3-8c82-0d85b8ecab52,2021/11/08,炉ばた情緒かっこ　藤沢南口店,炉ばた情緒かっこ藤沢南口店,株式会社オーイズミフーズ
9,タコとハイボール藤沢店,神奈川県藤沢市南藤沢2番1~2号,藤沢プライム　1F,,1飲食店営業,株式会社フラバーダイニング,0263-87-0688,令和3年11月8日,令和3年11月8日,令和3年11月8日,新規,2021-901-0264,,145,タコとハイボール藤沢店,0466,,,,,神奈川県藤沢市南藤沢2番1~2号,神奈川県藤沢市南藤沢２番１~２号,藤沢プライム　1F,81786,14,14205,南藤沢,,2021/11/08,2021/11/08,,,株式会社フラバーダイニング,,0263-87-0688,,,,,,,,2021-901-0264,新規,飲食店営業,,,,145_神奈川県_藤沢市保健所_食品衛生()_2021年11月_末日_新規、廃止,M,76,,,タコとハイボル藤沢店8178614205,78ecfcc2-2d94-4e80-bc85-a8908d52b261,株式会社フラバーダイニング,3f939ad2-7a35-4ac5-99af-bd3a91df5518,25693343-60db-4fc7-bd72-d401d086fd8c,2021/11/08,タコとハイボール藤沢店,タコとハイボル藤沢店,株式会社フラバーダイニング
10,パブ 風月,神奈川県藤沢市南藤沢3番3号,藤沢平和ビル　6階,0466-24-1037,1飲食店営業,株式会社湘南コーポレーション,0467-98-2537,令和3年11月8日,令和3年11月8日,令和3年11月8日,新規,2021-901-0263,,145,パブ 風月,0466,0466-24-1037,,,,神奈川県藤沢市南藤沢3番3号,神奈川県藤沢市南藤沢３番３号,藤沢平和ビル　6階,81786,14,14205,南藤沢,,2021/11/08,2021/11/08,,,株式会社湘南コーポレーション,,0467-98-2537,,,,,,,,2021-901-0263,新規,飲食店営業,,,,145_神奈川県_藤沢市保健所_食品衛生()_2021年11月_末日_新規、廃止,M,76,,,パブ風月0466-24-10378178614205,0e53e674-f9a2-4dd3-bd61-1f749cbbd56a,株式会社湘南コーポレーション,a99a3026-0028-4f0b-8679-217253c22a9c,89a8f1c0-aea4-46a9-859a-ea8df119415e,2021/11/08,パブ　風月,パブ風月,株式会社湘南コーポレーション
11,くいもの屋　わん　藤沢店,神奈川県藤沢市南藤沢2番1号2,藤沢プライムビル　5F,0466-52-2011,1飲食店営業,株式会社オーイズミフーズ,046-297-2511,令和3年11月9日,令和3年11月9日,令和3年11月9日,新規,2021-901-0270,,145,くいもの屋　わん　藤沢店,0466,0466-52-2011,,,,神奈川県藤沢市南藤沢2番1号2,神奈川県藤沢市南藤沢２番１号２,藤沢プライムビル　5F,81786,14,14205,南藤沢,,2021/11/09,2021/11/09,,,株式会社オーイズミフーズ,,046-297-2511,,,,,,,,2021-901-0270,新規,飲食店営業,,,,145_神奈川県_藤沢市保健所_食品衛生()_2021年11月_末日_新規、廃止,M,76,,,くいもの屋わん藤沢店0466-52-20118178614205,eff71cae-0439-4264-b33c-2312c3c89ea8,株式会社オーイズミフーズ,4065ac5b-b2ce-4bea-84a0-5f42f021cde8,829c093f-7336-4f95-b65b-52c0b0e7f99c,2021/11/09,くいもの屋　わん　藤沢店,くいもの屋わん藤沢店,株式会社オーイズミフーズ
12,ファーストレッスン,神奈川県藤沢市南藤沢3番3号,第一興産ビル　B1,0466-29-9010,1飲食店営業,株式会社シャイン,042-766-6194,令和3年11月9日,令和3年11月9日,令和3年11月9日,新規,2021-901-0267,,145,ファーストレッスン,0466,0466-29-9010,,,,神奈川県藤沢市南藤沢3番3号,神奈川県藤沢市南藤沢３番３号,第一興産ビル　B1,81786,14,14205,南藤沢,,2021/11/09,2021/11/09,,,株式会社シャイン,,042-766-6194,,,,,,,,2021-901-0267,新規,飲食店営業,,,,145_神奈川県_藤沢市保健所_食品衛生()_2021年11月_末日_新規、廃止,M,76,,,ファストレッスン0466-29-90108178614205,66c2a7ef-b7f4-4870-98cb-ad95584f9b97,株式会社シャイン,89a4b986-bab6-4463-ac30-250745a2ab39,4e3f80be-c866-41ee-ade1-5f88eb5b77ce,2021/11/09,ファーストレッスン,ファストレッスン,株式会社シャイン
13,串かつ酒場　串堂,神奈川県藤沢市辻堂二丁目9番10号,,0466-65-4694,1飲食店営業,SURFOOD株式会社,0466-65-4694,令和3年11月9日,令和3年11月9日,令和3年11月9日,新規,2021-901-0271,,145,串かつ酒場　串堂,0466,0466-65-4694,,,,神奈川県藤沢市辻堂二丁目9番10号,神奈川県藤沢市辻堂２丁目９番１０号,,81714,14,14205,辻堂２,,2021/11/09,2021/11/09,,,SURFOOD株式会社,,0466-65-4694,,,,,,,,2021-901-0271,新規,飲食店営業,,,,145_神奈川県_藤沢市保健所_食品衛生()_2021年11月_末日_新規、廃止,M,76,,,串かつ酒場串堂0466-65-46948171414205,2089410c-e0a3-4dfc-a49f-56bd33fc1116,ＳＵＲＦＯＯＤ株式会社,191a0a17-c796-46e0-97b2-20466b86ae9a,b803adc2-d502-4c6c-9e44-20b56fc0063f,2021/11/09,串かつ酒場　串堂,串かつ酒場串堂,ＳＵＲＦＯＯＤ株式会社
14,鮪のまつだ,神奈川県藤沢市稲荷520番地,,0466-47-8955,1飲食店営業,株式会社まつだ,0466-47-8955,令和3年11月9日,令和3年11月9日,令和3年11月9日,新規,2021-901-0269,,145,鮪のまつだ,0466,0466-47-8955,,,,神奈川県藤沢市稲荷520番地,神奈川県藤沢市稲荷５２０番地,,81624,14,14205,稲荷,,2021/11/09,2021/11/09,,,株式会社まつだ,,0466-47-8955,,,,,,,,2021-901-0269,新規,飲食店営業,,,,145_神奈川県_藤沢市保健所_食品衛生()_2021年11月_末日_新規、廃止,M,76,,,鮪のまつだ0466-47-89558162414205,d1bf27a3-8974-4b04-bc0f-67a52e63b938,株式会社まつだ,c075925b-e08d-41c9-a471-7196439c1a96,c31c7eac-2940-4932-a19d-bd4284f4b33d,2021/11/09,鮪のまつだ,鮪のまつだ,株式会社まつだ
15,Umie,神奈川県藤沢市鵠沼海岸五丁目7番12号,,0466-41-9774,1飲食店営業,株式会社スウェル·アート,0467-40-4073,令和3年11月11日,令和3年11月11日,令和3年11月11日,新規,2021-901-0275,,145,Umie,0466,0466-41-9774,,,,神奈川県藤沢市鵠沼海岸五丁目7番12号,神奈川県藤沢市鵠沼海岸５丁目７番１２号,,81668,14,14205,鵠沼海岸５,,2021/11/11,2021/11/11,,,株式会社スウェル·アート,,0467-40-4073,,,,,,,,2021-901-0275,新規,飲食店営業,,,,145_神奈川県_藤沢市保健所_食品衛生()_2021年11月_末日_新規、廃止,M,76,,,Ｕｍｉｅ0466-41-97748166814205,8bbf5763-64f8-45fd-8b87-14947e494848,株式会社スウェル・アート,70ba2e57-b349-469f-9e74-587ce5c663c3,51a7671f-c906-42f2-9650-99206a722589,2021/11/11,Ｕｍｉｅ,Ｕｍｉｅ,株式会社スウェル・アート
16,日高屋　辻堂南口店,神奈川県藤沢市辻堂一丁目2番1号,,0466-36-2712,1飲食店営業,株式会社ハイデイ日高,048-644-3231,令和3年11月15日,令和3年11月15日,令和3年11月15日,新規,2021-901-0278,,145,日高屋　辻堂南口店,0466,0466-36-2712,,,,神奈川県藤沢市辻堂一丁目2番1号,神奈川県藤沢市辻堂１丁目２番１号,,81713,14,14205,辻堂１,,2021/11/15,2021/11/15,,,株式会社ハイデイ日高,,048-644-3231,,,,,,,,2021-901-0278,新規,飲食店営業,,,,145_神奈川県_藤沢市保健所_食品衛生()_2021年11月_末日_新規、廃止,M,76,,,日高屋辻堂南口店0466-36-27128171314205,22a5be62-1624-477f-89dd-9d25f9f10360,株式会社ハイデイ日高,0a17957c-472d-4d30-afdc-a4ae955be266,535f19ec-4374-4766-867e-ad6eefae6cd6,2021/11/15,日高屋　辻堂南口店,日高屋辻堂南口店,株式会社ハイデイ日高
17,セブンイレブン藤沢遠藤滝の沢店,神奈川県藤沢市遠藤1325番地3,,0466-86-1283,1飲食店営業,有限会社ティ·アンド·ワイ,0466-86-1283,令和3年11月15日,令和3年11月15日,令和3年11月15日,新規,2021-901-0277,,145,セブンイレブン藤沢遠藤滝の沢店,0466,0466-86-1283,,,,神奈川県藤沢市遠藤1325番地3,神奈川県藤沢市遠藤１３２５番地３,,81633,14,14205,遠藤,,2021/11/15,2021/11/15,,,有限会社ティ·アンド·ワイ,,0466-86-1283,,,,,,,,2021-901-0277,新規,飲食店営業,,,,145_神奈川県_藤沢市保健所_食品衛生()_2021年11月_末日_新規、廃止,M,76,,,セブンイレブン藤沢遠藤滝の沢店0466-86-12838163314205,63213fd4-768e-4c9a-a459-a5cae3a13316,有限会社ティ・アンド·ワイ,ce2d9f47-1b76-4549-8d56-a6468432d5ce,673f0936-e7da-457a-a099-543c9b201610,2021/11/15,セブンイレブン藤沢遠藤滝の沢店,セブンイレブン藤沢遠藤滝の沢店,有限会社ティ・アンド·ワイ
18,ほっともっと　藤沢遠藤店,神奈川県藤沢市遠藤1551番地6,,,1飲食店営業,合同会社藤巻商会,,令和3年11月15日,令和3年11月15日,令和3年11月15日,新規,2021-901-0280,,145,ほっともっと　藤沢遠藤店,0466,,,,,神奈川県藤沢市遠藤1551番地6,神奈川県藤沢市遠藤１５５１番地６,,81633,14,14205,遠藤,,2021/11/15,2021/11/15,,,合同会社藤巻商会,,,,,,,,,,2021-901-0280,新規,飲食店営業,,,,145_神奈川県_藤沢市保健所_食品衛生()_2021年11月_末日_新規、廃止,M,76,,,ほっともっと藤沢遠藤店8163314205,5e172882-c90c-4de1-afea-12e3824a6d14,合同会社藤巻商会,39163caf-0815-4012-a4d7-98d7d890edc6,f594705d-ca54-41ad-afb2-473ced4eaa33,2021/11/15,ほっともっと　藤沢遠藤店,ほっともっと藤沢遠藤店,合同会社藤巻商会
19,サガミハム直売店　DELI&GIFT,神奈川県藤沢市遠藤4262番地,,0466-48-0171,1飲食店営業,エア·ウォーターアグリ&フーズ株式会社,,令和3年11月15日,令和3年11月15日,令和3年11月15日,新規,2021-901-0279,,145,サガミハム直売店　DELI&GIFT,0466,0466-48-0171,,,,神奈川県藤沢市遠藤4262番地,神奈川県藤沢市遠藤４２６２番地,,81633,14,14205,遠藤,,2021/11/15,2021/11/15,,,エア·ウォーターアグリ&フーズ株式会社,,,,,,,,,,2021-901-0279,新規,飲食店営業,,,,145_神奈川県_藤沢市保健所_食品衛生()_2021年11月_末日_新規、廃止,M,76,,,サガミハム直売店ＤＥＬＩＧＩＦＴ0466-48-01718163314205,3b3458bc-b66e-4c4d-bb4b-a1e54847d065,エア・ウォーターアグリ＆フーズ株式会社,0a22e454-e708-472e-92a5-0735b92cf52f,bdc63dc6-d35e-42b4-88c5-7df069bc88b5,2021/11/15,サガミハム直売店　ＤＥＬＩ＆ＧＩＦＴ,サガミハム直売店ＤＥＬＩＧＩＦＴ,エア・ウォーターアグリ＆フーズ株式会社
20,ホームメイドクッキング,神奈川県藤沢市鵠沼石上一丁目2番5号,第一ミヤビル　2F,0466-24-4451,11菓子製造業,株式会社ホームメイドクッキング,03-5753-5327,令和3年11月17日,令和3年11月17日,令和3年11月17日,新規,2021-911-0021,,145,ホームメイドクッキング,0466,0466-24-4451,,,,神奈川県藤沢市鵠沼石上一丁目2番5号,神奈川県藤沢市鵠沼石上１丁目２番５号,第一ミヤビル　2F,81789,14,14205,鵠沼石上１,,2021/11/17,2021/11/17,,,株式会社ホームメイドクッキング,,03-5753-5327,,,,,,,,2021-911-0021,新規,菓子製造業,,,,145_神奈川県_藤沢市保健所_食品衛生()_2021年11月_末日_新規、廃止,E,9,,,ホムメイドクッキング0466-24-44518178914205,fd00dd44-c156-4d89-a313-9f67326bf415,株式会社ホームメイドクッキング,ae47c354-f449-4c7f-a7ab-498c5668df96,fbd65c9b-1056-4688-a36b-42e08905eb90,2021/11/17,ホームメイドクッキング,ホムメイドクッキング,株式会社ホームメイドクッキング
21,家庭料理　シャルレ,神奈川県藤沢市亀井野一丁目8番地4,,0466-81-4062,1飲食店営業,有限会社シャルレ加藤,0466-45-5038,令和3年11月18日,令和3年11月18日,令和3年11月18日,新規,2021-901-0285,,145,家庭料理　シャルレ,0466,0466-81-4062,,,,神奈川県藤沢市亀井野一丁目8番地4,神奈川県藤沢市亀井野１丁目８番地４,,81652,14,14205,亀井野１,,2021/11/18,2021/11/18,,,有限会社シャルレ加藤,,0466-45-5038,,,,,,,,2021-901-0285,新規,飲食店営業,,,,145_神奈川県_藤沢市保健所_食品衛生()_2021年11月_末日_新規、廃止,M,76,,,家庭料理シャルレ0466-81-40628165214205,940f9d8b-36ef-4fb2-aa32-ffcc0b59cb41,有限会社シャルレ加藤,fee2a58e-5eee-4b4f-a6cb-f00064dcdfe4,9576bd41-54bc-494d-b77d-2e89b197de89,2021/11/18,家庭料理　シャルレ,家庭料理シャルレ,有限会社シャルレ加藤
22,麻布十番モンタボー　鵠沼海岸店,神奈川県藤沢市鵠沼海岸二丁目4番8号,,0466-33-1337,11 菓子製造業,株式会社スイートスタイル,03-3516-3105,令和3年11月19日,令和3年11月19日,令和3年11月19日,新規,2021-911-0022,,145,麻布十番モンタボー　鵠沼海岸店,0466,0466-33-1337,,,,神奈川県藤沢市鵠沼海岸二丁目4番8号,神奈川県藤沢市鵠沼海岸２丁目４番８号,,81665,14,14205,鵠沼海岸２,,2021/11/19,2021/11/19,,,株式会社スイートスタイル,,03-3516-3105,,,,,,,,2021-911-0022,新規,菓子製造業,,,,145_神奈川県_藤沢市保健所_食品衛生()_2021年11月_末日_新規、廃止,E,9,,,麻布十番モンタボ鵠沼海岸店0466-33-13378166514205,1ee9b496-8f9a-41ed-aebf-e0ca8775a28d,株式会社スイートスタイル,35bc1684-0cf9-414d-ad2b-85cebd2f71ee,aee390d6-8537-4b98-892e-c9849bd15778,2021/11/19,麻布十番モンタボー　鵠沼海岸店,麻布十番モンタボ鵠沼海岸店,株式会社スイートスタイル
23,MENGA,神奈川県藤沢市片瀬海岸一丁目13番11号,,0466-52-5547,1飲食店営業,有限会社ギャラップ,03-6435-4390,令和3年11月24日,令和3年11月24日,令和3年11月24日,新規,2021-901-0288,,145,MENGA,0466,0466-52-5547,,,,神奈川県藤沢市片瀬海岸一丁目13番11号,神奈川県藤沢市片瀬海岸１丁目１３番１１号,,81642,14,14205,片瀬海岸１,,2021/11/24,2021/11/24,,,有限会社ギャラップ,,03-6435-4390,,,,,,,,2021-901-0288,新規,飲食店営業,,,,145_神奈川県_藤沢市保健所_食品衛生()_2021年11月_末日_新規、廃止,M,76,,,ＭＥＮＧＡ0466-52-55478164214205,76482a1b-113a-43b7-8b1d-330c64a2c6c2,有限会社ギャラップ,06b3bb6e-cc5e-4b54-8dfc-304320686501,0f7ca0ec-e734-4a7e-bd86-46e623142f81,2021/11/24,ＭＥＮＧＡ,ＭＥＮＧＡ,有限会社ギャラップ
24,株式会社やまか生鮮センター,神奈川県藤沢市稲荷520番地,,0466-52-5066,16水産製品製造業,株式会社やまか,0466-52-5640,令和3年11月24日,令和3年11月24日,令和3年11月24日,新規,2021-916-0003,,145,株式会社やまか生鮮センター,0466,0466-52-5066,,,,神奈川県藤沢市稲荷520番地,神奈川県藤沢市稲荷５２０番地,,81624,14,14205,稲荷,,2021/11/24,2021/11/24,,,株式会社やまか,,0466-52-5640,,,,,,,,2021-916-0003,新規,水産製品製造業,,,,145_神奈川県_藤沢市保健所_食品衛生()_2021年11月_末日_新規、廃止,E,9,92,,株式会社やまか生鮮センタ0466-52-50668162414205,05194715-1389-445f-afbd-29da05488825,株式会社やまか,97bd989a-65f0-4838-8848-aff88b94c447,b8e16f49-6650-4d85-b302-7779d3acd5c0,2021/11/24,株式会社やまか生鮮センター,株式会社やまか生鮮センタ,株式会社やまか
25,Mr. chill　ENOSHIMA,神奈川県藤沢市片瀬海岸一丁目12番7号,江ノ島ビュータワー　5F,,1飲食店営業,株式会社Mr.chill,03-6432-5866,令和3年11月25日,令和3年11月25日,令和3年11月25日,新規,2021-901-0293,,145,Mr. chill　ENOSHIMA,0466,,,,,神奈川県藤沢市片瀬海岸一丁目12番7号,神奈川県藤沢市片瀬海岸１丁目１２番７号,江ノ島ビュータワー　5F,81642,14,14205,片瀬海岸１,,2021/11/25,2021/11/25,,,株式会社Mr.chill,,03-6432-5866,,,,,,,,2021-901-0293,新規,飲食店営業,,,,145_神奈川県_藤沢市保健所_食品衛生()_2021年11月_末日_新規、廃止,M,76,,,ＭｒｃｈｉｌｌＥＮＯＳＨＩＭＡ8164214205,da92923f-6fe5-4d0f-98ff-15b8a1aedc83,株式会社Ｍｒ．ｃｈｉｌｌ,eacaeb9c-fc54-4515-af3c-8910828d28b9,dfbb0df9-2733-4673-a11f-4fc3251ae772,2021/11/25,Ｍｒ．　ｃｈｉｌｌ　ＥＮＯＳＨＩＭＡ,ＭｒｃｈｉｌｌＥＮＯＳＨＩＭＡ,株式会社Ｍｒ．ｃｈｉｌｌ
