原　明美,,,,,ya重,福岡県,北九州市小倉北区大畠３丁目5-28大勇ビル104,北九州市小倉北区大畠３丁目５－２８,大勇ビル１０４,,① 飲食店営業,,2021-20794,2021/11/11,2021/11/11,2021/11/11,2027/11/30,,390,ya重,093,,,,,福岡県　北九州市小倉北区大畠３丁目５－２８,福岡県北九州市小倉北区大畠３丁目５－２８,大勇ビル１０４,198692,40,40106,大畠３,,2021/11/11,2021/11/11,2021/11/11,2027/11/30,,原　明美 ,,,,,,,,,2021-20794,,飲食店営業,,,,390_福岡県_北九州市保健所_食品衛生()_2021年11月_末日（仮設除く）,M,76,,,ｙａ重19869240106,44c171b6-13e0-4708-a7de-972fbdc26498,,personal,e002a23b-0e31-4214-86bb-ff13c01a6f07,2021/11/11,ｙａ重,ｙａ重,
野澤晴子,,,,,門司港レトロカレー工房春や,福岡県,北九州市門司区東本町１丁目１－１５,北九州市門司区東本町１丁目１－１５,,093-331-2788,㉕ そうざい製造業,,2021-10097,2021/11/11,2021/11/11,2021/12/1,2027/11/30,,390,門司港レトロカレー工房春や,093,093-331-2788,,,,福岡県　北九州市門司区東本町１丁目１－１５,福岡県北九州市門司区東本町１丁目１－１５,,198341,40,40101,東本町１,,2021/11/11,2021/11/11,2021/12/01,2027/11/30,,野澤晴子 ,,,,,,,,,2021-10097,,そうざい製造業,,,,390_福岡県_北九州市保健所_食品衛生()_2021年11月_末日（仮設除く）,E,9,,,門司港レトロカレ工房春や093-331-278819834140101,a53ee520-53ff-4b9d-94b0-eed7795360b9,,personal,88398100-b0a4-4e3b-9566-6744136e69c8,2021/11/11,門司港レトロカレー工房春や,門司港レトロカレ工房春や,
株式会社　浜長,東まゆみ,北九州市小倉北区中井三丁目３－１,北九州市小倉北区中井３丁目３－１,,株式会社　浜長,福岡県,北九州市小倉北区中井三丁目３－１,北九州市小倉北区中井３丁目３－１,,,⑯ 水産製品製造業,,2021-20793,2021/11/5,2021/11/5,2021/11/5,2027/11/30,,390,株式会社　浜長,093,,,,,福岡県　北九州市小倉北区中井３丁目３－１,福岡県北九州市小倉北区中井３丁目３－１,,198821,40,40106,中井３,,2021/11/05,2021/11/05,2021/11/05,2027/11/30,株式会社　浜長,東まゆみ,,北九州市小倉北区中井３丁目３－１,福岡県北九州市小倉北区中井３丁目３－１,,198821,福岡県,北九州市小倉北区,中井３,2021-20793,,水産製品製造業,,,,390_福岡県_北九州市保健所_食品衛生()_2021年11月_末日（仮設除く）,E,9,92,,株式会社浜長19882140106,b7da768e-cb15-419a-a075-498410555e70,株式会社浜長198821,b8b4e338-47a1-4593-baf4-597b54c7f607,99337a06-ee6d-4a22-85a7-20eb5c90009a,2021/11/05,株式会社浜長,株式会社浜長,株式会社浜長
株式会社ピウ食品,大江尚,北九州市門司区港町３－９,北九州市門司区港町３－９,,サポートセンター門司,福岡県,北九州市門司区松原１丁目３－８,北九州市門司区松原１丁目３－８,,093-382-1117,① 飲食店営業,複合福祉施設（特別養護老人ホーム等）,2021-10098,2021/11/11,2021/11/11,2021/12/1,2028/11/30,,390,サポートセンター門司,093,093-382-1117,,,,福岡県　北九州市門司区松原１丁目３－８,福岡県北九州市門司区松原１丁目３－８,,198361,40,40101,松原１,,2021/11/11,2021/11/11,2021/12/01,2028/11/30,株式会社ピウ食品,大江尚,,北九州市門司区港町３－９,福岡県北九州市門司区港町３－９,,198371,福岡県,北九州市門司区,港町,2021-10098,,飲食店営業, 複合福祉施設（特別養護老人ホーム等）,,,390_福岡県_北九州市保健所_食品衛生()_2021年11月_末日（仮設除く）,M,76,,,サポトセンタ門司093-382-111719836140101,02371cb2-14b7-43d6-9b11-bb991f3c7dc8,株式会社ピウ食品198371,8392af42-70fc-41c4-9125-1f8e08f5772a,97abe9e3-abac-496d-9db0-98e6a8a6aef5,2021/11/11,サポートセンター門司,サポトセンタ門司,株式会社ピウ食品
海心株式会社,古賀善敏,行橋市行橋市宮市町５－２４ハイライフサクセス１Ｆ,行橋市行橋市宮市町５－２４,ハイライフサクセス１Ｆ,ダイレックス門司大里店,福岡県,北九州市門司区不老町一丁目４－１ダイレックス門司大里店内,北九州市門司区不老町１丁目４－１,ダイレックス門司大里店内,,① 飲食店営業,,2021-20801,2021/11/29,2021/11/29,2021/11/29,2027/11/30,,390,ダイレックス門司大里店,093,,,,,福岡県　北九州市門司区不老町１丁目４－１,福岡県北九州市門司区不老町１丁目４－１,ダイレックス門司大里店内,198355,40,40101,不老町１,,2021/11/29,2021/11/29,2021/11/29,2027/11/30,海心株式会社,古賀善敏,,行橋市行橋市宮市町５－２４,福岡県行橋市宮市町５－２４,ハイライフサクセス１Ｆ,201917,福岡県,行橋市,宮市町,2021-20801,,飲食店営業,,,,390_福岡県_北九州市保健所_食品衛生()_2021年11月_末日（仮設除く）,M,76,,,ダイレックス門司大里店19835540101,74fb1261-e8f1-4d80-86f4-bbd7da8a3ec6,海心株式会社201917,20721bda-a457-4463-a20a-fbf9549a900c,baad7781-5424-44f5-9a65-86b475e1c7c8,2021/11/29,ダイレックス門司大里店,ダイレックス門司大里店,海心株式会社
海心株式会社,古賀善敏,行橋市行橋市宮市町５－２４ハイライフサクセス１Ｆ,行橋市行橋市宮市町５－２４,ハイライフサクセス１Ｆ,ダイレックス門司大里店,福岡県,北九州市門司区不老町一丁目４－１ダイレックス門司大里店内,北九州市門司区不老町１丁目４－１,ダイレックス門司大里店内,,④ 魚介類販売業,,2021-20802,2021/11/29,2021/11/29,2021/11/29,2027/11/30,,390,ダイレックス門司大里店,093,,,,,福岡県　北九州市門司区不老町１丁目４－１,福岡県北九州市門司区不老町１丁目４－１,ダイレックス門司大里店内,198355,40,40101,不老町１,,2021/11/29,2021/11/29,2021/11/29,2027/11/30,海心株式会社,古賀善敏,,行橋市行橋市宮市町５－２４,福岡県行橋市宮市町５－２４,ハイライフサクセス１Ｆ,201917,福岡県,行橋市,宮市町,2021-20802,,魚介類販売業,,,,390_福岡県_北九州市保健所_食品衛生()_2021年11月_末日（仮設除く）,I,58,,,ダイレックス門司大里店19835540101,74fb1261-e8f1-4d80-86f4-bbd7da8a3ec6,海心株式会社201917,20721bda-a457-4463-a20a-fbf9549a900c,87b5c1a6-e814-4b3c-82bf-899aad3f4c56,2021/11/29,ダイレックス門司大里店,ダイレックス門司大里店,海心株式会社
小川絵理,,,,,夢叶,福岡県,北九州市門司区大字吉志３２４－６,北九州市門司区大字吉志３２４－６,,093-481-7680,① 飲食店営業,,2021-30080,2021/11/8,2021/11/8,2021/11/8,2027/11/30,,390,夢叶,093,093-481-7680,,,,福岡県　北九州市門司区大字吉志３２４－６,福岡県北九州市門司区吉志３２４－６,,198235,40,40101,吉志３,,2021/11/08,2021/11/08,2021/11/08,2027/11/30,,小川絵理 ,,,,,,,,,2021-30080,,飲食店営業,,,,390_福岡県_北九州市保健所_食品衛生()_2021年11月_末日（仮設除く）,M,76,,,夢叶093-481-768019823540101,fc7a265e-16e0-4832-ab62-12d6de8df055,,personal,bbd42417-49fc-46e5-a537-5f0f4166e03f,2021/11/08,夢叶,夢叶,
松永夫規子,,,,,カラオケスナックはなかがり,福岡県,北九州市八幡西区森下町１１－１０－１０１,北九州市八幡西区森下町１１－１０,１０１,,① 飲食店営業,カラオケスナック,2021-60418,2021/11/24,2021/11/24,2021/11/24,2027/11/30,,390,カラオケスナックはなかがり,093,,,,,福岡県　北九州市八幡西区森下町１１－１０,福岡県北九州市八幡西区森下町１１－１０,１０１,199576,40,40109,森下町,,2021/11/24,2021/11/24,2021/11/24,2027/11/30,,松永夫規子 ,,,,,,,,,2021-60418,,飲食店営業, カラオケスナック,,,390_福岡県_北九州市保健所_食品衛生()_2021年11月_末日（仮設除く）,M,76,,,カラオケスナックはなかがり19957640109,de8c04ba-4312-4d52-bbde-54bd6d905029,,personal,38d0fe4c-a04f-4c49-945b-39f4f0459552,2021/11/24,カラオケスナックはなかがり,カラオケスナックはなかがり,
村上陽子,,,,,かんな,福岡県,北九州市八幡西区陣原五丁目１－１３,北九州市八幡西区陣原５丁目１－１３,,691-5376,① 飲食店営業,カラオケ喫茶,2021-60420,2021/11/12,2021/11/12,2021/12/1,2027/11/30,,390,かんな,093,093-691-5376,,,,福岡県　北九州市八幡西区陣原５丁目１－１３,福岡県北九州市八幡西区陣原５丁目１－１３,,199468,40,40109,陣原５,,2021/11/12,2021/11/12,2021/12/01,2027/11/30,,村上陽子 ,,,,,,,,,2021-60420,,飲食店営業, カラオケ喫茶,,,390_福岡県_北九州市保健所_食品衛生()_2021年11月_末日（仮設除く）,M,76,,,かんな093-691-537619946840109,44dc6c20-75da-4875-ab4c-760f978cfbe4,,personal,a2afb4b5-ae93-46fd-84bc-f1f7c92b75ce,2021/11/12,かんな,かんな,
中川雄介,,,,,博多ソルたこ,福岡県,北九州市若松区竹並１００６ひびきグリーンパーク,北九州市若松区竹並１００６,ひびきグリーンパーク,,① 飲食店営業,自動車営業（キッチンカー）,2021-60419,2021/11/5,2021/11/5,2021/11/5,2026/11/30,,390,博多ソルたこ,093,,,,,福岡県　北九州市若松区竹並１００６,福岡県北九州市若松区竹並１００６,ひびきグリーンパーク,198440,40,40103,竹並,,2021/11/05,2021/11/05,2021/11/05,2026/11/30,,中川雄介 ,,,,,,,,,2021-60419,,飲食店営業, 自動車営業（キッチンカー）,,,390_福岡県_北九州市保健所_食品衛生()_2021年11月_末日（仮設除く）,M,76,,,博多ソルたこ19844040103,d6c79313-406a-494e-878a-e26ca0c0b8be,,personal,90e33e0d-afe7-40b6-92a2-5e768fd9f4e4,2021/11/05,博多ソルたこ,博多ソルたこ,
株式会社　和正,田原正也,北九州市小倉北区紺屋町１－１－６０１,北九州市小倉北区紺屋町１－１,６０１,小倉稚加栄,福岡県,北九州市小倉北区堺町１－４－２６,北九州市小倉北区堺町１－４－２６,,,① 飲食店営業,一般食堂,2021-20769,2021/11/5,2021/11/5,2021/11/5,2027/11/30,,390,小倉稚加栄,093,,,,,福岡県　北九州市小倉北区堺町１－４－２６,福岡県北九州市小倉北区堺町１－４－２６,,198760,40,40106,堺町１,,2021/11/05,2021/11/05,2021/11/05,2027/11/30,株式会社　和正,田原正也,,北九州市小倉北区紺屋町１－１,福岡県北九州市小倉北区紺屋町１－１,６０１,198757,福岡県,北九州市小倉北区,紺屋町,2021-20769,,飲食店営業, 一般食堂,,,390_福岡県_北九州市保健所_食品衛生()_2021年11月_末日（仮設除く）,M,76,,,小倉稚加栄19876040106,eeb43094-93e0-44f4-94c3-5b81c369ba23,株式会社和正198757,17e78ea1-311a-4570-b16f-fc34a672b21f,991c46e3-b2ee-4864-8c9d-c97ca7e0516c,2021/11/05,小倉稚加栄,小倉稚加栄,株式会社和正
株式会社　和正,田原正也,北九州市小倉北区紺屋町１－１－６０１,北九州市小倉北区紺屋町１－１,６０１,小倉稚加栄,福岡県,北九州市小倉北区堺町１－４－２６,北九州市小倉北区堺町１－４－２６,,,④ 魚介類販売業,一般食堂,2021-20770,2021/11/5,2021/11/5,2021/11/5,2027/11/30,,390,小倉稚加栄,093,,,,,福岡県　北九州市小倉北区堺町１－４－２６,福岡県北九州市小倉北区堺町１－４－２６,,198760,40,40106,堺町１,,2021/11/05,2021/11/05,2021/11/05,2027/11/30,株式会社　和正,田原正也,,北九州市小倉北区紺屋町１－１,福岡県北九州市小倉北区紺屋町１－１,６０１,198757,福岡県,北九州市小倉北区,紺屋町,2021-20770,,魚介類販売業, 一般食堂,,,390_福岡県_北九州市保健所_食品衛生()_2021年11月_末日（仮設除く）,I,58,,,小倉稚加栄19876040106,eeb43094-93e0-44f4-94c3-5b81c369ba23,株式会社和正198757,17e78ea1-311a-4570-b16f-fc34a672b21f,53040fb0-84a2-47b7-b672-25319565291f,2021/11/05,小倉稚加栄,小倉稚加栄,株式会社和正
株式会社　和正,田原正也,北九州市小倉北区紺屋町１－１－６０１,北九州市小倉北区紺屋町１－１,６０１,小倉稚加栄,福岡県,北九州市小倉北区堺町１－４－２６,北九州市小倉北区堺町１－４－２６,,,㉕ そうざい製造業,一般食堂,2021-20771,2021/11/5,2021/11/5,2021/11/5,2027/11/30,,390,小倉稚加栄,093,,,,,福岡県　北九州市小倉北区堺町１－４－２６,福岡県北九州市小倉北区堺町１－４－２６,,198760,40,40106,堺町１,,2021/11/05,2021/11/05,2021/11/05,2027/11/30,株式会社　和正,田原正也,,北九州市小倉北区紺屋町１－１,福岡県北九州市小倉北区紺屋町１－１,６０１,198757,福岡県,北九州市小倉北区,紺屋町,2021-20771,,そうざい製造業, 一般食堂,,,390_福岡県_北九州市保健所_食品衛生()_2021年11月_末日（仮設除く）,E,9,,,小倉稚加栄19876040106,eeb43094-93e0-44f4-94c3-5b81c369ba23,株式会社和正198757,17e78ea1-311a-4570-b16f-fc34a672b21f,af55010b-55b4-4047-bea3-da5b1663980b,2021/11/05,小倉稚加栄,小倉稚加栄,株式会社和正
有限会社エンジェルスマイル,藤本美加,北九州市八幡東区白川町８－８,北九州市八幡東区白川町８－８,,ママの餃子,福岡県,北九州市八幡東区白川町８－８,北九州市八幡東区白川町８－８,,093-662-5512,① 飲食店営業,餃子屋,2021-50067,2021/11/29,2021/11/29,2021/12/1,2027/11/30,,390,ママの餃子,093,093-662-5512,,,,福岡県　北九州市八幡東区白川町８－８,福岡県北九州市八幡東区白川町８－８,,199284,40,40108,白川町,,2021/11/29,2021/11/29,2021/12/01,2027/11/30,有限会社エンジェルスマイル,藤本美加,,北九州市八幡東区白川町８－８,福岡県北九州市八幡東区白川町８－８,,199284,福岡県,北九州市八幡東区,白川町,2021-50067,,飲食店営業, 餃子屋,,,390_福岡県_北九州市保健所_食品衛生()_2021年11月_末日（仮設除く）,M,76,,,ママの餃子093-662-551219928440108,8542f43f-8ae8-49bb-87be-f8a900623b46,有限会社エンジェルスマイル199284,8bc755aa-6e87-441d-a1d3-9b84443a526b,0b719698-4f94-4973-8b22-c07b48c187b6,2021/11/29,ママの餃子,ママの餃子,有限会社エンジェルスマイル
魚岸瑛南,,,,,Eden,福岡県,北九州市小倉北区鍛冶町一丁目３－１２角田ビル４階　４０２号,北九州市小倉北区鍛冶町１丁目３－１２,角田ビル４階 ４０２号,,① 飲食店営業,一般食堂　バー,2021-20804,2021/11/8,2021/11/8,2021/11/8,2027/11/30,,390,Eden,093,,,,,福岡県　北九州市小倉北区鍛冶町１丁目３－１２,福岡県北九州市小倉北区鍛冶町１丁目３－１２,角田ビル４階 ４０２号,198693,40,40106,鍛冶町１,,2021/11/08,2021/11/08,2021/11/08,2027/11/30,,魚岸瑛南 ,,,,,,,,,2021-20804,,飲食店営業, 一般食堂　バー,,,390_福岡県_北九州市保健所_食品衛生()_2021年11月_末日（仮設除く）,M,76,,,Ｅｄｅｎ19869340106,6bac3f81-bf5f-42c0-ba29-5c3638e01595,,personal,d676fe4a-edff-46d3-9d1f-015c9dfe36f6,2021/11/08,Ｅｄｅｎ,Ｅｄｅｎ,
坂本みゆき,,,,,ござ候屋,福岡県,北九州市八幡西区相生町４－５,北九州市八幡西区相生町４－５,,093-621-0400,⑪ 菓子製造業,和菓子店,2021-60423,2021/11/10,2021/11/10,2021/12/1,2027/11/30,,390,ござ候屋,093,093-621-0400,,,,福岡県　北九州市八幡西区相生町４－５,福岡県北九州市八幡西区相生町４－５,,199366,40,40109,相生町,,2021/11/10,2021/11/10,2021/12/01,2027/11/30,,坂本みゆき ,,,,,,,,,2021-60423,,菓子製造業, 和菓子店,,,390_福岡県_北九州市保健所_食品衛生()_2021年11月_末日（仮設除く）,E,9,,,ござ候屋093-621-040019936640109,3da4abfa-c647-4984-969f-167996b2a580,,personal,85a70f9d-1d12-4c70-b0b1-27cb9097cf23,2021/11/10,ござ候屋,ござ候屋,
株式会社ＭＡＣ,金剛孝徳,北九州市小倉北区片野四丁目１７－２,北九州市小倉北区片野４丁目１７－２,,特別養護老人ホーム　ひまわり,福岡県,北九州市小倉南区曽根北町４－３１,北九州市小倉南区曽根北町４－３１,,093-474-0100,① 飲食店営業,,2021－30081,2021/11/11,2021/11/11,2021/12/1,2027/11/30,,390,特別養護老人ホーム　ひまわり,093,093-474-0100,,,,福岡県　北九州市小倉南区曽根北町４－３１,福岡県北九州市小倉南区曽根北町４－３１,,199230,40,40107,曽根北町,,2021/11/11,2021/11/11,2021/12/01,2027/11/30,株式会社ＭＡＣ,金剛孝徳,,北九州市小倉北区片野４丁目１７－２,福岡県北九州市小倉北区片野４丁目１７－２,,198698,福岡県,北九州市小倉北区,片野４,2021－30081,,飲食店営業,,,,390_福岡県_北九州市保健所_食品衛生()_2021年11月_末日（仮設除く）,M,76,,,特別養護老人ホムひまわり093-474-010019923040107,501abf73-193f-4e63-ab5d-1d4c23a9e9ee,株式会社ＭＡＣ198698,28f889e0-e71e-4144-ad2a-3caaae151f1b,dac6dcda-834a-415a-ba28-14cd932b9d16,2021/11/11,特別養護老人ホーム　ひまわり,特別養護老人ホムひまわり,株式会社ＭＡＣ
合資会社妹尾商店,妹尾昌紀,北九州市門司区栄町５－２０,北九州市門司区栄町５－２０,,菓匠せのお,福岡県,北九州市門司区栄町１０－１,北九州市門司区栄町１０－１,,093-321-2029,⑪ 菓子製造業,,2021-10099,2021/11/11,2021/11/11,2021/12/1,2027/11/30,,390,菓匠せのお,093,093-321-2029,,,,福岡県　北九州市門司区栄町１０－１,福岡県北九州市門司区栄町１０－１,,198263,40,40101,栄町,,2021/11/11,2021/11/11,2021/12/01,2027/11/30,合資会社妹尾商店,妹尾昌紀,,北九州市門司区栄町５－２０,福岡県北九州市門司区栄町５－２０,,198263,福岡県,北九州市門司区,栄町,2021-10099,,菓子製造業,,,,390_福岡県_北九州市保健所_食品衛生()_2021年11月_末日（仮設除く）,E,9,,,菓匠せのお093-321-202919826340101,2c2d2462-c89c-4cfc-b663-44832c8393a0,合資会社妹尾商店198263,f8740b40-2049-4763-9b4c-a417ab4f98a8,0c62c295-501a-483a-95ef-84e668644b6f,2021/11/11,菓匠せのお,菓匠せのお,合資会社妹尾商店
佐藤由美,,,,,おむすびYO-KA-YO,福岡県,北九州市八幡西区鉄竜一丁目１－４９－１４０８,北九州市八幡西区鉄竜１丁目１－４９,１４０８,,① 飲食店営業,自動車営業,2021-60421,2021/11/9,2021/11/9,2021/11/9,2026/11/30,,390,おむすびYO-KA-YO,093,,,,,福岡県　北九州市八幡西区鉄竜１丁目１－４９,福岡県北九州市八幡西区鉄竜１丁目１－４９,１４０８,199497,40,40109,鉄竜１,,2021/11/09,2021/11/09,2021/11/09,2026/11/30,,佐藤由美 ,,,,,,,,,2021-60421,,飲食店営業, 自動車営業,,,390_福岡県_北九州市保健所_食品衛生()_2021年11月_末日（仮設除く）,M,76,,,おむすびＹＯＫＡＹＯ19949740109,a40fd9c9-6dfc-4512-b1fc-43a252e8a2b2,,personal,701e0c39-a493-4ac6-93e1-603360f60f54,2021/11/09,おむすびＹＯ－ＫＡ－ＹＯ,おむすびＹＯＫＡＹＯ,
濱中篤史,,,,,BlueOcean,福岡県,北九州市八幡東区西本町二丁目２－１,北九州市八幡東区西本町２丁目２－１,,,㉕ そうざい製造業,,2021ｰ60425,2021/11/17,2021/11/17,2021/11/17,2027/11/30,,390,BlueOcean,093,,,,,福岡県　北九州市八幡東区西本町２丁目２－１,福岡県北九州市八幡東区西本町２丁目２－１,,199309,40,40108,西本町２,,2021/11/17,2021/11/17,2021/11/17,2027/11/30,,濱中篤史 ,,,,,,,,,2021ｰ60425,,そうざい製造業,,,,390_福岡県_北九州市保健所_食品衛生()_2021年11月_末日（仮設除く）,E,9,,,ＢｌｕｅＯｃｅａｎ19930940108,585a47f9-5d89-4d72-b9dc-20dafbbf525f,,personal,e1d84020-36c7-424c-98ca-d19065883a41,2021/11/17,ＢｌｕｅＯｃｅａｎ,ＢｌｕｅＯｃｅａｎ,
三原トモヱ,,,,,ロード,福岡県,北九州市八幡東区中央二丁目７－５,北九州市八幡東区中央２丁目７－５,,093-672-7256,① 飲食店営業,,2021-50068,2021/11/29,2021/11/29,2021/12/1,2027/11/30,,390,ロード,093,093-672-7256,,,,福岡県　北九州市八幡東区中央２丁目７－５,福岡県北九州市八幡東区中央２丁目７－５,,199297,40,40108,中央２,,2021/11/29,2021/11/29,2021/12/01,2027/11/30,,三原トモヱ ,,,,,,,,,2021-50068,,飲食店営業,,,,390_福岡県_北九州市保健所_食品衛生()_2021年11月_末日（仮設除く）,M,76,,,ロド093-672-725619929740108,180f6d3e-8685-498e-83e2-0656eef98aae,,personal,4a60d0f5-96e6-48a8-9450-ce8e4b2b2003,2021/11/29,ロード,ロド,
吉井広美,,,,,ショコラ,福岡県,北九州市若松区中川町１－３１,北九州市若松区中川町１－３１,,093-751-1557,① 飲食店営業,,2021-40094,2021/11/9,2021/11/9,2021/11/9,2027/11/30,,390,ショコラ,093,093-751-1557,,,,福岡県　北九州市若松区中川町１－３１,福岡県北九州市若松区中川町１－３１,,198446,40,40103,中川町,,2021/11/09,2021/11/09,2021/11/09,2027/11/30,,吉井広美 ,,,,,,,,,2021-40094,,飲食店営業,,,,390_福岡県_北九州市保健所_食品衛生()_2021年11月_末日（仮設除く）,M,76,,,ショコラ093-751-155719844640103,0e1a044e-a752-4ccf-a48f-37361cbcc061,,personal,2daf5172-d638-4c50-b2bf-beb4af0cbd8a,2021/11/09,ショコラ,ショコラ,
もやいネット北九州株式会社,権頭秀作,北九州市八幡西区鉄王二丁目２－３６,北九州市八幡西区鉄王２丁目２－３６,,MOYAIステーション９６Cafe,福岡県,北九州市八幡西区黒崎二丁目８－７長島ビル１F,北九州市八幡西区黒崎２丁目８－７,長島ビル１F,,① 飲食店営業,カフェ,2021-60426,2021/11/10,2021/11/10,2021/12/1,2027/11/30,,390,MOYAIステーション９６Cafe,093,,,,,福岡県　北九州市八幡西区黒崎２丁目８－７,福岡県北九州市八幡西区黒崎２丁目８－７,長島ビル１F,199430,40,40109,黒崎２,,2021/11/10,2021/11/10,2021/12/01,2027/11/30,もやいネット北九州株式会社,権頭秀作,,北九州市八幡西区鉄王２丁目２－３６,福岡県北九州市八幡西区鉄王２丁目２－３６,,199496,福岡県,北九州市八幡西区,鉄王２,2021-60426,,飲食店営業, カフェ,,,390_福岡県_北九州市保健所_食品衛生()_2021年11月_末日（仮設除く）,M,76,,,ＭＯＹＡＩステション９６Ｃａｆｅ19943040109,2291237c-1a25-492b-92a6-9f57006f08b2,もやいネット北九州株式会社199496,9e23416f-8f53-4f45-a78c-5190b5034d23,73e78901-4002-4fa4-95d8-e87eee0334bb,2021/11/10,ＭＯＹＡＩステーション９６Ｃａｆｅ,ＭＯＹＡＩステション９６Ｃａｆｅ,もやいネット北九州株式会社
もやいネット北九州株式会社,権頭秀作,北九州市八幡西区鉄王二丁目２－３６,北九州市八幡西区鉄王２丁目２－３６,,銀杏庵穴生倶楽部,福岡県,北九州市八幡西区鉄王二丁目２－３６,北九州市八幡西区鉄王２丁目２－３６,,,① 飲食店営業,給食施設,2021-60437,2021/11/19,2021/11/19,2021/12/1,2028/11/30,,390,銀杏庵穴生倶楽部,093,,,,,福岡県　北九州市八幡西区鉄王２丁目２－３６,福岡県北九州市八幡西区鉄王２丁目２－３６,,199496,40,40109,鉄王２,,2021/11/19,2021/11/19,2021/12/01,2028/11/30,もやいネット北九州株式会社,権頭秀作,,北九州市八幡西区鉄王２丁目２－３６,福岡県北九州市八幡西区鉄王２丁目２－３６,,199496,福岡県,北九州市八幡西区,鉄王２,2021-60437,,飲食店営業, 給食施設,,,390_福岡県_北九州市保健所_食品衛生()_2021年11月_末日（仮設除く）,M,76,,,銀杏庵穴生倶楽部19949640109,5903f098-f42e-4e2c-9bdf-de3e799c93d1,もやいネット北九州株式会社199496,9e23416f-8f53-4f45-a78c-5190b5034d23,d765bf55-4268-4163-8c6f-0985466ef04f,2021/11/19,銀杏庵穴生倶楽部,銀杏庵穴生倶楽部,もやいネット北九州株式会社
竹村美保,,,,,ローゼ,福岡県,北九州市八幡西区熊手一丁目１－３７　麻生ビル５F,北九州市八幡西区熊手１丁目１－３７,麻生ビル５F,093-642-7830,① 飲食店営業,スナック,2021-60427,2021/11/10,2021/11/10,2021/11/10,2027/11/30,,390,ローゼ,093,093-642-7830,,,,福岡県　北九州市八幡西区熊手１丁目１－３７,福岡県北九州市八幡西区熊手１丁目１－３７,麻生ビル５F,199424,40,40109,熊手１,,2021/11/10,2021/11/10,2021/11/10,2027/11/30,,竹村美保 ,,,,,,,,,2021-60427,,飲食店営業, スナック,,,390_福岡県_北九州市保健所_食品衛生()_2021年11月_末日（仮設除く）,M,76,,,ロゼ093-642-783019942440109,f1403060-d3e5-415f-8baf-c20bfd47bf7d,,personal,05eca61d-bb7c-419e-8285-031eee89290e,2021/11/10,ローゼ,ロゼ,
