,,,,,,,,,,,,,,,,,,,,,,,,,,,,,,,,,,,,,,,,,,,,,,,,,,,,,,,,,,,,,,,,,,,,,
,n処理終了,,,,,,,,,,,,n10_company_name_maintenance,完了,,,,,,,,,,,,,,,,,,,,,,,,,,,,,,,,,,,,,,,,,,,,,,,,,,,,,,,
,業種,業態,確認番号,施設名,施設-住所0,施設-住所1,施設-マンション名,施設-電話番号1,申請者1,許可年月日,開業年月日,許可期間開始日,ここまで,,,,,,,,,,,,,,,,,,,,,,,,,,,,,,,,,,,,,,,,,,,,,,,,,,,,,,,,
施設番号,業種,種目,許可番号,営業所名称,営業所所在地,,,営業所電話番号,申請者名,許可年月日,初回許可年月日,初回開始年月日,,管轄保健所,名称,市外局番,電話番号,施設の郵便番号,緯度,経度,施設の住所（元住所）,施設の住所（整備）,施設マンション名,施設-住所コード,施設-都道府県,施設-郡・政令市・市区町村名,施設-大字名・字名,申請年月日,開業年月日,許可年月日,許可期間開始日,許可期間終了日,申請法人,申請者氏名(個人名),申請者（開設者）の電話番号,申請者の住所（元住所）,申請者の住所（整備）,申請マンション名,申請-住所コード,申請-都道府県,申請-郡・政令市・市区町村名,申請-大字名・字名,確認番号,申請区分,業種,業態,その他,法人番号,シート名,産業分類大,産業分類中,産業分類小,産業分類詳細,facility_idを識別するための文字列,店舗コード,company_idを識別するための文字列,法人コード,ライセンスコード,検索用日付,整備名称,整備名称2,整備申請法人,チェーン店名,重複確認,店舗業種(大),店舗業種(中),店舗業種(小),店舗業種(詳細),施設名のフリガナ
54143,漬物製造業,漬物製造業,54143-02-2901,漬物　ホシナ,白石市斉川字高畑前２９－５,白石市斉川字高畑前２９－５,,,保科　よう子,R 4. 6. 3,R 4. 6. 3,R 4. 6.21,,仙南保健所,漬物　ホシナ,0224,,,,,白石市斉川字高畑前２９－５,宮城県白石市斉川字高畑前２９－５,,39447,宮城県,白石市,,,2022/06/03,2022/06/03,2022/06/21,,,,,,,,,,,,54143-02-2901,,漬物製造業, 漬物製造業,,,050-056_宮城県_宮城県一括_食品衛生()_2022年06月_末日,製造業,食料品製造業,,,,,,,,,漬物　ホシナ,漬物ホシナ,,,1,,,,,
57311,魚介類販売業,魚介類販売業,57311-01-0401,小野鮮魚ストアー,白石市白川津田内堀７８,白石市白川津田内堀７８,,0224-27-2028,小野　和雄,R 4. 6. 3,R 4. 6. 3,R 4. 6.21,,仙南保健所,小野鮮魚ストアー,0224,0224-27-2028,,,,白石市白川津田内堀７８,宮城県白石市白川津田内堀７８,,39464,宮城県,白石市,白川津田,,2022/06/03,2022/06/03,2022/06/21,,,,,,,,,,,,57311-01-0401,,魚介類販売業, 魚介類販売業,,,050-056_宮城県_宮城県一括_食品衛生()_2022年06月_末日,卸売業，小売業,飲食料品小売業,,,,,,,,,小野鮮魚ストアー,小野鮮魚ストア,,,1,,,,,
57654,清涼飲料水製造業,清涼飲料水製造業,57654-01-1401,丸治農園,刈田郡蔵王町宮字小山田９７,刈田郡蔵王町宮字小山田９７,,0224-32-3254,佐藤　宏一,R 4. 6. 1,R 4. 6. 1,R 4. 6.21,,仙南保健所,丸治農園,0224,0224-32-3254,,,,刈田郡蔵王町宮字小山田９７,宮城県刈田郡蔵王町宮字小山田９７,,43674,宮城県,刈田郡蔵王町,宮,,2022/06/01,2022/06/01,2022/06/21,,,,,,,,,,,,57654-01-1401,,清涼飲料水製造業, 清涼飲料水製造業,,,050-056_宮城県_宮城県一括_食品衛生()_2022年06月_末日,製造業,飲料・たばこ・飼料製造業,,,,,,,,,丸治農園,丸治農園,,,1,,,,,
57683,飲食店営業,飲食店営業,57683-01-0101,角屋,角田市角田字田町７５,角田市角田字田町７５,,0224-63-2080,東　雪子,R 4. 6. 3,R 4. 6. 3,R 4. 6.21,,仙南保健所,角屋,0224,0224-63-2080,,,,角田市角田字田町７５,宮城県角田市角田字田町７５,,39644,宮城県,角田市,角田,,2022/06/03,2022/06/03,2022/06/21,,,,,,,,,,,,57683-01-0101,,飲食店営業, 飲食店営業,,,050-056_宮城県_宮城県一括_食品衛生()_2022年06月_末日,宿泊業，飲食サービス業,飲食店,,,,,,,,,角屋,角屋,,,1,,,,,
57709,漬物製造業,漬物製造業,57709-01-2901,あずだす,伊具郡丸森町大内山屋敷131,伊具郡丸森町大内山屋敷１３１,,0224-79-2549,佐藤けい子,R 4. 6. 3,R 4. 6. 3,R 4. 6.21,,仙南保健所,あずだす,0224,0224-79-2549,,,,伊具郡丸森町大内山屋敷１３１,宮城県伊具郡丸森町大内山屋敷１３１,,43777,宮城県,伊具郡丸森町,大内,,2022/06/03,2022/06/03,2022/06/21,,,,,,,,,,,,57709-01-2901,,漬物製造業, 漬物製造業,,,050-056_宮城県_宮城県一括_食品衛生()_2022年06月_末日,製造業,食料品製造業,,,,,,,,,あずだす,あずだす,,,1,,,,,
57885,食肉処理業,食肉処理業,57885-01-0901,はらから福祉会　みずきの里丸森,伊具郡丸森町大内横手１９,伊具郡丸森町大内横手１９,,0224-79-2141,社会福祉法人　はらから福祉会,R 4. 6.13,R 4. 6.13,R 4. 6.13,,仙南保健所,はらから福祉会　みずきの里丸森,0224,0224-79-2141,,,,伊具郡丸森町大内横手１９,宮城県伊具郡丸森町大内横手１９,,43777,宮城県,伊具郡丸森町,大内,,2022/06/13,2022/06/13,2022/06/13,,社会福祉法人　はらから福祉会,,,,,,,,,,57885-01-0901,,食肉販売業, 食肉処理業,,,050-056_宮城県_宮城県一括_食品衛生()_2022年06月_末日,卸売業，小売業,飲食料品小売業,食肉小売業,,,,,,,,はらから福祉会　みずきの里丸森,はらから福祉会みずきの里丸森,社会福祉法人はらから福祉会,,1,,,,,
57905,複合型冷凍食品製造業,複合型冷凍食品製造業,57905-01-2801,株式会社ニチレイフーズ白石工場,白石市白鳥１丁目１６番地の２,白石市白鳥１丁目１６番地の２,,0224-25-7181,株式会社ニチレイフーズ,R 4. 6.10,R 4. 6.10,R 4. 6.10,,仙南保健所,株式会社ニチレイフーズ白石工場,0224,0224-25-7181,,,,白石市白鳥１丁目１６番地の２,宮城県白石市白鳥１丁目１６番地ノ２,,39512,宮城県,白石市,白鳥１,,2022/06/10,2022/06/10,2022/06/10,,株式会社ニチレイフーズ,,,,,,,,,,57905-01-2801,,冷凍食品製造業, 複合型冷凍食品製造業,,,050-056_宮城県_宮城県一括_食品衛生()_2022年06月_末日,製造業,食料品製造業,,,,,,,,,株式会社ニチレイフーズ白石工場,株式会社ニチレイフズ白石工場,株式会社ニチレイフーズ,,1,,,,,
57933,飲食店営業,飲食店営業,57933-01-0101,ホルモンきょうちゃん,柴田郡柴田町船岡中央三丁目８－３７,柴田郡柴田町船岡中央３丁目８－３７,,,菅野　恭平,R 4. 6.10,R 4. 6.10,R 4. 6.10,,仙南保健所,ホルモンきょうちゃん,0224,,,,,柴田郡柴田町船岡中央３丁目８－３７,宮城県柴田郡柴田町船岡中央３丁目８－３７,,43717,宮城県,柴田郡柴田町,船岡中央３,,2022/06/10,2022/06/10,2022/06/10,,,,,,,,,,,,57933-01-0101,,飲食店営業, 飲食店営業,,,050-056_宮城県_宮城県一括_食品衛生()_2022年06月_末日,宿泊業，飲食サービス業,飲食店,,,,,,,,,ホルモンきょうちゃん,ホルモンきょうちゃん,,,1,,,,,
58064,菓子製造業,菓子製造業,58064-01-1101,ICTソリューションズ株式会社,柴田郡村田町大字村田字反町１６　E-２,柴田郡村田町大字村田字反町１６,E－２,,ICTソリューションズ株式会社,R 4. 6.21,R 4. 6.21,R 4. 6.21,,仙南保健所,ICTソリューションズ株式会社,0224,,,,,柴田郡村田町大字村田字反町１６,宮城県柴田郡村田町村田字反町１６,E－２,43773,宮城県,柴田郡村田町,村田,,2022/06/21,2022/06/21,2022/06/21,,ICTソリューションズ株式会社,,,,,,,,,,58064-01-1101,,菓子製造業, 菓子製造業,,,050-056_宮城県_宮城県一括_食品衛生()_2022年06月_末日,製造業,食料品製造業,,,,,,,,,ＩＣＴソリューションズ株式会社,ＩＣＴソリュションズ株式会社,ＩＣＴソリューションズ株式会社,,2,,,,,
58064,食品の小分け業,食品の小分け業,58064-02-3101,ICTソリューションズ株式会社,柴田郡村田町大字村田字反町１６　E-２,柴田郡村田町大字村田字反町１６,E－２,,ICTソリューションズ株式会社,R 4. 6.21,R 4. 6.21,R 4. 6.21,,仙南保健所,ICTソリューションズ株式会社,0224,,,,,柴田郡村田町大字村田字反町１６,宮城県柴田郡村田町村田字反町１６,E－２,43773,宮城県,柴田郡村田町,村田,,2022/06/21,2022/06/21,2022/06/21,,ICTソリューションズ株式会社,,,,,,,,,,58064-02-3101,,食品の小分け業, 食品の小分け業,,,050-056_宮城県_宮城県一括_食品衛生()_2022年06月_末日,卸売業，小売業,飲食料品小売業,食料・飲料卸売業,その他の食料・飲料卸売業,,,,,,,ＩＣＴソリューションズ株式会社,ＩＣＴソリュションズ株式会社,ＩＣＴソリューションズ株式会社,,2,,,,,
58076,飲食店営業,飲食店営業,58076-01-0101,山形手打ち十割そば　一,柴田郡川崎町前川字沼ノ平山１－２６　創生の森内,柴田郡川崎町前川字沼ノ平山１－２６,創生の森内,0224-87-8405,後藤　寛二,R 4. 6.21,R 4. 6.21,R 4. 6.21,,仙南保健所,山形手打ち十割そば　一,0224,0224-87-8405,,,,柴田郡川崎町前川字沼ノ平山１－２６,宮城県柴田郡川崎町前川字沼ノ平山１－２６,創生の森内,43690,宮城県,柴田郡川崎町,前川,,2022/06/21,2022/06/21,2022/06/21,,,,,,,,,,,,58076-01-0101,,飲食店営業, 飲食店営業,,,050-056_宮城県_宮城県一括_食品衛生()_2022年06月_末日,宿泊業，飲食サービス業,飲食店,,,,,,,,,山形手打ち十割そば　一,山形手打ち十割そば一,,,1,,,,,
58101,飲食店営業,飲食店営業,58101-01-0101,一軒茶屋,柴田郡川崎町青根温泉８－１０,柴田郡川崎町青根温泉８－１０,,,株式会社 A-one Unity,R 4. 6.24,R 4. 6.24,R 4. 6.24,,仙南保健所,一軒茶屋,0224,,,,,柴田郡川崎町青根温泉８－１０,宮城県柴田郡川崎町青根温泉８－１０,,43693,宮城県,柴田郡川崎町,青根温泉,,2022/06/24,2022/06/24,2022/06/24,,株式会社 A-one Unity,,,,,,,,,,58101-01-0101,,飲食店営業, 飲食店営業,,,050-056_宮城県_宮城県一括_食品衛生()_2022年06月_末日,宿泊業，飲食サービス業,飲食店,,,,,,,,,一軒茶屋,一軒茶屋,株式会社Ａ－ｏｎｅ　Ｕｎｉｔｙ,,1,,,,,
58142,飲食店営業,飲食店営業,58142-01-0101,grill＆Bar gransla.S,柴田郡柴田町船岡中央３丁目８－１,柴田郡柴田町船岡中央３丁目８－１,,,庄司　祐介,R 4. 6.29,R 4. 6.29,R 4. 6.29,,仙南保健所,grill＆Bar gransla.S,0224,,,,,柴田郡柴田町船岡中央３丁目８－１,宮城県柴田郡柴田町船岡中央３丁目８－１,,43717,宮城県,柴田郡柴田町,船岡中央３,,2022/06/29,2022/06/29,2022/06/29,,,,,,,,,,,,58142-01-0101,,飲食店営業, 飲食店営業,,,050-056_宮城県_宮城県一括_食品衛生()_2022年06月_末日,宿泊業，飲食サービス業,飲食店,,,,,,,,,ｇｒｉｌｌ＆Ｂａｒ　ｇｒａｎｓｌａ．Ｓ,ｇｒｉｌｌＢａｒｇｒａｎｓｌａＳ,,,1,,,,,
51281,漬物製造業,漬物製造業,51281-02-2901,三波食品株式会社,塩竈市新浜町一丁目４３番１号,塩竈市新浜町１丁目４３番１号,,022-366-2151,三波食品株式会社,R 4. 6. 7,R 4. 6. 7,R 4. 6.11,,塩釜保健所,三波食品株式会社,022,022-366-2151,,,,塩竈市新浜町１丁目４３番１号,宮城県塩釜市新浜町１丁目４３番１号,,38972,宮城県,塩竈市,新浜町１,,2022/06/07,2022/06/07,2022/06/11,,三波食品株式会社,,,,,,,,,,51281-02-2901,,漬物製造業, 漬物製造業,,,050-056_宮城県_宮城県一括_食品衛生()_2022年06月_末日,製造業,食料品製造業,,,,,,,,,三波食品株式会社,三波食品株式会社,三波食品株式会社,,1,,,,,
57727,飲食店営業,簡易,57727-01-0105,Khara,多賀城市桜木1丁目１－５６　アメニティハウス　１１０,多賀城市桜木１丁目１－５６,アメニティハウス １１０,,佐々木　加代,R 4. 6. 3,R 4. 6. 3,R 4. 6. 3,,塩釜保健所,Khara,022,,,,,多賀城市桜木１丁目１－５６,宮城県多賀城市桜木１丁目１－５６,アメニティハウス １１０,39686,宮城県,多賀城市,桜木１,,2022/06/03,2022/06/03,2022/06/03,,,,,,,,,,,,57727-01-0105,,飲食店営業, 簡易,,,050-056_宮城県_宮城県一括_食品衛生()_2022年06月_末日,宿泊業，飲食サービス業,飲食店,,,,,,,,,Ｋｈａｒａ,Ｋｈａｒａ,,,1,,,,,
57748,飲食店営業,飲食店営業,57748-01-0101,株式会社菓匠三全,宮城郡松島町松島字町内５８,宮城郡松島町松島字町内５８,,022-353-2501,株式会社菓匠三全,R 4. 6. 3,R 4. 6. 3,R 4. 6. 3,,塩釜保健所,株式会社菓匠三全,022,022-353-2501,,,,宮城郡松島町松島字町内５８,宮城県宮城郡松島町松島字町内５８,,43862,宮城県,宮城郡松島町,松島,,2022/06/03,2022/06/03,2022/06/03,,株式会社菓匠三全,,,,,,,,,,57748-01-0101,,飲食店営業, 飲食店営業,,,050-056_宮城県_宮城県一括_食品衛生()_2022年06月_末日,宿泊業，飲食サービス業,飲食店,,,,,,,,,株式会社菓匠三全,株式会社菓匠三全,株式会社菓匠三全,,2,,,,,
57748,菓子製造業,菓子製造業,57748-02-1101,株式会社菓匠三全,宮城郡松島町松島字町内５８,宮城郡松島町松島字町内５８,,022-353-2501,株式会社菓匠三全,R 4. 6. 8,R 4. 6. 8,R 4. 6. 8,,塩釜保健所,株式会社菓匠三全,022,022-353-2501,,,,宮城郡松島町松島字町内５８,宮城県宮城郡松島町松島字町内５８,,43862,宮城県,宮城郡松島町,松島,,2022/06/08,2022/06/08,2022/06/08,,株式会社菓匠三全,,,,,,,,,,57748-02-1101,,菓子製造業, 菓子製造業,,,050-056_宮城県_宮城県一括_食品衛生()_2022年06月_末日,製造業,食料品製造業,,,,,,,,,株式会社菓匠三全,株式会社菓匠三全,株式会社菓匠三全,,2,,,,,
57754,飲食店営業,飲食店営業,57754-01-0101,株式会社阿部蒲鉾店,宮城郡松島町松島字町内５８,宮城郡松島町松島字町内５８,,022-353-4277,株式会社阿部蒲鉾店,R 4. 6. 3,R 4. 6. 3,R 4. 6. 3,,塩釜保健所,株式会社阿部蒲鉾店,022,022-353-4277,,,,宮城郡松島町松島字町内５８,宮城県宮城郡松島町松島字町内５８,,43862,宮城県,宮城郡松島町,松島,,2022/06/03,2022/06/03,2022/06/03,,株式会社阿部蒲鉾店,,,,,,,,,,57754-01-0101,,飲食店営業, 飲食店営業,,,050-056_宮城県_宮城県一括_食品衛生()_2022年06月_末日,宿泊業，飲食サービス業,飲食店,,,,,,,,,株式会社阿部蒲鉾店,株式会社阿部蒲鉾店,株式会社阿部蒲鉾店,,1,,,,,
57756,菓子製造業,菓子製造業,57756-01-1101,ぱんやあいざわ,宮城郡松島町松島字町内１５７－２,宮城郡松島町松島字町内１５７－２,,022-354-0233,相澤　隆志,R 4. 6. 3,R 4. 6. 3,R 4. 6. 3,,塩釜保健所,ぱんやあいざわ,022,022-354-0233,,,,宮城郡松島町松島字町内１５７－２,宮城県宮城郡松島町松島字町内１５７－２,,43862,宮城県,宮城郡松島町,松島,,2022/06/03,2022/06/03,2022/06/03,,,,,,,,,,,,57756-01-1101,,菓子製造業, 菓子製造業,,,050-056_宮城県_宮城県一括_食品衛生()_2022年06月_末日,製造業,食料品製造業,,,,,,,,,ぱんやあいざわ,ぱんやあいざわ,,,1,,,,,
57761,飲食店営業,飲食店営業,57761-01-0101,松島プチホテルびすとろアバロン,宮城郡松島町松島字三十刈２６－２１,宮城郡松島町松島字三十刈２６－２１,,022-354-5777,有限会社アバロン,R 4. 6. 3,R 4. 6. 3,R 4. 6. 3,,塩釜保健所,松島プチホテルびすとろアバロン,022,022-354-5777,,,,宮城郡松島町松島字三十刈２６－２１,宮城県宮城郡松島町松島字三十刈２６－２１,,43862,宮城県,宮城郡松島町,松島,,2022/06/03,2022/06/03,2022/06/03,,有限会社アバロン,,,,,,,,,,57761-01-0101,,飲食店営業, 飲食店営業,,,050-056_宮城県_宮城県一括_食品衛生()_2022年06月_末日,宿泊業，飲食サービス業,飲食店,,,,,,,,,松島プチホテルびすとろアバロン,松島プチホテルびすとろアバロン,有限会社アバロン,,1,,,,,
57764,菓子製造業,菓子製造業,57764-01-1101,小松館　好風亭,宮城郡松島町松島字仙随３５－２,宮城郡松島町松島字仙随３５－２,,022-354-5065,有限会社小松館,R 4. 6. 7,R 4. 6. 7,R 4. 6.11,,塩釜保健所,小松館　好風亭,022,022-354-5065,,,,宮城郡松島町松島字仙随３５－２,宮城県宮城郡松島町松島字仙随３５－２,,43862,宮城県,宮城郡松島町,松島,,2022/06/07,2022/06/07,2022/06/11,,有限会社小松館,,,,,,,,,,57764-01-1101,,菓子製造業, 菓子製造業,,,050-056_宮城県_宮城県一括_食品衛生()_2022年06月_末日,製造業,食料品製造業,,,,,,,,,小松館　好風亭,小松館好風亭,有限会社小松館,,2,,,,,
57764,魚介類販売業,魚介類販売業,57764-02-0401,小松館　好風亭,宮城郡松島町松島字仙随３５－２,宮城郡松島町松島字仙随３５－２,,022-354-5065,有限会社小松館,R 4. 6. 7,R 4. 6. 7,R 4. 6.11,,塩釜保健所,小松館　好風亭,022,022-354-5065,,,,宮城郡松島町松島字仙随３５－２,宮城県宮城郡松島町松島字仙随３５－２,,43862,宮城県,宮城郡松島町,松島,,2022/06/07,2022/06/07,2022/06/11,,有限会社小松館,,,,,,,,,,57764-02-0401,,魚介類販売業, 魚介類販売業,,,050-056_宮城県_宮城県一括_食品衛生()_2022年06月_末日,卸売業，小売業,飲食料品小売業,,,,,,,,,小松館　好風亭,小松館好風亭,有限会社小松館,,2,,,,,
57775,飲食店営業,飲食店営業,57775-01-0101,うちみそばや,宮城郡松島町松島字仙随１０,宮城郡松島町松島字仙随１０,,022-354-2363,内海　秀一,R 4. 6.11,R 4. 6.11,R 4. 6.11,,塩釜保健所,うちみそばや,022,022-354-2363,,,,宮城郡松島町松島字仙随１０,宮城県宮城郡松島町松島字仙随１０,,43862,宮城県,宮城郡松島町,松島,,2022/06/11,2022/06/11,2022/06/11,,,,,,,,,,,,57775-01-0101,,飲食店営業, 飲食店営業,,,050-056_宮城県_宮城県一括_食品衛生()_2022年06月_末日,宿泊業，飲食サービス業,飲食店,,,,,,,,,うちみそばや,うちみそばや,,,1,,,,,
57805,水産製品製造業,水産製品製造業,57805-01-1601,株式会社仙台大門　塩釜工場,塩竈市新浜町２－８－２２,塩竈市新浜町２－８－２２,,022-364-5288,株式会社仙台大門,R 4. 6. 3,R 4. 6. 3,R 4. 6.11,,塩釜保健所,株式会社仙台大門　塩釜工場,022,022-364-5288,,,,塩竈市新浜町２－８－２２,宮城県塩釜市新浜町２－８－２２,,38973,宮城県,塩竈市,新浜町２,,2022/06/03,2022/06/03,2022/06/11,,株式会社仙台大門,,,,,,,,,,57805-01-1601,,水産製品製造業, 水産製品製造業,,,050-056_宮城県_宮城県一括_食品衛生()_2022年06月_末日,製造業,食料品製造業,水産食料品製造業,,,,,,,,株式会社仙台大門　塩釜工場,株式会社仙台大門塩釜工場,株式会社仙台大門,,1,,,,,
57829,水産製品製造業,魚肉練り製品,57829-01-1605,株式会社松島蒲鉾本舗　多賀城工場,多賀城市八幡一本柳３番５,多賀城市八幡一本柳３番５,,022-355-9471,株式会社松島蒲鉾本舗,R 4. 6. 6,R 4. 6. 6,R 4. 6. 6,,塩釜保健所,株式会社松島蒲鉾本舗　多賀城工場,022,022-355-9471,,,,多賀城市八幡一本柳３番５,宮城県多賀城市八幡一本柳３番５,,39728,宮城県,多賀城市,八幡,,2022/06/06,2022/06/06,2022/06/06,,株式会社松島蒲鉾本舗,,,,,,,,,,57829-01-1605,,水産製品製造業, 魚肉練り製品,,,050-056_宮城県_宮城県一括_食品衛生()_2022年06月_末日,製造業,食料品製造業,水産食料品製造業,,,,,,,,株式会社松島蒲鉾本舗　多賀城工場,株式会社松島蒲鉾本舗多賀城工場,株式会社松島蒲鉾本舗,,1,,,,,
57831,飲食店営業,飲食店営業,57831-01-0101,カラオケプラザ時遊館多賀城店,多賀城市八幡１－３－４８,多賀城市八幡１－３－４８,,022-361-3211,株式会社アトム,R 4. 6. 6,R 4. 6. 6,R 4. 6.11,,塩釜保健所,カラオケプラザ時遊館多賀城店,022,022-361-3211,,,,多賀城市八幡１－３－４８,宮城県多賀城市八幡１－３－４８,,39729,宮城県,多賀城市,八幡１,,2022/06/06,2022/06/06,2022/06/11,,株式会社アトム,,,,,,,,,,57831-01-0101,,飲食店営業, 飲食店営業,,,050-056_宮城県_宮城県一括_食品衛生()_2022年06月_末日,宿泊業，飲食サービス業,飲食店,,,,,,,,,カラオケプラザ時遊館多賀城店,カラオケプラザ時遊館多賀城店,株式会社アトム,,1,,,,,
57835,飲食店営業,飲食店営業,57835-01-0101,うみねこや,宮城郡松島町松島仙随地内,宮城郡松島町松島仙随地内,,022-354-5218,宮城産業株式会社,R 4. 6. 6,R 4. 6. 6,R 4. 6.11,,塩釜保健所,うみねこや,022,022-354-5218,,,,宮城郡松島町松島仙随地内,宮城県宮城郡松島町松島仙随地内,,43862,宮城県,宮城郡松島町,松島,,2022/06/06,2022/06/06,2022/06/11,,宮城産業株式会社,,,,,,,,,,57835-01-0101,,飲食店営業, 飲食店営業,,,050-056_宮城県_宮城県一括_食品衛生()_2022年06月_末日,宿泊業，飲食サービス業,飲食店,,,,,,,,,うみねこや,うみねこや,宮城産業株式会社,,1,,,,,
57864,水産製品製造業,水産製品製造業,57864-01-1601,株式会社マルナミフーズ,塩竈市新浜町１丁目４３番１１号,塩竈市新浜町１丁目４３番１１号,,022-367-0732,株式会社マルナミフーズ,R 4. 6. 7,R 4. 6. 7,R 4. 6.11,,塩釜保健所,株式会社マルナミフーズ,022,022-367-0732,,,,塩竈市新浜町１丁目４３番１１号,宮城県塩釜市新浜町１丁目４３番１１号,,38972,宮城県,塩竈市,新浜町１,,2022/06/07,2022/06/07,2022/06/11,,株式会社マルナミフーズ,,,,,,,,,,57864-01-1601,,水産製品製造業, 水産製品製造業,,,050-056_宮城県_宮城県一括_食品衛生()_2022年06月_末日,製造業,食料品製造業,水産食料品製造業,,,,,,,,株式会社マルナミフーズ,株式会社マルナミフズ,株式会社マルナミフーズ,,1,,,,,
57870,水産製品製造業,水産製品製造業,57870-01-1601,株式会社　間宮商店,塩竈市新浜町一丁目２１番８号,塩竈市新浜町１丁目２１番８号,,022-365-3890,株式会社間宮商店,R 4. 6.11,R 4. 6. 8,R 4. 6.11,,塩釜保健所,株式会社　間宮商店,022,022-365-3890,,,,塩竈市新浜町１丁目２１番８号,宮城県塩釜市新浜町１丁目２１番８号,,38972,宮城県,塩竈市,新浜町１,,2022/06/08,2022/06/11,2022/06/11,,株式会社間宮商店,,,,,,,,,,57870-01-1601,,水産製品製造業, 水産製品製造業,,,050-056_宮城県_宮城県一括_食品衛生()_2022年06月_末日,製造業,食料品製造業,水産食料品製造業,,,,,,,,株式会社間宮商店,株式会社間宮商店,株式会社間宮商店,,2,,,,,
57870,飲食店営業,飲食店営業,57870-02-0101,株式会社　間宮商店,塩竈市新浜町一丁目２１番８号,塩竈市新浜町１丁目２１番８号,,022-365-3890,株式会社間宮商店,R 4. 6. 8,R 4. 6. 8,R 4. 6.11,,塩釜保健所,株式会社　間宮商店,022,022-365-3890,,,,塩竈市新浜町１丁目２１番８号,宮城県塩釜市新浜町１丁目２１番８号,,38972,宮城県,塩竈市,新浜町１,,2022/06/08,2022/06/08,2022/06/11,,株式会社間宮商店,,,,,,,,,,57870-02-0101,,飲食店営業, 飲食店営業,,,050-056_宮城県_宮城県一括_食品衛生()_2022年06月_末日,宿泊業，飲食サービス業,飲食店,,,,,,,,,株式会社間宮商店,株式会社間宮商店,株式会社間宮商店,,2,,,,,
57872,飲食店営業,ふぐ,57872-01-0102,有限会社丸長寿司,塩竈市尾島町１１－１６,塩竈市尾島町１１－１６,,022-362-3637,有限会社丸長寿司,R 4. 6. 7,R 4. 6. 7,R 4. 6.11,,塩釜保健所,有限会社丸長寿司,022,022-362-3637,,,,塩竈市尾島町１１－１６,宮城県塩釜市尾島町１１－１６,,38959,宮城県,塩竈市,尾島町,,2022/06/07,2022/06/07,2022/06/11,,有限会社丸長寿司,,,,,,,,,,57872-01-0102,,飲食店営業, ふぐ,,,050-056_宮城県_宮城県一括_食品衛生()_2022年06月_末日,宿泊業，飲食サービス業,飲食店,,,,,,,,,有限会社丸長寿司,有限会社丸長寿司,有限会社丸長寿司,,1,,,,,
