laugh（ラフ）,北九州市小倉北区堺町一丁目１０－６ECプラザビル４F,北九州市小倉北区堺町１丁目１０－６,ECプラザビル４F,,紫村勇大,,,,,2022-20334,飲食店営業,バー,2022/7/11,2022/7/11,2022/7/11,2028/7/31,,北九州市保健所,laugh（ラフ）,093,,,,,北九州市小倉北区堺町１丁目１０－６,福岡県北九州市小倉北区堺町１丁目１０－６,ECプラザビル４F,198760,福岡県,北九州市小倉北区,堺町１,2022/07/11,,2022/07/11,2022/07/11,2028/07/31,,,,,,,,,,,2022-20334,,飲食店営業, バー,,,390_福岡県_北九州市保健所_食品衛生(許可)_2022年07月_末日_新規,宿泊業，飲食サービス業,飲食店,,,,,,,,,ｌａｕｇｈ（ラフ）,ｌａｕｇｈラフ,,,1,,,,,
ノラや,北九州市小倉北区吉野町９－２８,北九州市小倉北区吉野町９－２８,,,廣田彩,,,,,2022-20318,飲食店営業,居酒屋,2022/7/1,2022/7/1,2022/7/1,2028/6/30,,北九州市保健所,ノラや,093,,,,,北九州市小倉北区吉野町９－２８,福岡県北九州市小倉北区吉野町９－２８,,198867,福岡県,北九州市小倉北区,吉野町,2022/07/01,,2022/07/01,2022/07/01,2028/06/30,,,,,,,,,,,2022-20318,,飲食店営業, 居酒屋,,,390_福岡県_北九州市保健所_食品衛生(許可)_2022年07月_末日_新規,宿泊業，飲食サービス業,飲食店,,,,,,,,,ノラや,ノラや,,,1,,,,,
カラオケ喫茶　森田,北九州市小倉北区古船場町２－１０タ―ウィンビル３Ｆ,北九州市小倉北区古船場町２－１０,タ―ウィンビル３Ｆ,0935334737,森田千恵子,,,,,2022－20355,飲食店営業,カラオケ喫茶,2022/7/15,2022/7/15,2022/8/1,2028/7/31,,北九州市保健所,カラオケ喫茶　森田,093,093-533-4737,,,,北九州市小倉北区古船場町２－１０,福岡県北九州市小倉北区古船場町２－１０,タ―ウィンビル３Ｆ,198847,福岡県,北九州市小倉北区,古船場町,2022/07/15,,2022/07/15,2022/08/01,2028/07/31,,,,,,,,,,,2022－20355,,飲食店営業, カラオケ喫茶,,,390_福岡県_北九州市保健所_食品衛生(許可)_2022年07月_末日_新規,宿泊業，飲食サービス業,飲食店,,,,,,,,,カラオケ喫茶　森田,カラオケ喫茶森田,,,1,,,,,
コワーキングスペース秘密基地,北九州市小倉北区京町二丁目２－１９ジャンジャンビル３F,北九州市小倉北区京町２丁目２－１９,ジャンジャンビル３F,093-967-1003,株式会社ＨＯＡ,岡秀樹,福岡県北九州市小倉北区京町２丁目２番１９号,福岡県北九州市小倉北区京町２丁目２番１９号,,2022-20408,飲食店営業,,2022/7/8,2022/7/8,2022/9/1,2028/8/31,,北九州市保健所,コワーキングスペース秘密基地,093,093-967-1003,,,,北九州市小倉北区京町２丁目２－１９,福岡県北九州市小倉北区京町２丁目２－１９,ジャンジャンビル３F,198725,福岡県,北九州市小倉北区,京町２,2022/07/08,,2022/07/08,2022/09/01,2028/08/31,株式会社ＨＯＡ,岡秀樹,,福岡県北九州市小倉北区京町２丁目２番１９号　,福岡県北九州市小倉北区京町２丁目２番１９号,,198725,福岡県,北九州市小倉北区,京町２,2022-20408,,飲食店営業,,,,390_福岡県_北九州市保健所_食品衛生(許可)_2022年07月_末日_新規,宿泊業，飲食サービス業,飲食店,,,,,,,,,コワーキングスペース秘密基地,コワキングスペス秘密基地,株式会社ＨＯＡ,,1,,,,,
鯉八,北九州市小倉北区京町三丁目１１－１７石崎ビル２Ｆ,北九州市小倉北区京町３丁目１１－１７,石崎ビル２Ｆ,,兼森一裕,,,,,2022-20374,飲食店営業,,2022/7/15,2022/7/15,2022/8/1,2028/7/31,,北九州市保健所,鯉八,093,,,,,北九州市小倉北区京町３丁目１１－１７,福岡県北九州市小倉北区京町３丁目１１－１７,石崎ビル２Ｆ,198726,福岡県,北九州市小倉北区,京町３,2022/07/15,,2022/07/15,2022/08/01,2028/07/31,,,,,,,,,,,2022-20374,,飲食店営業,,,,390_福岡県_北九州市保健所_食品衛生(許可)_2022年07月_末日_新規,宿泊業，飲食サービス業,飲食店,,,,,,,,,鯉八,鯉八,,,1,,,,,
ANteNNA,北九州市小倉北区京町三丁目１０－９栄伸ビル４F,北九州市小倉北区京町３丁目１０－９,栄伸ビル４F,0934821810,平岩亮哉,,,,,2022-20464,飲食店営業,雑貨屋で喫茶,2022/7/22,2022/7/22,2022/7/22,2028/7/31,,北九州市保健所,ANteNNA,093,093-482-1810,,,,北九州市小倉北区京町３丁目１０－９,福岡県北九州市小倉北区京町３丁目１０－９,栄伸ビル４F,198726,福岡県,北九州市小倉北区,京町３,2022/07/22,,2022/07/22,2022/07/22,2028/07/31,,,,,,,,,,,2022-20464,,飲食店営業, 雑貨屋で喫茶,,,390_福岡県_北九州市保健所_食品衛生(許可)_2022年07月_末日_新規,宿泊業，飲食サービス業,飲食店,,,,,,,,,ＡＮｔｅＮＮＡ,ＡＮｔｅＮＮＡ,,,1,,,,,
どんどん亭小倉セントシティ店,北九州市小倉北区京町三丁目１－１セントシティ１１F,北九州市小倉北区京町３丁目１－１,セントシティ１１F,0935517922,Miコーポレーション株式会社,松石崇志,福岡県福岡市博多区山王1丁目1番34号,福岡県福岡市博多区山王１丁目１番３４号,,2022－20375,飲食店営業,お好み焼き屋,2022/7/15,2022/7/15,2022/8/1,2029/7/31,,北九州市保健所,どんどん亭小倉セントシティ店,093,093-551-7922,,,,北九州市小倉北区京町３丁目１－１,福岡県北九州市小倉北区京町３丁目１－１,セントシティ１１F,198726,福岡県,北九州市小倉北区,京町３,2022/07/15,,2022/07/15,2022/08/01,2029/07/31,Miコーポレーション株式会社,松石崇志,,福岡県福岡市博多区山王１丁目１番３４号　,福岡県福岡市博多区山王１丁目１番３４号,,200073,福岡県,福岡市博多区,山王１,2022－20375,,飲食店営業, お好み焼き屋,,,390_福岡県_北九州市保健所_食品衛生(許可)_2022年07月_末日_新規,宿泊業，飲食サービス業,飲食店,,,,,,,,,どんどん亭小倉セントシティ店,どんどん亭小倉セントシティ店,Ｍｉコーポレーション株式会社,,1,,,,,
小倉フルーツ旬菓　すず蘭,北九州市小倉北区京町一丁目４－２１ー１F,北九州市小倉北区京町１丁目４－２１,ー１F,,合同会社TAMS,片桐愛,福岡県北九州市小倉北区下富野三丁目４－５４,福岡県北九州市小倉北区下富野３丁目４－５４,,2022-20406,飲食店営業,,2022/7/22,2022/7/22,2022/7/22,2028/7/31,,北九州市保健所,小倉フルーツ旬菓　すず蘭,093,,,,,北九州市小倉北区京町１丁目４－２１,福岡県北九州市小倉北区京町１丁目４－２１,ー１F,198724,福岡県,北九州市小倉北区,京町１,2022/07/22,,2022/07/22,2022/07/22,2028/07/31,合同会社TAMS,片桐愛,,福岡県北九州市小倉北区下富野３丁目４－５４　,福岡県北九州市小倉北区下富野３丁目４－５４,,198781,福岡県,北九州市小倉北区,下富野３,2022-20406,,飲食店営業,,,,390_福岡県_北九州市保健所_食品衛生(許可)_2022年07月_末日_新規,宿泊業，飲食サービス業,飲食店,,,,,,,,,小倉フルーツ旬菓　すず蘭,小倉フルツ旬菓すず蘭,合同会社ＴＡＭＳ,,2,,,,,
小倉フルーツ旬菓　すず蘭,北九州市小倉北区京町一丁目４－２１ー１F,北九州市小倉北区京町１丁目４－２１,ー１F,,合同会社TAMS,片桐愛,福岡県北九州市小倉北区下富野三丁目４－５４,福岡県北九州市小倉北区下富野３丁目４－５４,,2022-20407,菓子製造業,,2022/7/22,2022/7/22,2022/7/22,2028/7/31,,北九州市保健所,小倉フルーツ旬菓　すず蘭,093,,,,,北九州市小倉北区京町１丁目４－２１,福岡県北九州市小倉北区京町１丁目４－２１,ー１F,198724,福岡県,北九州市小倉北区,京町１,2022/07/22,,2022/07/22,2022/07/22,2028/07/31,合同会社TAMS,片桐愛,,福岡県北九州市小倉北区下富野３丁目４－５４　,福岡県北九州市小倉北区下富野３丁目４－５４,,198781,福岡県,北九州市小倉北区,下富野３,2022-20407,,菓子製造業,,,,390_福岡県_北九州市保健所_食品衛生(許可)_2022年07月_末日_新規,製造業,食料品製造業,,,,,,,,,小倉フルーツ旬菓　すず蘭,小倉フルツ旬菓すず蘭,合同会社ＴＡＭＳ,,2,,,,,
セブンイレブン小倉井堀４丁目店,北九州市小倉北区井堀四丁目５－１９,北九州市小倉北区井堀４丁目５－１９,,093-571-7757,室園武章,,,,,2022-20431,飲食店営業,コンビニエンスストア,2022/7/14,2022/7/14,2022/9/1,2028/8/31,,北九州市保健所,セブンイレブン小倉井堀４丁目店,093,093-571-7757,,,,北九州市小倉北区井堀４丁目５－１９,福岡県北九州市小倉北区井堀４丁目５－１９,,198674,福岡県,北九州市小倉北区,井堀４,2022/07/14,,2022/07/14,2022/09/01,2028/08/31,,,,,,,,,,,2022-20431,,飲食店営業, コンビニエンスストア,,,390_福岡県_北九州市保健所_食品衛生(許可)_2022年07月_末日_新規,宿泊業，飲食サービス業,飲食店,,,,,,,,,セブンイレブン小倉井堀４丁目店,セブンイレブン小倉井堀４丁目店,,セブンイレブン,1,卸売業，小売業,飲食料品小売業,その他の飲食料品小売業,コンビニエンスストア（飲食料品を中心とするものに限る）,
一麺亭中津口店,北九州市小倉北区中津口一丁目４－１,北九州市小倉北区中津口１丁目４－１,,,リズム食品株式会社,岡本　慶大,福岡県北九州市小倉北区紺屋町13番1号毎日西部会館7階,福岡県北九州市小倉北区紺屋町１３番１号,毎日西部会館７階,2022-20349,飲食店営業,,2022/7/1,2022/7/1,2022/8/1,2029/7/31,,北九州市保健所,一麺亭中津口店,093,,,,,北九州市小倉北区中津口１丁目４－１,福岡県北九州市小倉北区中津口１丁目４－１,,198827,福岡県,北九州市小倉北区,中津口１,2022/07/01,,2022/07/01,2022/08/01,2029/07/31,リズム食品株式会社,岡本　慶大,,福岡県北九州市小倉北区紺屋町１３番１号　毎日西部会館７階,福岡県北九州市小倉北区紺屋町１３番１号毎日西部会館７階,,198757,福岡県,北九州市小倉北区,紺屋町,2022-20349,,飲食店営業,,,,390_福岡県_北九州市保健所_食品衛生(許可)_2022年07月_末日_新規,宿泊業，飲食サービス業,飲食店,,,,,,,,,一麺亭中津口店,一麺亭中津口店,リズム食品株式会社,,1,,,,,
旦過スパイスカレーARATA,北九州市小倉北区中井一丁目１７－２,北九州市小倉北区中井１丁目１７－２,,,河浜由美子,,,,,2022-20274,飲食店営業,一般食堂,2022/7/25,2022/7/25,2022/7/25,2028/7/31,,北九州市保健所,旦過スパイスカレーARATA,093,,,,,北九州市小倉北区中井１丁目１７－２,福岡県北九州市小倉北区中井１丁目１７－２,,198819,福岡県,北九州市小倉北区,中井１,2022/07/25,,2022/07/25,2022/07/25,2028/07/31,,,,,,,,,,,2022-20274,,飲食店営業, 一般食堂,,,390_福岡県_北九州市保健所_食品衛生(許可)_2022年07月_末日_新規,宿泊業，飲食サービス業,飲食店,,,,,,,,,旦過スパイスカレーＡＲＡＴＡ,旦過スパイスカレＡＲＡＴＡ,,,1,,,,,
コミルキッチン,北九州市小倉北区下富野三丁目２－１２,北九州市小倉北区下富野３丁目２－１２,,093-531-6760,中島ひとみ,,,,,2022-20429,菓子製造業,,2022/7/25,2022/7/25,2022/7/25,2028/7/31,,北九州市保健所,コミルキッチン,093,093-531-6760,,,,北九州市小倉北区下富野３丁目２－１２,福岡県北九州市小倉北区下富野３丁目２－１２,,198781,福岡県,北九州市小倉北区,下富野３,2022/07/25,,2022/07/25,2022/07/25,2028/07/31,,,,,,,,,,,2022-20429,,菓子製造業,,,,390_福岡県_北九州市保健所_食品衛生(許可)_2022年07月_末日_新規,製造業,食料品製造業,,,,,,,,,コミルキッチン,コミルキッチン,,,1,,,,,
おにぎりカフェ＆BAR　一粒万倍,北九州市小倉北区下到津四丁目１０－９,北九州市小倉北区下到津４丁目１０－９,,,株式会社えにしあ,永野響子,福岡県福岡市東区舞松原２丁目７番１１号－２０２号,福岡県福岡市東区舞松原２丁目７番１１号－２０２号,,2022-20469,飲食店営業,一般食堂,2022/7/28,2022/7/28,2022/7/28,2028/7/31,,北九州市保健所,おにぎりカフェ＆BAR　一粒万倍,093,,,,,北九州市小倉北区下到津４丁目１０－９,福岡県北九州市小倉北区下到津４丁目１０－９,,198777,福岡県,北九州市小倉北区,下到津４,2022/07/28,,2022/07/28,2022/07/28,2028/07/31,株式会社えにしあ,永野響子,,福岡県福岡市東区舞松原２丁目７番１１号－２０２号　,福岡県福岡市東区舞松原２丁目７番１１号－２０２号,,199944,福岡県,福岡市東区,舞松原２,2022-20469,,飲食店営業, 一般食堂,,,390_福岡県_北九州市保健所_食品衛生(許可)_2022年07月_末日_新規,宿泊業，飲食サービス業,飲食店,,,,,,,,,おにぎりカフェ＆ＢＡＲ　一粒万倍,おにぎりカフェＢＡＲ一粒万倍,株式会社えにしあ,,1,,,,,
和食処はまもと,北九州市小倉北区下到津一丁目５－１７トーカンマンション下到津１F,北九州市小倉北区下到津１丁目５－１７,トーカンマンション下到津１F,,浜元康司,,,,,2022-20444,飲食店営業,一般食堂,2022/7/15,2022/7/15,2022/9/1,2028/8/31,,北九州市保健所,和食処はまもと,093,,,,,北九州市小倉北区下到津１丁目５－１７,福岡県北九州市小倉北区下到津１丁目５－１７,トーカンマンション下到津１F,198774,福岡県,北九州市小倉北区,下到津１,2022/07/15,,2022/07/15,2022/09/01,2028/08/31,,,,,,,,,,,2022-20444,,飲食店営業, 一般食堂,,,390_福岡県_北九州市保健所_食品衛生(許可)_2022年07月_末日_新規,宿泊業，飲食サービス業,飲食店,,,,,,,,,和食処はまもと,和食処はまもと,,,1,,,,,
ミニストップ小倉三郎丸店,北九州市小倉北区三郎丸三丁目１５－１７,北九州市小倉北区三郎丸３丁目１５－１７,,093-923-0875,金木誠治,,,,,2022-20423,飲食店営業,,2022/7/12,2022/7/12,2022/9/1,2028/8/31,,北九州市保健所,ミニストップ小倉三郎丸店,093,093-923-0875,,,,北九州市小倉北区三郎丸３丁目１５－１７,福岡県北九州市小倉北区三郎丸３丁目１５－１７,,198764,福岡県,北九州市小倉北区,三郎丸３,2022/07/12,,2022/07/12,2022/09/01,2028/08/31,,,,,,,,,,,2022-20423,,飲食店営業,,,,390_福岡県_北九州市保健所_食品衛生(許可)_2022年07月_末日_新規,宿泊業，飲食サービス業,飲食店,,,,,,,,,ミニストップ小倉三郎丸店,ミニストップ小倉三郎丸店,,ミニストップ,1,卸売業，小売業,飲食料品小売業,その他の飲食料品小売業,コンビニエンスストア（飲食料品を中心とするものに限る）,
セブンーイレブン八幡黒崎城石店,北九州市八幡西区黒崎城石３番７号,北九州市八幡西区黒崎城石３番７号,,,髙島ライフソリューションズ株式会社,福田正,福岡県北九州市八幡西区黒崎城石３－７,福岡県北九州市八幡西区黒崎城石３－７,,2022-60217,飲食店営業,,2022/7/15,2022/7/15,2022/9/1,2028/8/31,,北九州市保健所,セブンーイレブン八幡黒崎城石店,093,,,,,北九州市八幡西区黒崎城石３番７号,福岡県北九州市八幡西区黒崎城石３番７号,,199730,福岡県,北九州市八幡西区,黒崎城石,2022/07/15,,2022/07/15,2022/09/01,2028/08/31,髙島ライフソリューションズ株式会社,福田正,,福岡県北九州市八幡西区黒崎城石３－７　,福岡県北九州市八幡西区黒崎城石３－７,,199730,福岡県,北九州市八幡西区,黒崎城石,2022-60217,,飲食店営業,,,,390_福岡県_北九州市保健所_食品衛生(許可)_2022年07月_末日_新規,宿泊業，飲食サービス業,飲食店,,,,,,,,,セブンイレブン八幡黒崎城石店,セブンイレブン八幡黒崎城石店,髙島ライフソリューションズ株式会社,セブンイレブン,1,卸売業，小売業,飲食料品小売業,その他の飲食料品小売業,コンビニエンスストア（飲食料品を中心とするものに限る）,
Bar Genievre,北九州市八幡西区黒崎四丁目６－１　グリーンパーク三共１０３,北九州市八幡西区黒崎４丁目６－１,グリーンパーク三共１０３,,坂井栄樹,,,,,2022-60107,飲食店営業,バー,2022/7/13,2022/7/13,2022/7/13,2028/7/31,,北九州市保健所,Bar Genievre,093,,,,,北九州市八幡西区黒崎４丁目６－１,福岡県北九州市八幡西区黒崎４丁目６－１,グリーンパーク三共１０３,199432,福岡県,北九州市八幡西区,黒崎４,2022/07/13,,2022/07/13,2022/07/13,2028/07/31,,,,,,,,,,,2022-60107,,飲食店営業, バー,,,390_福岡県_北九州市保健所_食品衛生(許可)_2022年07月_末日_新規,宿泊業，飲食サービス業,飲食店,,,,,,,,,Ｂａｒ　Ｇｅｎｉｅｖｒｅ,ＢａｒＧｅｎｉｅｖｒｅ,,,1,,,,,
あらカブや,北九州市八幡西区黒崎二丁目９－５　第一平木ビル１F,北九州市八幡西区黒崎２丁目９－５,第一平木ビル１F,093-603-2722,高藤昭弘,,,,,2022-60238,飲食店営業,居酒屋,2022/7/22,2022/7/22,2022/9/1,2028/8/31,,北九州市保健所,あらカブや,093,093-603-2722,,,,北九州市八幡西区黒崎２丁目９－５,福岡県北九州市八幡西区黒崎２丁目９－５,第一平木ビル１F,199430,福岡県,北九州市八幡西区,黒崎２,2022/07/22,,2022/07/22,2022/09/01,2028/08/31,,,,,,,,,,,2022-60238,,飲食店営業, 居酒屋,,,390_福岡県_北九州市保健所_食品衛生(許可)_2022年07月_末日_新規,宿泊業，飲食サービス業,飲食店,,,,,,,,,あらカブや,あらカブや,,,1,,,,,
Ｙａｍａｔｏ’ｓ　Ｃａｆｅ,北九州市八幡西区黒崎三丁目１５－３,北九州市八幡西区黒崎３丁目１５－３,,0949-22-0533,学校法人大和学園,大和雅彦,福岡県直方市日吉町10-12,福岡県直方市日吉町１０－１２,,2022-60252,飲食店営業,自動車営業,2022/7/29,2022/7/29,2022/7/29,2027/7/31,,北九州市保健所,Ｙａｍａｔｏ’ｓ　Ｃａｆｅ,093,0949-22-0533,,,,北九州市八幡西区黒崎３丁目１５－３,福岡県北九州市八幡西区黒崎３丁目１５－３,,199431,福岡県,北九州市八幡西区,黒崎３,2022/07/29,,2022/07/29,2022/07/29,2027/07/31,学校法人大和学園,大和雅彦,,福岡県直方市日吉町１０－１２　,福岡県直方市日吉町１０－１２,,201470,福岡県,直方市,日吉町,2022-60252,,飲食店営業, 自動車営業,,,390_福岡県_北九州市保健所_食品衛生(許可)_2022年07月_末日_新規,宿泊業，飲食サービス業,飲食店,,,,,,,,,Ｙａｍａｔｏ＇ｓ　Ｃａｆｅ,ＹａｍａｔｏｓＣａｆｅ,学校法人大和学園,,1,,,,,
Ｙａｍａｔｏ’ｓ　ｋｉｔｃｈｅｎ,北九州市八幡西区黒崎三丁目１５－３,北九州市八幡西区黒崎３丁目１５－３,,0949-22-0533,学校法人大和学園,大和雅彦,福岡県直方市日吉町10-12,福岡県直方市日吉町１０－１２,,2022-60251,飲食店営業,自動車営業,2022/7/29,2022/7/29,2022/7/29,2027/7/31,,北九州市保健所,Ｙａｍａｔｏ’ｓ　ｋｉｔｃｈｅｎ,093,0949-22-0533,,,,北九州市八幡西区黒崎３丁目１５－３,福岡県北九州市八幡西区黒崎３丁目１５－３,,199431,福岡県,北九州市八幡西区,黒崎３,2022/07/29,,2022/07/29,2022/07/29,2027/07/31,学校法人大和学園,大和雅彦,,福岡県直方市日吉町１０－１２　,福岡県直方市日吉町１０－１２,,201470,福岡県,直方市,日吉町,2022-60251,,飲食店営業, 自動車営業,,,390_福岡県_北九州市保健所_食品衛生(許可)_2022年07月_末日_新規,宿泊業，飲食サービス業,飲食店,,,,,,,,,Ｙａｍａｔｏ＇ｓ　ｋｉｔｃｈｅｎ,Ｙａｍａｔｏｓｋｉｔｃｈｅｎ,学校法人大和学園,,1,,,,,
たこ焼きしんちゃん,北九州市八幡西区黒崎三丁目１５－３,北九州市八幡西区黒崎３丁目１５－３,,,田口真一,,,,,2022-60195,飲食店営業,自動車営業,2022/7/1,2022/7/1,2022/7/1,2027/6/30,,北九州市保健所,たこ焼きしんちゃん,093,,,,,北九州市八幡西区黒崎３丁目１５－３,福岡県北九州市八幡西区黒崎３丁目１５－３,,199431,福岡県,北九州市八幡西区,黒崎３,2022/07/01,,2022/07/01,2022/07/01,2027/06/30,,,,,,,,,,,2022-60195,,飲食店営業, 自動車営業,,,390_福岡県_北九州市保健所_食品衛生(許可)_2022年07月_末日_新規,宿泊業，飲食サービス業,飲食店,,,,,,,,,たこ焼きしんちゃん,たこ焼きしんちゃん,,,1,,,,,
Wakey Wakey Eggs and Bakey,北九州市八幡西区黒崎三丁目15番3号,北九州市八幡西区黒崎３丁目１５番３号,,,石松文愛,,,,,2022-60222,飲食店営業,自動車営業,2022/7/15,2022/7/15,2022/7/15,2027/7/31,,北九州市保健所,Wakey Wakey Eggs and Bakey,093,,,,,北九州市八幡西区黒崎３丁目１５番３号,福岡県北九州市八幡西区黒崎３丁目１５番３号,,199431,福岡県,北九州市八幡西区,黒崎３,2022/07/15,,2022/07/15,2022/07/15,2027/07/31,,,,,,,,,,,2022-60222,,飲食店営業, 自動車営業,,,390_福岡県_北九州市保健所_食品衛生(許可)_2022年07月_末日_新規,宿泊業，飲食サービス業,飲食店,,,,,,,,,Ｗａｋｅｙ　Ｗａｋｅｙ　Ｅｇｇｓ　ａｎｄ　Ｂａｋｅｙ,ＷａｋｅｙＷａｋｅｙＥｇｇｓａｎｄＢａｋｅｙ,,,1,,,,,
厨,北九州市八幡西区黒崎一丁目９－８　キングビル１Ｆ,北九州市八幡西区黒崎１丁目９－８,キングビル１Ｆ,,𠮷田富雄,,,,,2022-60229,飲食店営業,居酒屋,2022/7/26,2022/7/26,2022/9/1,2028/8/31,,北九州市保健所,厨,093,,,,,北九州市八幡西区黒崎１丁目９－８,福岡県北九州市八幡西区黒崎１丁目９－８,キングビル１Ｆ,199429,福岡県,北九州市八幡西区,黒崎１,2022/07/26,,2022/07/26,2022/09/01,2028/08/31,,,,,,,,,,,2022-60229,,飲食店営業, 居酒屋,,,390_福岡県_北九州市保健所_食品衛生(許可)_2022年07月_末日_新規,宿泊業，飲食サービス業,飲食店,,,,,,,,,厨,厨,,,1,,,,,
スナック　かず,北九州市八幡西区黒崎一丁目８－７　銀映ビル２F,北九州市八幡西区黒崎１丁目８－７,銀映ビル２F,,坂口和子,,,,,2022-60198,飲食店営業,スナック,2022/7/19,2022/7/19,2022/8/1,2028/7/31,,北九州市保健所,スナック　かず,093,,,,,北九州市八幡西区黒崎１丁目８－７,福岡県北九州市八幡西区黒崎１丁目８－７,銀映ビル２F,199429,福岡県,北九州市八幡西区,黒崎１,2022/07/19,,2022/07/19,2022/08/01,2028/07/31,,,,,,,,,,,2022-60198,,飲食店営業, スナック,,,390_福岡県_北九州市保健所_食品衛生(許可)_2022年07月_末日_新規,宿泊業，飲食サービス業,飲食店,,,,,,,,,スナック　かず,スナックかず,,,1,,,,,
オーガスタ,北九州市八幡西区黒崎一丁目１４－２２,北九州市八幡西区黒崎１丁目１４－２２,,,有限会社オーガスタ,馬場里美,福岡県北九州市八幡西区鷹の巣二丁目４－３８－３０４,福岡県北九州市八幡西区鷹の巣２丁目４－３８,３０４,2022-60236,飲食店営業,スナック,2022/7/26,2022/7/26,2022/8/1,2028/7/31,,北九州市保健所,オーガスタ,093,,,,,北九州市八幡西区黒崎１丁目１４－２２,福岡県北九州市八幡西区黒崎１丁目１４－２２,,199429,福岡県,北九州市八幡西区,黒崎１,2022/07/26,,2022/07/26,2022/08/01,2028/07/31,有限会社オーガスタ,馬場里美,,福岡県北九州市八幡西区鷹の巣２丁目４－３８　３０４,福岡県北九州市八幡西区鷹ノ巣２丁目４－３８３０４,,199479,福岡県,北九州市八幡西区,鷹の巣２,2022-60236,,飲食店営業, スナック,,,390_福岡県_北九州市保健所_食品衛生(許可)_2022年07月_末日_新規,宿泊業，飲食サービス業,飲食店,,,,,,,,,オーガスタ,オガスタ,有限会社オーガスタ,,1,,,,,
かおるの部屋,北九州市八幡西区黒崎一丁目１３－２,北九州市八幡西区黒崎１丁目１３－２,,,藤井清香,,,,,2022-60240,飲食店営業,スナック,2022/7/27,2022/7/27,2022/9/1,2028/8/31,,北九州市保健所,かおるの部屋,093,,,,,北九州市八幡西区黒崎１丁目１３－２,福岡県北九州市八幡西区黒崎１丁目１３－２,,199429,福岡県,北九州市八幡西区,黒崎１,2022/07/27,,2022/07/27,2022/09/01,2028/08/31,,,,,,,,,,,2022-60240,,飲食店営業, スナック,,,390_福岡県_北九州市保健所_食品衛生(許可)_2022年07月_末日_新規,宿泊業，飲食サービス業,飲食店,,,,,,,,,かおるの部屋,かおるの部屋,,,1,,,,,
