許可,菓子製造業,豚ラーメン榊,釧路市海運１丁目１３番  ,釧路市海運１丁目１３番 ,,0154-32-7051,小川綾,  ,  , ,,  ,2021.12.16,2021.12.16,7-497,,釧路保健所,豚ラーメン榊,0154,0154-32-7051,,,,釧路市海運１丁目１３番 ,北海道釧路市海運１丁目１３番,,9027,北海道,釧路市,海運１,,2021/12/16,2021/12/16,,,,小川綾   ,, ,,,,,,,7-497,,菓子製造業,,許可,,008-030_北海道_保健所_食品衛生()_2021年12月_末日,製造業,食料品製造業,,,,,,,,,豚ラーメン榊,豚ラメン榊,
届出,コップ式自動販売機(自動洗浄・屋内設置）,1100201869釧路日産クリスタル店,釧路市鳥取大通９丁目２  ,釧路市鳥取大通９丁目２,,0154-53-4123,北海道コカ・コーラボトリング（株）,佐々木康行,札幌市清田区清田１条１丁目２番１号 ,札幌市清田区清田１条１丁目２番１号, ,011-888-2001,,2021.12.16,,,釧路保健所,1100201869釧路日産クリスタル店,0154,0154-53-4123,,,,釧路市鳥取大通９丁目２,北海道釧路市鳥取大通９丁目２,,9197,北海道,釧路市,鳥取大通９,,,2021/12/16,,,北海道コカ・コーラボトリング（株）,佐々木康行,011-888-2001,札幌市清田区清田１条１丁目２番１号,北海道札幌市清田区清田一条１丁目２番１号, ,5944,北海道,札幌市清田区,清田一条１,,,自動販売機,自動洗浄・屋内設置,届出,,008-030_北海道_保健所_食品衛生()_2021年12月_末日,卸売業，小売業,無店舗小売業,自動販売機による小売業,,,,,,,,１１００２０１８６９釧路日産クリスタル店,１１００２０１８６９釧路日産クリスタル店,北海道コカ・コーラボトリング株式会社
届出,コンビニ,セブン・イレブン　釧路千代ノ浦店,釧路市千代ノ浦２番１０号  ,釧路市千代ノ浦２番１０号, ,0154-43-0030,岡田明彦,  ,  , ,,  ,,2021.12.15,,,釧路保健所,セブン・イレブン　釧路千代ノ浦店,0154,0154-43-0030,,,,釧路市千代ノ浦２番１０号,北海道釧路市千代ノ浦２番１０号, ,9183,北海道,釧路市,千代ノ浦,,,2021/12/15,,,,岡田明彦   ,, ,,,,,,,,,コンビニエンスストア,,届出,,008-030_北海道_保健所_食品衛生()_2021年12月_末日,卸売業，小売業,飲食料品小売業,その他の飲食料品小売業,コンビニエンスストア（飲食料品を中心とするものに限る）,,,,,,,セブンイレブン　釧路千代ノ浦店,セブンイレブン釧路千代ノ浦店,
届出,コンビニ,セブンイレブン　厚岸白浜店,厚岸郡厚岸町白浜３丁目７  ,厚岸郡厚岸町白浜３丁目７,,0153-52-0711,有限会社　島下,島下将一,野付郡別海町別海緑町１０番地 ,野付郡別海町別海緑町１０番地 ,,0153-75-0775,,2021.12.15,,,釧路保健所,セブンイレブン　厚岸白浜店,0153,0153-52-0711,,,,厚岸郡厚岸町白浜３丁目７,北海道厚岸郡厚岸町白浜３丁目７,,22821,北海道,厚岸郡厚岸町,白浜３,,,2021/12/15,,,有限会社　島下,島下将一,0153-75-0775,野付郡別海町別海緑町１０番地 ,北海道野付郡別海町別海緑町１０番地,,24105,北海道,野付郡別海町,別海緑町,,,コンビニエンスストア,,届出,,008-030_北海道_保健所_食品衛生()_2021年12月_末日,卸売業，小売業,飲食料品小売業,その他の飲食料品小売業,コンビニエンスストア（飲食料品を中心とするものに限る）,,,,,,,セブンイレブン　厚岸白浜店,セブンイレブン厚岸白浜店,有限会社島下
届出,コンビニ,セブン・イレブン　　厚岸港町店,厚岸郡厚岸町港町４丁目１７７番地の２  ,厚岸郡厚岸町港町４丁目１７７番地の２,,0153-52-2870,有限会社　島下,島下将一,野付郡別海町別海緑町１０番地 ,野付郡別海町別海緑町１０番地 ,,01537-5-0775,,2021.12.15,,,釧路保健所,セブン・イレブン　　厚岸港町店,0153,0153-52-2870,,,,厚岸郡厚岸町港町４丁目１７７番地の２,北海道厚岸郡厚岸町港町４丁目１７７番地ノ２,,22841,北海道,厚岸郡厚岸町,港町４,,,2021/12/15,,,有限会社　島下,島下将一,01537-5-0775,野付郡別海町別海緑町１０番地 ,北海道野付郡別海町別海緑町１０番地,,24105,北海道,野付郡別海町,別海緑町,,,コンビニエンスストア,,届出,,008-030_北海道_保健所_食品衛生()_2021年12月_末日,卸売業，小売業,飲食料品小売業,その他の飲食料品小売業,コンビニエンスストア（飲食料品を中心とするものに限る）,,,,,,,セブンイレブン　厚岸港町店,セブンイレブン厚岸港町店,有限会社島下
届出,行商,シロー,営業計画書に基づく釧路保健所管内一円  ,営業計画書に基づく釧路保健所管内一円 ,,0153-52-2270,濱野廣,  ,  , ,,  ,,2021.12.15,,,釧路保健所,シロー,,0153-52-2270,,,,営業計画書に基づく釧路保健所管内一円 ,北海道営業計画書に基づく釧路保健所管内一円,,,北海道,,,,,2021/12/15,,,,濱野廣   ,, ,,,,,,,,,行商,,届出,,008-030_北海道_保健所_食品衛生()_2021年12月_末日,卸売業，小売業,無店舗小売業,その他の無店舗小売業,,,,,,,,シロー,シロ,
届出,コンビニ,セブン・イレブン　釧路新川町店,釧路市新川町１６－１  ,釧路市新川町１６－１,,0154-24-9772,（有）ショップシンバシ,松本章子,釧路市新橋大通２－２－１０ ,釧路市新橋大通２－２－１０,,0154-22-6691,,2021.12.14,,,釧路保健所,セブン・イレブン　釧路新川町店,0154,0154-24-9772,,,,釧路市新川町１６－１,北海道釧路市新川町１６－１,,9144,北海道,釧路市,新川町,,,2021/12/14,,,（有）ショップシンバシ,松本章子,0154-22-6691,釧路市新橋大通２－２－１０,北海道釧路市新橋大通２－２－１０,,9148,北海道,釧路市,新橋大通２,,,コンビニエンスストア,,届出,,008-030_北海道_保健所_食品衛生()_2021年12月_末日,卸売業，小売業,飲食料品小売業,その他の飲食料品小売業,コンビニエンスストア（飲食料品を中心とするものに限る）,,,,,,,セブンイレブン　釧路新川町店,セブンイレブン釧路新川町店,有限会社ショップシンバシ
届出,コンビニ,セブン－イレブン釧路武佐１丁目店,釧路市武佐１丁目９  ,釧路市武佐１丁目９,,0154-46-5772,西村　史,  ,  , ,,  ,,2021.12.14,,,釧路保健所,セブン－イレブン釧路武佐１丁目店,0154,0154-46-5772,,,,釧路市武佐１丁目９,北海道釧路市武佐１丁目９,,9302,北海道,釧路市,武佐１,,,2021/12/14,,,,西村　史   ,, ,,,,,,,,,コンビニエンスストア,,届出,,008-030_北海道_保健所_食品衛生()_2021年12月_末日,卸売業，小売業,飲食料品小売業,その他の飲食料品小売業,コンビニエンスストア（飲食料品を中心とするものに限る）,,,,,,,セブンイレブン釧路武佐１丁目店,セブンイレブン釧路武佐１丁目店,
届出,その他の食料・飲料販売業,ミルキークラウン乳業株式会社,営業計画書の基づく釧路保健所管内一円  ,営業計画書の基づく釧路保健所管内一円 ,,,ミルキークラウン乳業株式会社,舘石未希,釧路市新富士町５丁目１番７号 ,釧路市新富士町５丁目１番７号, ,0154-53-7788,,2021.12.13,,,釧路保健所,ミルキークラウン乳業株式会社,,,,,,営業計画書の基づく釧路保健所管内一円 ,北海道営業計画書ノ基づく釧路保健所管内一円,,,北海道,,,,,2021/12/13,,,ミルキークラウン乳業株式会社,舘石未希,0154-53-7788,釧路市新富士町５丁目１番７号,北海道釧路市新富士町５丁目１番７号, ,9160,北海道,釧路市,新富士町５,,,その他の食料品製造・加工業,(包装),届出,,008-030_北海道_保健所_食品衛生()_2021年12月_末日,製造業,食料品製造業,その他の食料品製造業,,,,,,,,ミルキークラウン乳業株式会社,ミルキクラウン乳業株式会社,ミルキークラウン乳業株式会社
届出,コンビニ,セブン－イレブン　春採７丁目店,釧路市春採７丁目１－３０  ,釧路市春採７丁目１－３０,,0154-46-4646,西村裕太郎,  ,  , ,,  ,,2021.12.10,,,釧路保健所,セブン－イレブン　春採７丁目店,0154,0154-46-4646,,,,釧路市春採７丁目１－３０,北海道釧路市春採７丁目１－３０,,9242,北海道,釧路市,春採７,,,2021/12/10,,,,西村裕太郎   ,, ,,,,,,,,,コンビニエンスストア,,届出,,008-030_北海道_保健所_食品衛生()_2021年12月_末日,卸売業，小売業,飲食料品小売業,その他の飲食料品小売業,コンビニエンスストア（飲食料品を中心とするものに限る）,,,,,,,セブンイレブン　春採７丁目店,セブンイレブン春採７丁目店,
許可,飲食店営業,幸せごはん　ゆきね,釧路市昭和中央３－５－５  ,釧路市昭和中央３－５－５,,,菅野雪音,  ,  , ,,  ,2021.12.10,2021.12.10,7-494,,釧路保健所,幸せごはん　ゆきね,0154,,,,,釧路市昭和中央３－５－５,北海道釧路市昭和中央３－５－５,,9352,北海道,釧路市,昭和中央３,,2021/12/10,2021/12/10,,,,菅野雪音   ,, ,,,,,,,7-494,,飲食店営業,,許可,,008-030_北海道_保健所_食品衛生()_2021年12月_末日,宿泊業，飲食サービス業,飲食店,,,,,,,,,幸せごはん　ゆきね,幸せごはんゆきね,
許可,菓子製造業,幸せごはん　ゆきね,釧路市昭和中央３－５－５  ,釧路市昭和中央３－５－５,,,菅野雪音,  ,  , ,,  ,2021.12.10,2021.12.10,7-494,,釧路保健所,幸せごはん　ゆきね,0154,,,,,釧路市昭和中央３－５－５,北海道釧路市昭和中央３－５－５,,9352,北海道,釧路市,昭和中央３,,2021/12/10,2021/12/10,,,,菅野雪音   ,, ,,,,,,,7-494,,菓子製造業,,許可,,008-030_北海道_保健所_食品衛生()_2021年12月_末日,製造業,食料品製造業,,,,,,,,,幸せごはん　ゆきね,幸せごはんゆきね,
届出,魚介類販売業,カキキン有限会社,厚岸郡厚岸町奔渡１丁目１３７番地  ,厚岸郡厚岸町奔渡１丁目１３７番地 ,,0153-52-5277,カキキン有限会社,中嶋均,厚岸郡厚岸町奔渡１丁目１３７番地 ,厚岸郡厚岸町奔渡１丁目１３７番地 ,,0153-52-5277,,2021.12.10,,,釧路保健所,カキキン有限会社,0153,0153-52-5277,,,,厚岸郡厚岸町奔渡１丁目１３７番地 ,北海道厚岸郡厚岸町奔渡１丁目１３７番地,,22843,北海道,厚岸郡厚岸町,奔渡１,,,2021/12/10,,,カキキン有限会社,中嶋均,0153-52-5277,厚岸郡厚岸町奔渡１丁目１３７番地 ,北海道厚岸郡厚岸町奔渡１丁目１３７番地,,22843,北海道,厚岸郡厚岸町,奔渡１,,,魚介類販売業,,届出,,008-030_北海道_保健所_食品衛生()_2021年12月_末日,卸売業，小売業,飲食料品小売業,,,,,,,,,カキキン有限会社,カキキン有限会社,カキキン有限会社
届出,野菜果物販売業,マルハン釧路店,釧路市星が浦大通２－８－５  ,釧路市星が浦大通２－８－５,,0154-55-6805,釧路水産振興（株）,大貫昭博,釧路市大町１－１－１３ ,釧路市大町１－１－１３,,0154-42-1241,,2021.12.10,,,釧路保健所,マルハン釧路店,0154,0154-55-6805,,,,釧路市星が浦大通２－８－５,北海道釧路市星が浦大通２－８－５,,9256,北海道,釧路市,星が浦大通２,,,2021/12/10,,,釧路水産振興（株）,大貫昭博,0154-42-1241,釧路市大町１－１－１３,北海道釧路市大町１－１－１３,,9000,北海道,釧路市,大町１,,,野菜果物販売業,,届出,,008-030_北海道_保健所_食品衛生()_2021年12月_末日,卸売業，小売業,飲食料品小売業,野菜・果実小売業,,,,,,,,マルハン釧路店,マルハン釧路店,釧路水産振興株式会社
届出,野菜果物販売業,釧路ひまわり,釧路郡釧路町桂木６－３  ,釧路郡釧路町桂木６－３,,0154-38-8080,釧路水産振興（株）,大貫昭博,釧路市大町１－１－１３ ,釧路市大町１－１－１３,,0154-42-1241,,2021.12.10,,,釧路保健所,釧路ひまわり,0154,0154-38-8080,,,,釧路郡釧路町桂木６－３,北海道釧路郡釧路町桂木６－３,,21873,北海道,釧路郡釧路町,桂木６,,,2021/12/10,,,釧路水産振興（株）,大貫昭博,0154-42-1241,釧路市大町１－１－１３,北海道釧路市大町１－１－１３,,9000,北海道,釧路市,大町１,,,野菜果物販売業,,届出,,008-030_北海道_保健所_食品衛生()_2021年12月_末日,卸売業，小売業,飲食料品小売業,野菜・果実小売業,,,,,,,,釧路ひまわり,釧路ひまわり,釧路水産振興株式会社
許可,飲食店営業,からあげ専門店鶏笑釧路店,釧路市益浦１丁目１０番３２号  益浦ユニットＣ号,釧路市益浦１丁目１０番３２号 ,益浦ユニットＣ号,  ,鈴木涼太,  ,  , ,,  ,2021.12.9,2021.12.9,7-493,,釧路保健所,からあげ専門店鶏笑釧路店,0154,,,,,釧路市益浦１丁目１０番３２号 ,北海道釧路市益浦１丁目１０番３２号,益浦ユニットＣ号,9272,北海道,釧路市,益浦１,,2021/12/09,2021/12/09,,,,鈴木涼太   ,, ,,,,,,,7-493,,飲食店営業,,許可,,008-030_北海道_保健所_食品衛生()_2021年12月_末日,宿泊業，飲食サービス業,飲食店,,,,,,,,,からあげ専門店鶏笑釧路店,からあげ専門店鶏笑釧路店,
届出,その他の食料・飲料販売業,はま寿司　釧路愛国店,釧路市愛国東１丁目１１番４号  ,釧路市愛国東１丁目１１番４号, ,0154-39-2020,株式会社はま寿司,遠藤哲郎,東京都港区港南２丁目１８番１号 ,東京都港区港南２丁目１８番１号, ,03-6833-8032,,2021.12.9,,,釧路保健所,はま寿司　釧路愛国店,0154,0154-39-2020,,,,釧路市愛国東１丁目１１番４号,北海道釧路市愛国東１丁目１１番４号, ,9319,北海道,釧路市,愛国東１,,,2021/12/09,,,株式会社はま寿司,遠藤哲郎,03-6833-8032,東京都港区港南２丁目１８番１号,東京都港区港南２丁目１８番１号, ,73073,東京都,港区,港南２,,,その他の食料品製造・加工業,(包装),届出,,008-030_北海道_保健所_食品衛生()_2021年12月_末日,製造業,食料品製造業,その他の食料品製造業,,,,,,,,はま寿司　釧路愛国店,はま寿司釧路愛国店,株式会社はま寿司
届出,その他の食料・飲料販売業,はま寿司　釧路鳥取大通店,釧路市鳥取大通２－６－７  ,釧路市鳥取大通２－６－７,,0154-55-5035,株式会社はま寿司,遠藤哲郎,東京都港区港南２丁目１８番１号 ,東京都港区港南２丁目１８番１号, ,03-6833-8032,,2021.12.9,,,釧路保健所,はま寿司　釧路鳥取大通店,0154,0154-55-5035,,,,釧路市鳥取大通２－６－７,北海道釧路市鳥取大通２－６－７,,9190,北海道,釧路市,鳥取大通２,,,2021/12/09,,,株式会社はま寿司,遠藤哲郎,03-6833-8032,東京都港区港南２丁目１８番１号,東京都港区港南２丁目１８番１号, ,73073,東京都,港区,港南２,,,その他の食料品製造・加工業,(包装),届出,,008-030_北海道_保健所_食品衛生()_2021年12月_末日,製造業,食料品製造業,その他の食料品製造業,,,,,,,,はま寿司　釧路鳥取大通店,はま寿司釧路鳥取大通店,株式会社はま寿司
届出,コンビニ,セブン－イレブン　標茶駅前店,川上郡標茶町富士１丁目２番２７号  ,川上郡標茶町富士１丁目２番２７号, ,015-485-0707,合同会社繁敬慎,中井慎二,川上郡標茶町富士１丁目３番１９号 ,川上郡標茶町富士１丁目３番１９号, ,0,,2021.12.8,,,釧路保健所,セブン－イレブン　標茶駅前店,015,015-485-0707,,,,川上郡標茶町富士１丁目２番２７号,北海道川上郡標茶町富士１丁目２番２７号, ,22463,北海道,川上郡標茶町,富士１,,,2021/12/08,,,合同会社繁敬慎,中井慎二,,川上郡標茶町富士１丁目３番１９号,北海道川上郡標茶町富士１丁目３番１９号, ,22463,北海道,川上郡標茶町,富士１,,,コンビニエンスストア,,届出,,008-030_北海道_保健所_食品衛生()_2021年12月_末日,卸売業，小売業,飲食料品小売業,その他の飲食料品小売業,コンビニエンスストア（飲食料品を中心とするものに限る）,,,,,,,セブンイレブン　標茶駅前店,セブンイレブン標茶駅前店,合同会社繁敬慎
許可,飲食店営業,ｍｅｌｌｏｗ　ｃｏｆｆｅｅ,釧路市栄町３－２  栄楽街,釧路市栄町３－２,栄楽街,  ,山口綾子,  ,  , ,,  ,2021.12.8,2021.12.8,7-491,,釧路保健所,ｍｅｌｌｏｗ　ｃｏｆｆｅｅ,0154,,,,,釧路市栄町３－２,北海道釧路市栄町３－２,栄楽街,9105,北海道,釧路市,栄町３,,2021/12/08,2021/12/08,,,,山口綾子   ,, ,,,,,,,7-491,,飲食店営業,,許可,,008-030_北海道_保健所_食品衛生()_2021年12月_末日,宿泊業，飲食サービス業,飲食店,,,,,,,,,ｍｅｌｌｏｗ　ｃｏｆｆｅｅ,ｍｅｌｌｏｗｃｏｆｆｅｅ,
届出,野菜果物販売業,釧路水産振興（株）,釧路市大町１－１－１３  ,釧路市大町１－１－１３,,0154-42-1241,釧路水産振興（株）,大貫昭博,釧路市大町１－１－１３ ,釧路市大町１－１－１３,,0154-42-1241,,2021.12.8,,,釧路保健所,釧路水産振興（株）,0154,0154-42-1241,,,,釧路市大町１－１－１３,北海道釧路市大町１－１－１３,,9000,北海道,釧路市,大町１,,,2021/12/08,,,釧路水産振興（株）,大貫昭博,0154-42-1241,釧路市大町１－１－１３,北海道釧路市大町１－１－１３,,9000,北海道,釧路市,大町１,,,野菜果物販売業,,届出,,008-030_北海道_保健所_食品衛生()_2021年12月_末日,卸売業，小売業,飲食料品小売業,野菜・果実小売業,,,,,,,,釧路水産振興株式会社,釧路水産振興株式会社,釧路水産振興株式会社
許可,飲食店営業,ｔａｌｃａｆｅ,釧路市光陽町９－１８  ,釧路市光陽町９－１８,,  ,羽柴政人,  ,  , ,,  ,2021.12.8,2021.12.8,7-492,,釧路保健所,ｔａｌｃａｆｅ,0154,,,,,釧路市光陽町９－１８,北海道釧路市光陽町９－１８,,9084,北海道,釧路市,光陽町,,2021/12/08,2021/12/08,,,,羽柴政人   ,, ,,,,,,,7-492,,飲食店営業,,許可,,008-030_北海道_保健所_食品衛生()_2021年12月_末日,宿泊業，飲食サービス業,飲食店,,,,,,,,,ｔａｌｃａｆｅ,ｔａｌｃａｆｅ,
届出,集団給食施設,社会福祉法人釧路創生会釧路北園啓生園,釧路市北園１丁目１番２７号  ,釧路市北園１丁目１番２７号, ,0154-55-5252,社会福祉法人釧路啓生会,高橋則之,釧路市北園１丁目１番２７号 ,釧路市北園１丁目１番２７号, ,0154-55-5252,,2021.12.7,,,釧路保健所,社会福祉法人釧路創生会釧路北園啓生園,0154,0154-55-5252,,,,釧路市北園１丁目１番２７号,北海道釧路市北園１丁目１番２７号, ,9064,北海道,釧路市,北園１,,,2021/12/07,,,社会福祉法人釧路啓生会,高橋則之,0154-55-5252,釧路市北園１丁目１番２７号,北海道釧路市北園１丁目１番２７号, ,9064,北海道,釧路市,北園１,,,給食施設,,届出,,008-030_北海道_保健所_食品衛生()_2021年12月_末日,宿泊業，飲食サービス業,持ち帰り・配達飲食サービス業,,,,,,,,,社会福祉法人釧路創生会釧路北園啓生園,社会福祉法人釧路創生会釧路北園啓生園,社会福祉法人釧路啓生会
許可,飲食店営業,スナック　Ｈａｖａｎａ,釧路市愛国東２丁目１５－１６  アイランドビル３F-B,釧路市愛国東２丁目１５－１６,アイランドビル３F－B,  ,中谷一美,  ,  , ,,  ,2021.12.7,2021.12.7,7-488,,釧路保健所,スナック　Ｈａｖａｎａ,0154,,,,,釧路市愛国東２丁目１５－１６,北海道釧路市愛国東２丁目１５－１６,アイランドビル３F－B,9320,北海道,釧路市,愛国東２,,2021/12/07,2021/12/07,,,,中谷一美   ,, ,,,,,,,7-488,,飲食店営業,,許可,,008-030_北海道_保健所_食品衛生()_2021年12月_末日,宿泊業，飲食サービス業,飲食店,,,,,,,,,スナック　Ｈａｖａｎａ,スナックＨａｖａｎａ,
許可,飲食店営業,武士道,釧路市愛国東１丁目３６番９号  １F店舗,釧路市愛国東１丁目３６番９号,１F店舗,,白井武司,  ,  , ,,  ,2021.12.7,2021.12.7,7-489,,釧路保健所,武士道,0154,,,,,釧路市愛国東１丁目３６番９号,北海道釧路市愛国東１丁目３６番９号,１F店舗,9319,北海道,釧路市,愛国東１,,2021/12/07,2021/12/07,,,,白井武司   ,, ,,,,,,,7-489,,飲食店営業,,許可,,008-030_北海道_保健所_食品衛生()_2021年12月_末日,宿泊業，飲食サービス業,飲食店,,,,,,,,,武士道,武士道,
許可,飲食店営業,ルナトゥルース,釧路市末広町５丁目１３番地  オリエンタルプラザ６Ｆ,釧路市末広町５丁目１３番地, オリエンタルプラザ６Ｆ,,合同会社ルナ企画,佐藤真弓,釧路市川北町２番２８号 ,釧路市川北町２番２８号, ,0154-25-8424,2021.12.7,2021.12.7,7-490,,釧路保健所,ルナトゥルース,0154,,,,,釧路市末広町５丁目１３番地,北海道釧路市末広町５丁目１３番地, オリエンタルプラザ６Ｆ,9167,北海道,釧路市,末広町５,,2021/12/07,2021/12/07,,,合同会社ルナ企画,佐藤真弓,0154-25-8424,釧路市川北町２番２８号,北海道釧路市川北町２番２８号, ,9047,北海道,釧路市,川北町,7-490,,飲食店営業,,許可,,008-030_北海道_保健所_食品衛生()_2021年12月_末日,宿泊業，飲食サービス業,飲食店,,,,,,,,,ルナトゥルース,ルナトゥルス,合同会社ルナ企画
届出,弁当販売業,道立標茶高校　売店,川上郡標茶町常盤１０－１  道立標茶高校,川上郡標茶町常盤１０－１,道立標茶高校,015-485-2001,三本雅一,  ,  , ,,  ,,2021.12.6,,,釧路保健所,道立標茶高校　売店,015,015-485-2001,,,,川上郡標茶町常盤１０－１,北海道川上郡標茶町常盤１０－１,道立標茶高校,22491,北海道,川上郡標茶町,常盤１０,,,2021/12/06,,,,三本雅一   ,, ,,,,,,,,,弁当販売業,,届出,,008-030_北海道_保健所_食品衛生()_2021年12月_末日,卸売業，小売業,飲食料品小売業,各種食料品小売業,各種食料品小売業,,,,,,,道立標茶高校　売店,道立標茶高校売店,
届出,弁当販売業,町立病院売店　三本販売店,川上郡標茶町開運４－１  町立病院内,川上郡標茶町開運４－１,町立病院内,015-485-2135,三本雅一,  ,  , ,,  ,,2021.12.6,,,釧路保健所,町立病院売店　三本販売店,015,015-485-2135,,,,川上郡標茶町開運４－１,北海道川上郡標茶町開運４－１,町立病院内,22467,北海道,川上郡標茶町,開運４,,,2021/12/06,,,,三本雅一   ,, ,,,,,,,,,弁当販売業,,届出,,008-030_北海道_保健所_食品衛生()_2021年12月_末日,卸売業，小売業,飲食料品小売業,各種食料品小売業,各種食料品小売業,,,,,,,町立病院売店　三本販売店,町立病院売店三本販売店,
届出,その他の食料・飲料販売業,三本販売店,川上郡標茶町川上８－２  ,川上郡標茶町川上８－２,,  ,三本雅一,  ,  , ,,  ,,2021.12.6,,,釧路保健所,三本販売店,015,,,,,川上郡標茶町川上８－２,北海道川上郡標茶町川上８－２,,22479,北海道,川上郡標茶町,川上８,,,2021/12/06,,,,三本雅一   ,, ,,,,,,,,,その他の食料品製造・加工業,(包装),届出,,008-030_北海道_保健所_食品衛生()_2021年12月_末日,製造業,食料品製造業,その他の食料品製造業,,,,,,,,三本販売店,三本販売店,
届出,集団給食施設,保育園キッズランド,釧路市文苑１丁目２２番１７号  ,釧路市文苑１丁目２２番１７号, ,0154-38-6617,（株）キッズランド,芦田泰子,釧路市文苑1丁目22番17号 ,釧路市文苑１丁目２２番１７号, ,0154-38-6617,,2021.12.6,,,釧路保健所,保育園キッズランド,0154,0154-38-6617,,,,釧路市文苑１丁目２２番１７号,北海道釧路市文苑１丁目２２番１７号, ,9341,北海道,釧路市,文苑１,,,2021/12/06,,,（株）キッズランド,芦田泰子,0154-38-6617,釧路市文苑１丁目２２番１７号,北海道釧路市文苑１丁目２２番１７号, ,9341,北海道,釧路市,文苑１,,,給食施設,,届出,,008-030_北海道_保健所_食品衛生()_2021年12月_末日,宿泊業，飲食サービス業,持ち帰り・配達飲食サービス業,,,,,,,,,保育園キッズランド,保育園キッズランド,株式会社キッズランド
