届出,コンビニエンスストア,日高町立門別国民健康保険病院,沙流郡日高町門別本町29-9,沙流郡日高町門別本町２９－９,,01456-2-0168,合同会社中山商事,高倉初美,沙流郡日高町富川北2-5-21,沙流郡日高町富川北２－５－２１,,01456-2-2326,2021/12/17,,,,静内保健所,日高町立門別国民健康保険病院,01456,01456-2-0168,,,,沙流郡日高町門別本町２９－９,北海道沙流郡日高町門別本町２９－９,,21755,北海道,沙流郡日高町,門別本町,,2021/12/17,,,,合同会社中山商事,高倉初美,01456-2-2326,沙流郡日高町富川北２－５－２１,北海道沙流郡日高町富川北２－５－２１,,21724,北海道,沙流郡日高町,富川北２,,,コンビニエンスストア,,届出,,008-030_北海道_保健所_食品衛生()_2021年12月_末日,卸売業，小売業,飲食料品小売業,その他の飲食料品小売業,コンビニエンスストア（飲食料品を中心とするものに限る）,,,,,,,日高町立門別国民健康保険病院,日高町立門別国民健康保険病院,合同会社中山商事
届出,コンビニエンスストア,日高町立富川国民健康保険診療所売店,沙流郡日高町富川北6-3-26,沙流郡日高町富川北６－３－２６,,01456-2-0168,合同会社中山商事,高倉初美,沙流郡日高町富川北2-5-21,沙流郡日高町富川北２－５－２１,,01456-2-2326,2021/12/17,,,,静内保健所,日高町立富川国民健康保険診療所売店,01456,01456-2-0168,,,,沙流郡日高町富川北６－３－２６,北海道沙流郡日高町富川北６－３－２６,,21728,北海道,沙流郡日高町,富川北６,,2021/12/17,,,,合同会社中山商事,高倉初美,01456-2-2326,沙流郡日高町富川北２－５－２１,北海道沙流郡日高町富川北２－５－２１,,21724,北海道,沙流郡日高町,富川北２,,,コンビニエンスストア,,届出,,008-030_北海道_保健所_食品衛生()_2021年12月_末日,卸売業，小売業,飲食料品小売業,その他の飲食料品小売業,コンビニエンスストア（飲食料品を中心とするものに限る）,,,,,,,日高町立富川国民健康保険診療所売店,日高町立富川国民健康保険診療所売店,合同会社中山商事
届出,その他の食料・飲料販売業,サーティワン帯広イトーヨーカドー店,帯広市稲田町南８線西１０－１イトーヨ－カドー帯広店,帯広市稲田町南８線西１０－１,イトーヨーカドー帯広店,0155-48-0380,株式会社ルーキーファーム,加藤祐功,帯広市西５条南３４丁目１２番地,帯広市西５条南３４丁目１２番地,,0155-47-1032,2021.12.28,2021.12.28,,,帯広保健所,サーティワン帯広イトーヨーカドー店,0155,0155-48-0380,,,,帯広市稲田町南８線西１０－１,北海道帯広市稲田町南８線西１０－１,イトーヨーカドー帯広店,9498,北海道,帯広市,稲田町,,2021/12/28,2021/12/28,,,株式会社ルーキーファーム,加藤祐功,0155-47-1032,帯広市西５条南３４丁目１２番地,北海道帯広市西五条南３４丁目１２番地,,9830,北海道,帯広市,西五条南３４,,,その他の食料品製造・加工業,(包装),届出,,008-030_北海道_保健所_食品衛生()_2021年12月_末日,製造業,食料品製造業,その他の食料品製造業,,,,,,,,サーティワン帯広イトーヨーカドー店,サティワン帯広イトヨカド店,株式会社ルーキーファーム
許可,飲食店営業,３１（サブイチ）,足寄郡足寄町南３条１丁目３１番地,足寄郡足寄町南３条１丁目３１番地,,,沼田紀行,,,,,,2021.12.28,2021.12.28,十保生15-719,,帯広保健所,３１（サブイチ）,0156,,,,,足寄郡足寄町南３条１丁目３１番地,北海道足寄郡足寄町南三条１丁目３１番地,,23989,北海道,足寄郡足寄町,南三条１,,2021/12/28,2021/12/28,,,,沼田紀行 ,,,,,,,,,十保生15-719,,飲食店営業,,許可,,008-030_北海道_保健所_食品衛生()_2021年12月_末日,宿泊業，飲食サービス業,飲食店,,,,,,,,,３１（サブイチ）,３１サブイチ,
許可,飲食店営業,支邦そば寅丸,帯広市西１条南８丁目１２番地八丁堀内,帯広市西１条南８丁目１２番地,八丁堀内,,出口隆久,,,,,,2021.12.23,2021.12.23,十保生15-716,,帯広保健所,支邦そば寅丸,0155,,,,,帯広市西１条南８丁目１２番地,北海道帯広市西一条南８丁目１２番地,八丁堀内,9633,北海道,帯広市,西一条南８,,2021/12/23,2021/12/23,,,,出口隆久 ,,,,,,,,,十保生15-716,,飲食店営業,,許可,,008-030_北海道_保健所_食品衛生()_2021年12月_末日,宿泊業，飲食サービス業,飲食店,,,,,,,,,支邦そば寅丸,支邦そば寅丸,
許可,飲食店営業,クレココ,帯広市西１条南１０丁目１，３，５番地五番館ビル２階,帯広市西１条南１０丁目１，３，５番地,五番館ビル２階,,徳村磨依,,,,,,2021.12.23,2021.12.23,十保生15-717,,帯広保健所,クレココ,0155,,,,,帯広市西１条南１０丁目１，３，５番地,北海道帯広市西一条南１０丁目１，３，５番地,五番館ビル２階,9635,北海道,帯広市,西一条南１０,,2021/12/23,2021/12/23,,,,徳村磨依 ,,,,,,,,,十保生15-717,,飲食店営業,,許可,,008-030_北海道_保健所_食品衛生()_2021年12月_末日,宿泊業，飲食サービス業,飲食店,,,,,,,,,クレココ,クレココ,
許可,飲食店営業,Ｃｌａｎ,帯広市西１条南１０丁目１１番地ライオンビル福原館２階２０９号室,帯広市西１条南１０丁目１１番地,ライオンビル福原館２階２０９号室,,吉川祐太,,,,,,2021.12.23,2021.12.23,十保生15-718,,帯広保健所,Ｃｌａｎ,0155,,,,,帯広市西１条南１０丁目１１番地,北海道帯広市西一条南１０丁目１１番地,ライオンビル福原館２階２０９号室,9635,北海道,帯広市,西一条南１０,,2021/12/23,2021/12/23,,,,吉川祐太 ,,,,,,,,,十保生15-718,,飲食店営業,,許可,,008-030_北海道_保健所_食品衛生()_2021年12月_末日,宿泊業，飲食サービス業,飲食店,,,,,,,,,Ｃｌａｎ,Ｃｌａｎ,
届出,器具、容器包装の製造・加工業,大成ベルト工販株式会社,帯広市西９条南１丁目６番地,帯広市西９条南１丁目６番地,,0155-35-7161,大成ベルト工販株式会社,岸龍吉,帯広市西９条南１丁目６番地,帯広市西９条南１丁目６番地,,0155-35-7161,2021.12.23,2021.12.23,,,帯広保健所,大成ベルト工販株式会社,0155,0155-35-7161,,,,帯広市西９条南１丁目６番地,北海道帯広市西九条南１丁目６番地,,9982,北海道,帯広市,西九条南１,,2021/12/23,2021/12/23,,,大成ベルト工販株式会社,岸龍吉,0155-35-7161,帯広市西９条南１丁目６番地,北海道帯広市西九条南１丁目６番地,,9982,北海道,帯広市,西九条南１,,,器具・容器・おもちゃ製造業,,届出,,008-030_北海道_保健所_食品衛生()_2021年12月_末日,製造業,プラスチック製品製造業（別掲を除く）,,,,,,,,,大成ベルト工販株式会社,大成ベルト工販株式会社,大成ベルト工販株式会社
届出,その他の食料・飲料販売業,マッシングワークス,河東郡鹿追町瓜幕西３１線２５,河東郡鹿追町瓜幕西３１線２５,,,滝田武志,,,,,,2021.12.23,2021.12.23,,,帯広保健所,マッシングワークス,0156,,,,,河東郡鹿追町瓜幕西３１線２５,北海道河東郡鹿追町瓜幕西３１線２５,,23561,北海道,河東郡鹿追町,瓜幕西３,,2021/12/23,2021/12/23,,,,滝田武志 ,,,,,,,,,,,その他の食料品製造・加工業,(包装),届出,,008-030_北海道_保健所_食品衛生()_2021年12月_末日,製造業,食料品製造業,その他の食料品製造業,,,,,,,,マッシングワークス,マッシングワクス,
届出,集団給食施設,新得町立富村牛小中学校,上川郡新得町屈足トムラウシ２５７,上川郡新得町屈足トムラウシ２５７,,0156-65-3064,新得町,浜田正利,上川郡新得町３条南１丁目２６番地,上川郡新得町３条南１丁目２６番地,,0156-64-5111,2021.12.23,2021.12.23,,,帯広保健所,新得町立富村牛小中学校,0156,0156-65-3064,,,,上川郡新得町屈足トムラウシ２５７,北海道上川郡新得町屈足トムラウシ２５７,,19112,北海道,上川郡新得町,屈足,,2021/12/23,2021/12/23,,,,新得町 浜田正利,0156-64-5111,上川郡新得町３条南１丁目２６番地,北海道上川郡新得町三条南１丁目２６番地,,19643,北海道,上川郡新得町,三条南１,,,給食施設,,届出,,008-030_北海道_保健所_食品衛生()_2021年12月_末日,宿泊業，飲食サービス業,持ち帰り・配達飲食サービス業,,,,,,,,,新得町立富村牛小中学校,新得町立富村牛小中学校,
届出,コーヒー製造・加工業,ＪＩＲＯ　ＣＯＦＦＥＥ,上川郡新得町上佐幌西１線３８－１９,上川郡新得町上佐幌西１線３８－１９,,,石栗優,,,,,,2021.12.23,2021.12.23,,,帯広保健所,ＪＩＲＯ　ＣＯＦＦＥＥ,0156,,,,,上川郡新得町上佐幌西１線３８－１９,北海道上川郡新得町上佐幌西１線３８－１９,,19111,北海道,上川郡新得町,上佐幌,,2021/12/23,2021/12/23,,,,石栗優 ,,,,,,,,,,,コーヒー製造・加工業,,届出,,008-030_北海道_保健所_食品衛生()_2021年12月_末日,製造業,飲料・たばこ・飼料製造業,茶・コーヒー製造業（清涼飲料を除く）,コーヒー製造業,,,,,,,ＪＩＲＯ　ＣＯＦＦＥＥ,ＪＩＲＯＣＯＦＦＥＥ,
許可,菓子製造業,旬菜まさゆめ,帯広市西２０条南４丁目２０－７,帯広市西２０条南４丁目２０－７,,0155-41-3030,有限会社オオミチフーズ,代表取締役大道昌博,帯広市西１９条南４丁目１８－２０,帯広市西１９条南４丁目１８－２０,,0155-58-2317,2021.12.22,2021.12.22,十保生15-714,,帯広保健所,旬菜まさゆめ,0155,0155-41-3030,,,,帯広市西２０条南４丁目２０－７,北海道帯広市西二十条南４丁目２０－７,,10358,北海道,帯広市,西二十条南４,,2021/12/22,2021/12/22,,,有限会社オオミチフーズ,代表取締役大道昌博,0155-58-2317,帯広市西１９条南４丁目１８－２０,北海道帯広市西十九条南４丁目１８－２０,,10341,北海道,帯広市,西十九条南４,十保生15-714,,菓子製造業,,許可,,008-030_北海道_保健所_食品衛生()_2021年12月_末日,製造業,食料品製造業,,,,,,,,,旬菜まさゆめ,旬菜まさゆめ,有限会社オオミチフーズ
許可,冷凍食品製造業,旬菜まさゆめ,帯広市西２０条南４丁目２０－７,帯広市西２０条南４丁目２０－７,,0155-41-3030,有限会社オオミチフーズ,代表取締役大道昌博,帯広市西１９条南４丁目１８－２０,帯広市西１９条南４丁目１８－２０,,0155-58-2317,2021.12.22,2021.12.22,十保生15-714,,帯広保健所,旬菜まさゆめ,0155,0155-41-3030,,,,帯広市西２０条南４丁目２０－７,北海道帯広市西二十条南４丁目２０－７,,10358,北海道,帯広市,西二十条南４,,2021/12/22,2021/12/22,,,有限会社オオミチフーズ,代表取締役大道昌博,0155-58-2317,帯広市西１９条南４丁目１８－２０,北海道帯広市西十九条南４丁目１８－２０,,10341,北海道,帯広市,西十九条南４,十保生15-714,,冷凍食品製造業,,許可,,008-030_北海道_保健所_食品衛生()_2021年12月_末日,製造業,食料品製造業,,,,,,,,,旬菜まさゆめ,旬菜まさゆめ,有限会社オオミチフーズ
許可,飲食店営業,マイペース,全道一円,全道一円,,,長野秀昭,,,,,,2021.12.22,2021.12.22,十保生15-715,,帯広保健所,マイペース,,,,,,全道一円,北海道全道一円,,,北海道,,,,2021/12/22,2021/12/22,,,,長野秀昭 ,,,,,,,,,十保生15-715,,飲食店営業,,許可,,008-030_北海道_保健所_食品衛生()_2021年12月_末日,宿泊業，飲食サービス業,飲食店,,,,,,,,,マイペース,マイペス,
届出,野菜果物販売業,ＪＡ忠類農畜産物直売所ベジタ,中川郡幕別町忠類白銀町３８３－８,中川郡幕別町忠類白銀町３８３－８,,01558-8-3303,忠類農業協同組合,蛯原一治,中川郡幕別町忠類栄町２５９番地,中川郡幕別町忠類栄町２５９番地,,01558-8-2311,2021.12.21,2021.12.21,,,帯広保健所,ＪＡ忠類農畜産物直売所ベジタ,01558,01558-8-3303,,,,中川郡幕別町忠類白銀町３８３－８,北海道中川郡幕別町忠類白銀町３８３－８,,20313,北海道,中川郡幕別町,忠類白銀町,,2021/12/21,2021/12/21,,,忠類農業協同組合,蛯原一治,01558-8-2311,中川郡幕別町忠類栄町２５９番地,北海道中川郡幕別町忠類栄町２５９番地,,20312,北海道,中川郡幕別町,忠類栄町,,,野菜果物販売業,,届出,,008-030_北海道_保健所_食品衛生()_2021年12月_末日,卸売業，小売業,飲食料品小売業,野菜・果実小売業,,,,,,,,ＪＡ忠類農畜産物直売所ベジタ,ＪＡ忠類農畜産物直売所ベジタ,忠類農業協同組合
届出,その他の食料品製造・加工業,ＪＡ忠類農畜産物直売所ベジタ,中川郡幕別町忠類白銀町３８３－８,中川郡幕別町忠類白銀町３８３－８,,01558-8-3303,忠類農業協同組合,蛯原一治,中川郡幕別町忠類栄町２５９番地,中川郡幕別町忠類栄町２５９番地,,01558-8-2311,2021.12.21,2021.12.21,,,帯広保健所,ＪＡ忠類農畜産物直売所ベジタ,01558,01558-8-3303,,,,中川郡幕別町忠類白銀町３８３－８,北海道中川郡幕別町忠類白銀町３８３－８,,20313,北海道,中川郡幕別町,忠類白銀町,,2021/12/21,2021/12/21,,,忠類農業協同組合,蛯原一治,01558-8-2311,中川郡幕別町忠類栄町２５９番地,北海道中川郡幕別町忠類栄町２５９番地,,20312,北海道,中川郡幕別町,忠類栄町,,,その他の食料品製造・加工業,,届出,,008-030_北海道_保健所_食品衛生()_2021年12月_末日,製造業,食料品製造業,その他の食料品製造業,,,,,,,,ＪＡ忠類農畜産物直売所ベジタ,ＪＡ忠類農畜産物直売所ベジタ,忠類農業協同組合
許可,飲食店営業,スイーツヒンナパイホリック,全道一円,全道一円,,,森田節子,,,,,,2021.12.20,2021.12.20,十保生15-713,,帯広保健所,スイーツヒンナパイホリック,,,,,,全道一円,北海道全道一円,,,北海道,,,,2021/12/20,2021/12/20,,,,森田節子 ,,,,,,,,,十保生15-713,,飲食店営業,,許可,,008-030_北海道_保健所_食品衛生()_2021年12月_末日,宿泊業，飲食サービス業,飲食店,,,,,,,,,スイーツヒンナパイホリック,スイツヒンナパイホリック,
届出,野菜果物販売業,北新ケータリング,帯広市西１６条南１丁目４８－１８マルハン柏林台店内,帯広市西１６条南１丁目４８－１８,マルハン柏林台店内,,北新化工有限会社,栢谷隆司,札幌市白石区東米里２０９３－１９４,札幌市白石区東米里２０９３－１９４,,011-876-1140,2021.12.7,2021.12.17,,,帯広保健所,北新ケータリング,0155,,,,,帯広市西１６条南１丁目４８－１８,北海道帯広市西十六条南１丁目４８－１８,マルハン柏林台店内,10264,北海道,帯広市,西十六条南１,,2021/12/07,2021/12/17,,,北新化工有限会社,栢谷隆司,011-876-1140,札幌市白石区東米里２０９３－１９４,北海道札幌市白石区東米里２０９３－１９４,,3524,北海道,札幌市白石区,東米里,,,野菜果物販売業,,届出,,008-030_北海道_保健所_食品衛生()_2021年12月_末日,卸売業，小売業,飲食料品小売業,野菜・果実小売業,,,,,,,,北新ケータリング,北新ケタリング,北新化工有限会社
許可,菓子製造業,夢乃ブランジェ,帯広市大通９丁目１９－３,帯広市大通９丁目１９－３,,,成瀬夢路,,,,,,2021.12.17,2021.12.17,十保生15-710,,帯広保健所,夢乃ブランジェ,0155,,,,,帯広市大通９丁目１９－３,北海道帯広市大通南９丁目１９－３,,9523,北海道,帯広市,大通南９,,2021/12/17,2021/12/17,,,,成瀬夢路 ,,,,,,,,,十保生15-710,,菓子製造業,,許可,,008-030_北海道_保健所_食品衛生()_2021年12月_末日,製造業,食料品製造業,,,,,,,,,夢乃ブランジェ,夢乃ブランジェ,
許可,飲食店営業,ぶた野家,帯広市西８条南１１丁目１－２,帯広市西８条南１１丁目１－２,,0155-65-0801,株式会社ぶた野家,西本孝二,帯広市白樺１６条西３丁目１５番地,帯広市白樺１６条西３丁目１５番地,,,2021.12.17,2021.12.17,十保生15-712,,帯広保健所,ぶた野家,0155,0155-65-0801,,,,帯広市西８条南１１丁目１－２,北海道帯広市西八条南１１丁目１－２,,9949,北海道,帯広市,西八条南１１,,2021/12/17,2021/12/17,,,株式会社ぶた野家,西本孝二,,帯広市白樺１６条西３丁目１５番地,北海道帯広市白樺十六条西３丁目１５番地,,9559,北海道,帯広市,白樺十六条西３,十保生15-712,,飲食店営業,,許可,,008-030_北海道_保健所_食品衛生()_2021年12月_末日,宿泊業，飲食サービス業,飲食店,,,,,,,,,ぶた野家,ぶた野家,株式会社ぶた野家
許可,食肉販売業,ぶた野家,帯広市西８条南１１丁目１－２,帯広市西８条南１１丁目１－２,,0155-65-0801,株式会社ぶた野家,西本孝二,帯広市白樺１６条西３丁目１５番地,帯広市白樺１６条西３丁目１５番地,,,2021.12.17,2021.12.17,十保生15-712,,帯広保健所,ぶた野家,0155,0155-65-0801,,,,帯広市西８条南１１丁目１－２,北海道帯広市西八条南１１丁目１－２,,9949,北海道,帯広市,西八条南１１,,2021/12/17,2021/12/17,,,株式会社ぶた野家,西本孝二,,帯広市白樺１６条西３丁目１５番地,北海道帯広市白樺十六条西３丁目１５番地,,9559,北海道,帯広市,白樺十六条西３,十保生15-712,,食肉販売業,,許可,,008-030_北海道_保健所_食品衛生()_2021年12月_末日,卸売業，小売業,飲食料品小売業,食肉小売業,,,,,,,,ぶた野家,ぶた野家,株式会社ぶた野家
許可,冷凍食品製造業,美珍樓工場,帯広市西１６条南４丁目３２－９,帯広市西１６条南４丁目３２－９,,,有限会社美珍樓,代表取締役鈴木一正,帯広市白樺１６条西１６丁目７番地,帯広市白樺１６条西１６丁目７番地,,0155-34-7443,2021.12.17,2021.12.17,十保生15-711,,帯広保健所,美珍樓工場,0155,,,,,帯広市西１６条南４丁目３２－９,北海道帯広市西十六条南４丁目３２－９,,10267,北海道,帯広市,西十六条南４,,2021/12/17,2021/12/17,,,有限会社美珍樓,代表取締役鈴木一正,0155-34-7443,帯広市白樺１６条西１６丁目７番地,北海道帯広市白樺十六条西１６丁目７番地,,9572,北海道,帯広市,白樺十六条西１６,十保生15-711,,冷凍食品製造業,,許可,,008-030_北海道_保健所_食品衛生()_2021年12月_末日,製造業,食料品製造業,,,,,,,,,美珍樓工場,美珍樓工場,有限会社美珍樓
届出,集団給食施設,ぷちとまとほいくえんスマイル,帯広市西２０条南２丁目３６－５,帯広市西２０条南２丁目３６－５,,,株式会社イーク,上野美幸,帯広市新町東１２丁目１７番地,帯広市新町東１２丁目１７番地,,0155-67-8726,2021.12.16,2021.12.16,,,帯広保健所,ぷちとまとほいくえんスマイル,0155,,,,,帯広市西２０条南２丁目３６－５,北海道帯広市西二十条南２丁目３６－５,,10356,北海道,帯広市,西二十条南２,,2021/12/16,2021/12/16,,,株式会社イーク,上野美幸,0155-67-8726,帯広市新町東１２丁目１７番地,北海道帯広市新町東１２丁目１７番地,,9617,北海道,帯広市,新町東１２,,,給食施設,,届出,,008-030_北海道_保健所_食品衛生()_2021年12月_末日,宿泊業，飲食サービス業,持ち帰り・配達飲食サービス業,,,,,,,,,ぷちとまとほいくえんスマイル,ぷちとまとほいくえんスマイル,株式会社イーク
届出,集団給食施設,ぷちとまとほいくえん,帯広市新町東１２丁目１７番地,帯広市新町東１２丁目１７番地,,,株式会社イーク,上野美幸,帯広市新町東１２丁目１７番地,帯広市新町東１２丁目１７番地,,0155-67-8726,2021.12.16,2021.12.16,,,帯広保健所,ぷちとまとほいくえん,0155,,,,,帯広市新町東１２丁目１７番地,北海道帯広市新町東１２丁目１７番地,,9617,北海道,帯広市,新町東１２,,2021/12/16,2021/12/16,,,株式会社イーク,上野美幸,0155-67-8726,帯広市新町東１２丁目１７番地,北海道帯広市新町東１２丁目１７番地,,9617,北海道,帯広市,新町東１２,,,給食施設,,届出,,008-030_北海道_保健所_食品衛生()_2021年12月_末日,宿泊業，飲食サービス業,持ち帰り・配達飲食サービス業,,,,,,,,,ぷちとまとほいくえん,ぷちとまとほいくえん,株式会社イーク
届出,コンビニエンスストア,セブンイレブン帯広西５条南１８丁目店,帯広市西５条南１８丁目２－１,帯広市西５条南１８丁目２－１,,,河瀨悦啓,,,,,,2021.12.16,2021.12.16,,,帯広保健所,セブンイレブン帯広西５条南１８丁目店,0155,,,,,帯広市西５条南１８丁目２－１,北海道帯広市西五条南１８丁目２－１,,9814,北海道,帯広市,西五条南１８,,2021/12/16,2021/12/16,,,,河瀨悦啓 ,,,,,,,,,,,コンビニエンスストア,,届出,,008-030_北海道_保健所_食品衛生()_2021年12月_末日,卸売業，小売業,飲食料品小売業,その他の飲食料品小売業,コンビニエンスストア（飲食料品を中心とするものに限る）,,,,,,,セブンイレブン帯広西５条南１８丁目店,セブンイレブン帯広西５条南１８丁目店,
届出,野菜果物販売業,十勝亭,上川郡清水町字清水４３７番地５,上川郡清水町字清水４３７番地５,,0156-62-4121,株式会社山下観光,山下和彦,河東郡音更町十勝川温泉南１４丁目１番地,河東郡音更町十勝川温泉南１４丁目１番地,,0155-46-2201,2021.12.16,2021.12.16,,,帯広保健所,十勝亭,0156,0156-62-4121,,,,上川郡清水町字清水４３７番地５,北海道上川郡清水町字清水４３７番地５,,19031,北海道,上川郡清水町,清水,,2021/12/16,2021/12/16,,,株式会社山下観光,山下和彦,0155-46-2201,河東郡音更町十勝川温泉南１４丁目１番地,北海道河東郡音更町十勝川温泉南１４丁目１番地,,23423,北海道,河東郡音更町,十勝川温泉南１４,,,野菜果物販売業,,届出,,008-030_北海道_保健所_食品衛生()_2021年12月_末日,卸売業，小売業,飲食料品小売業,野菜・果実小売業,,,,,,,,十勝亭,十勝亭,株式会社山下観光
届出,その他の食料・飲料販売業,はま寿司帯広大通店,帯広市大通南７丁目１０番地,帯広市大通南７丁目１０番地,,0155-20-7030,株式会社はま寿司,代表取締役遠藤哲郎,東京都港区港南２丁目１８－１,東京都港区港南２丁目１８－１,,03-6833-8032,2021.12.15,2021.12.15,,,帯広保健所,はま寿司帯広大通店,0155,0155-20-7030,,,,帯広市大通南７丁目１０番地,北海道帯広市大通南７丁目１０番地,,9521,北海道,帯広市,大通南７,,2021/12/15,2021/12/15,,,株式会社はま寿司,代表取締役遠藤哲郎,03-6833-8032,東京都港区港南２丁目１８－１,東京都港区港南２丁目１８－１,,73073,東京都,港区,港南２,,,その他の食料品製造・加工業,(包装),届出,,008-030_北海道_保健所_食品衛生()_2021年12月_末日,製造業,食料品製造業,その他の食料品製造業,,,,,,,,はま寿司帯広大通店,はま寿司帯広大通店,株式会社はま寿司
届出,その他の食料・飲料販売業,はま寿司帯広西店,帯広市西１８条南４丁目１－２４,帯広市西１８条南４丁目１－２４,,0155-58-1666,株式会社はま寿司,代表取締役遠藤哲郎,東京都港区港南２丁目１８－１,東京都港区港南２丁目１８－１,,03-6833-8032,2021.12.15,2021.12.15,,,帯広保健所,はま寿司帯広西店,0155,0155-58-1666,,,,帯広市西１８条南４丁目１－２４,北海道帯広市西十八条南４丁目１－２４,,10317,北海道,帯広市,西十八条南４,,2021/12/15,2021/12/15,,,株式会社はま寿司,代表取締役遠藤哲郎,03-6833-8032,東京都港区港南２丁目１８－１,東京都港区港南２丁目１８－１,,73073,東京都,港区,港南２,,,その他の食料品製造・加工業,(包装),届出,,008-030_北海道_保健所_食品衛生()_2021年12月_末日,製造業,食料品製造業,その他の食料品製造業,,,,,,,,はま寿司帯広西店,はま寿司帯広西店,株式会社はま寿司
