届出,その他の食料・飲料販売業,株式会社　丸北北都女満別空港支店,網走郡大空町女満別中央201-3女満別空港内,網走郡大空町女満別中央２０１－３,女満別空港内,0152-74-3015,株式会社　丸北北都,須藤美和,網走市南四条西3丁目7番地,網走市南四条西３丁目７番地,,0152-44-5526,2021/12/14,,,,網走保健所,株式会社　丸北北都女満別空港支店,0152,0152-74-3015,,,,網走郡大空町女満別中央２０１－３,北海道網走郡大空町女満別中央２０１－３,女満別空港内,21124,北海道,網走郡大空町,女満別中央,,2021/12/14,,,,株式会社　丸北北都,須藤美和,0152-44-5526,網走市南四条西３丁目７番地,北海道網走市南四条西３丁目７番地,,12412,北海道,網走市,南四条西３,,,その他の食料品製造・加工業,(包装),届出,,008-030_北海道_保健所_食品衛生()_2021年12月_末日,製造業,食料品製造業,その他の食料品製造業,,,,,,,,株式会社丸北北都女満別空港支店,株式会社丸北北都女満別空港支店,株式会社丸北北都
届出,魚介類販売業（包装済みの魚介類のみの販売）,精肉店　肉将,網走郡大空町東藻琴84-1,網走郡大空町東藻琴８４－１,,0152-63-5529,株式会社　Ｂｉｇ　Ｂｒｉｄｇｅ,大橋　遼太,網走郡大空町東藻琴344番地の16,網走郡大空町東藻琴３４４番地の１６,,0152-63-5529,2021/12/14,,,,網走保健所,精肉店　肉将,0152,0152-63-5529,,,,網走郡大空町東藻琴８４－１,北海道網走郡大空町東藻琴８４－１,,21095,北海道,網走郡大空町,東藻琴,,2021/12/14,,,,株式会社　Ｂｉｇ　Ｂｒｉｄｇｅ,大橋　遼太,0152-63-5529,網走郡大空町東藻琴３４４番地の１６,北海道網走郡大空町東藻琴３４４番地ノ１６,,21095,北海道,網走郡大空町,東藻琴,,,魚介類販売業,包装済みの魚介類のみの販売,届出,,008-030_北海道_保健所_食品衛生()_2021年12月_末日,卸売業，小売業,飲食料品小売業,,,,,,,,,精肉店　肉将,精肉店肉将,株式会社Ｂｉｇ　Ｂｒｉｄｇｅ
届出,その他の食料・飲料販売業,精肉店　肉将,網走郡大空町東藻琴84-1,網走郡大空町東藻琴８４－１,,0152-63-5529,株式会社　Ｂｉｇ　Ｂｒｉｄｇｅ,大橋　遼太,網走郡大空町東藻琴344番地の16,網走郡大空町東藻琴３４４番地の１６,,0152-63-5529,2021/12/14,,,,網走保健所,精肉店　肉将,0152,0152-63-5529,,,,網走郡大空町東藻琴８４－１,北海道網走郡大空町東藻琴８４－１,,21095,北海道,網走郡大空町,東藻琴,,2021/12/14,,,,株式会社　Ｂｉｇ　Ｂｒｉｄｇｅ,大橋　遼太,0152-63-5529,網走郡大空町東藻琴３４４番地の１６,北海道網走郡大空町東藻琴３４４番地ノ１６,,21095,北海道,網走郡大空町,東藻琴,,,その他の食料品製造・加工業,(包装),届出,,008-030_北海道_保健所_食品衛生()_2021年12月_末日,製造業,食料品製造業,その他の食料品製造業,,,,,,,,精肉店　肉将,精肉店肉将,株式会社Ｂｉｇ　Ｂｒｉｄｇｅ
届出,集団給食施設,大空町認定こども園めまんべつ,網走郡大空町女満別中央341-1,網走郡大空町女満別中央３４１－１,,0152-77-3371,社会福祉法人　大空町社会福祉協議会,鈴木　武昭,網走郡大空町女満別西一条3丁目2番5号,網走郡大空町女満別西一条３丁目２番５号,,0152-75-6021,2021/12/17,,,,網走保健所,大空町認定こども園めまんべつ,0152,0152-77-3371,,,,網走郡大空町女満別中央３４１－１,北海道網走郡大空町女満別中央３４１－１,,21124,北海道,網走郡大空町,女満別中央,,2021/12/17,,,,社会福祉法人　大空町社会福祉協議会,鈴木　武昭,0152-75-6021,網走郡大空町女満別西一条３丁目２番５号,北海道網走郡大空町女満別西一条３丁目２番５号,,21135,北海道,網走郡大空町,女満別西一条３,,,給食施設,,届出,,008-030_北海道_保健所_食品衛生()_2021年12月_末日,宿泊業，飲食サービス業,持ち帰り・配達飲食サービス業,,,,,,,,,大空町認定こども園めまんべつ,大空町認定こども園めまんべつ,社会福祉法人大空町社会福祉協議会
届出,集団給食施設,大空町認定こども園ひがしもこと,網走郡大空町東藻琴389-54,網走郡大空町東藻琴３８９－５４,,0152-67-6301,社会福祉法人　大空町社会福祉協議会,鈴木　武昭,網走郡大空町女満別西一条3丁目2番5号,網走郡大空町女満別西一条３丁目２番５号,,0152-75-6021,2021/12/17,,,,網走保健所,大空町認定こども園ひがしもこと,0152,0152-67-6301,,,,網走郡大空町東藻琴３８９－５４,北海道網走郡大空町東藻琴３８９－５４,,21095,北海道,網走郡大空町,東藻琴,,2021/12/17,,,,社会福祉法人　大空町社会福祉協議会,鈴木　武昭,0152-75-6021,網走郡大空町女満別西一条３丁目２番５号,北海道網走郡大空町女満別西一条３丁目２番５号,,21135,北海道,網走郡大空町,女満別西一条３,,,給食施設,,届出,,008-030_北海道_保健所_食品衛生()_2021年12月_末日,宿泊業，飲食サービス業,持ち帰り・配達飲食サービス業,,,,,,,,,大空町認定こども園ひがしもこと,大空町認定こども園ひがしもこと,社会福祉法人大空町社会福祉協議会
届出,集団給食施設,日本フードパッカー株式会社  道東工場 ,網走市藻琴35-1,網走市藻琴３５－１,,,日本フードパッカー株式会社,吉原洋明,上北郡おいらせ町松原2-132-35,上北郡おいらせ町松原２－１３２－３５,,03-4555-8246,2021/12/16,,,,網走保健所,日本フードパッカー株式会社  道東工場 ,0152,,,,,網走市藻琴３５－１,北海道網走市藻琴３５－１,,12488,北海道,網走市,藻琴,,2021/12/16,,,,日本フードパッカー株式会社,吉原洋明,03-4555-8246,上北郡おいらせ町松原２－１３２－３５,青森県上北郡おいらせ町松原２－１３２－３５,,28877,青森県,上北郡おいらせ町,松原２,,,給食施設,,届出,,008-030_北海道_保健所_食品衛生()_2021年12月_末日,宿泊業，飲食サービス業,持ち帰り・配達飲食サービス業,,,,,,,,,日本フードパッカー株式会社道東工場　,日本フドパッカ株式会社道東工場,日本フードパッカー株式会社
届出,コンビニエンスストア,ローソン網走厚生病院店,網走市北六条西1-9,網走市北六条西１－９,,0152-43-6120,株式会社アインファーマシーズ,大石美也,札幌市白石区東札幌五条2丁目4番30号 ,札幌市白石区東札幌五条２丁目４番３０号, ,011-814-1000,2021/12/22,,,,網走保健所,ローソン網走厚生病院店,0152,0152-43-6120,,,,網走市北六条西１－９,北海道網走市北六条西１－９,,12277,北海道,網走市,北六条西１,,2021/12/22,,,,株式会社アインファーマシーズ,大石美也,011-814-1000,札幌市白石区東札幌五条２丁目４番３０号,北海道札幌市白石区東札幌五条２丁目４番３０号, ,3513,北海道,札幌市白石区,東札幌五条２,,,コンビニエンスストア,,届出,,008-030_北海道_保健所_食品衛生()_2021年12月_末日,卸売業，小売業,飲食料品小売業,その他の飲食料品小売業,コンビニエンスストア（飲食料品を中心とするものに限る）,,,,,,,ローソン網走厚生病院店,ロソン網走厚生病院店,株式会社アインファーマシーズ
届出,農産保存食料品製造・加工業,たけのぶ小果実園,網走郡大空町女満別本郷22-16,網走郡大空町女満別本郷２２－１６,,,武信利明,,,,,,2021/12/17,,,,網走保健所,たけのぶ小果実園,0152,,,,,網走郡大空町女満別本郷２２－１６,北海道網走郡大空町女満別本郷２２－１６,,21175,北海道,網走郡大空町,女満別本郷,,2021/12/17,,,,,武信利明 ,,,,,,,,,,,農産保存食料品製造・加工業,,届出,,008-030_北海道_保健所_食品衛生()_2021年12月_末日,製造業,食料品製造業,野菜缶詰・果実缶詰・農産保存食料品製造業,,,,,,,,たけのぶ小果実園,たけのぶ小果実園,
届出,弁当販売業,モリヤ商店,網走市新町2JR網走駅構内,網走市新町２,JR網走駅構内,0152-44-5870,株式会社　モリヤ商店,守屋靖太良,網走市新町1丁目2番14号,網走市新町１丁目２番１４号,,0152-43-2015,2021/12/16,,,,網走保健所,モリヤ商店,0152,0152-44-5870,,,,網走市新町２,北海道網走市新町２,JR網走駅構内,12351,北海道,網走市,新町２,,2021/12/16,,,,株式会社　モリヤ商店,守屋靖太良,0152-43-2015,網走市新町１丁目２番１４号,北海道網走市新町１丁目２番１４号,,12350,北海道,網走市,新町１,,,弁当販売業,,届出,,008-030_北海道_保健所_食品衛生()_2021年12月_末日,卸売業，小売業,飲食料品小売業,各種食料品小売業,各種食料品小売業,,,,,,,モリヤ商店,モリヤ商店,株式会社モリヤ商店
届出,コンビニエンスストア,HOW網走中央病院店,網走市南六条東1丁目7網走中央病院内売店,網走市南六条東１丁目７,網走中央病院内売店,0152-67-4631,ワタキューセイモア株式会社,村田清和,綴喜郡井手町大字多賀小字茶臼塚12番地の2,綴喜郡井手町大字多賀小字茶臼塚１２番地の２,,075-361-4135,2021/12/24,,,,網走保健所,HOW網走中央病院店,0152,0152-67-4631,,,,網走市南六条東１丁目７,北海道網走市南六条東１丁目７,網走中央病院内売店,12436,北海道,網走市,南六条東１,,2021/12/24,,,,ワタキューセイモア株式会社,村田清和,075-361-4135,綴喜郡井手町大字多賀小字茶臼塚１２番地の２,京都府綴喜郡井手町多賀小字茶臼塚１２番地ノ２,,152151,京都府,綴喜郡井手町,多賀,,,コンビニエンスストア,,届出,,008-030_北海道_保健所_食品衛生()_2021年12月_末日,卸売業，小売業,飲食料品小売業,その他の飲食料品小売業,コンビニエンスストア（飲食料品を中心とするものに限る）,,,,,,,ＨＯＷ網走中央病院店,ＨＯＷ網走中央病院店,ワタキューセイモア株式会社
届出,コンビニエンスストア,ローソン網走潮見店,網走市潮見8丁目94-64,網走市潮見８丁目９４－６４,,0152-45-4311,株式会社ラクーン,大野太,斜里郡斜里町川上97番地,斜里郡斜里町川上９７番地,,0152-23-1745,2021/12/23,,,,網走保健所,ローソン網走潮見店,0152,0152-45-4311,,,,網走市潮見８丁目９４－６４,北海道網走市潮見８丁目９４－６４,,12345,北海道,網走市,潮見８,,2021/12/23,,,,株式会社ラクーン,大野太,0152-23-1745,斜里郡斜里町川上９７番地,北海道斜里郡斜里町川上９７番地,,21220,北海道,斜里郡斜里町,川上,,,コンビニエンスストア,,届出,,008-030_北海道_保健所_食品衛生()_2021年12月_末日,卸売業，小売業,飲食料品小売業,その他の飲食料品小売業,コンビニエンスストア（飲食料品を中心とするものに限る）,,,,,,,ローソン網走潮見店,ロソン網走潮見店,株式会社ラクーン
届出,その他の食料・飲料販売業,ゴーゴー！パンダ！,網走市つくしｹ丘3丁目2番2号,網走市つくしｹ丘３丁目２番２号,,,シルトクレーテ株式会社,齊藤直幸,網走市つくしｹ丘3丁目2番2号,網走市つくしｹ丘３丁目２番２号,,,2021/12/24,,,,網走保健所,ゴーゴー！パンダ！,0152,,,,,網走市つくしｹ丘３丁目２番２号,北海道網走市つくしが丘３丁目２番２号,,12358,北海道,網走市,つくしが丘３,,2021/12/24,,,,シルトクレーテ株式会社,齊藤直幸,,網走市つくしｹ丘３丁目２番２号,北海道網走市つくしが丘３丁目２番２号,,12358,北海道,網走市,つくしが丘３,,,その他の食料品製造・加工業,(包装),届出,,008-030_北海道_保健所_食品衛生()_2021年12月_末日,製造業,食料品製造業,その他の食料品製造業,,,,,,,,ゴーゴー！パンダ！,ゴゴパンダ,シルトクレーテ株式会社
届出,その他の食料・飲料販売業,有限会社フードサービスゴトウ,網走市藻琴45番地6,網走市藻琴４５番地６,,0152-61-7880,有限会社フードサービスゴトウ,後藤達也,網走市潮見10丁目11番12号,網走市潮見１０丁目１１番１２号,,0152-61-7880,2021/12/23,,,,網走保健所,有限会社フードサービスゴトウ,0152,0152-61-7880,,,,網走市藻琴４５番地６,北海道網走市藻琴４５番地６,,12488,北海道,網走市,藻琴,,2021/12/23,,,,有限会社フードサービスゴトウ,後藤達也,0152-61-7880,網走市潮見１０丁目１１番１２号,北海道網走市潮見１０丁目１１番１２号,,12347,北海道,網走市,潮見１０,,,その他の食料品製造・加工業,(包装),届出,,008-030_北海道_保健所_食品衛生()_2021年12月_末日,製造業,食料品製造業,その他の食料品製造業,,,,,,,,有限会社フードサービスゴトウ,有限会社フドサビスゴトウ,有限会社フードサービスゴトウ
届出,百貨店、総合スーパー,スーパー100,網走市南4条西3丁目,網走市南４条西３丁目,,,有限会社スーパー百,伊藤悟,網走市南4条西3丁目,網走市南４条西３丁目,,0152-44-7002,2021/12/16,,,,網走保健所,スーパー100,0152,,,,,網走市南４条西３丁目,北海道網走市南四条西３丁目,,12412,北海道,網走市,南四条西３,,2021/12/16,,,,有限会社スーパー百,伊藤悟,0152-44-7002,網走市南４条西３丁目,北海道網走市南四条西３丁目,,12412,北海道,網走市,南四条西３,,,百貨店、総合スーパー,,届出,,008-030_北海道_保健所_食品衛生()_2021年12月_末日,卸売業，小売業,各種商品小売業,百貨店，総合スーパー,百貨店，総合スーパー,,,,,,,スーパー１００,スパ１００,有限会社スーパー百
届出,魚介類販売業（包装済みの魚介類のみの販売）,オホーツクバザール,網走市南三条東4丁目5-1,網走市南三条東４丁目５－１,,0152-61-0088,オホーツクバザール株式会社,高橋晃,網走市大曲1丁目14番19号,網走市大曲１丁目１４番１９号,,0152-44-3005,2021/12/16,,,,網走保健所,オホーツクバザール,0152,0152-61-0088,,,,網走市南三条東４丁目５－１,北海道網走市南三条東４丁目５－１,,12406,北海道,網走市,南三条東４,,2021/12/16,,,,オホーツクバザール株式会社,高橋晃,0152-44-3005,網走市大曲１丁目１４番１９号,北海道網走市大曲１丁目１４番１９号,,12220,北海道,網走市,大曲１,,,魚介類販売業,包装済みの魚介類のみの販売,届出,,008-030_北海道_保健所_食品衛生()_2021年12月_末日,卸売業，小売業,飲食料品小売業,,,,,,,,,オホーツクバザール,オホツクバザル,オホーツクバザール株式会社
届出,食肉販売業（包装済みの食肉のみの販売）,オホーツクバザール,網走市南三条東4丁目5-1,網走市南三条東４丁目５－１,,0152-61-0088,オホーツクバザール株式会社,高橋晃,網走市大曲1丁目14番19号,網走市大曲１丁目１４番１９号,,0152-44-3005,2021/12/16,,,,網走保健所,オホーツクバザール,0152,0152-61-0088,,,,網走市南三条東４丁目５－１,北海道網走市南三条東４丁目５－１,,12406,北海道,網走市,南三条東４,,2021/12/16,,,,オホーツクバザール株式会社,高橋晃,0152-44-3005,網走市大曲１丁目１４番１９号,北海道網走市大曲１丁目１４番１９号,,12220,北海道,網走市,大曲１,,,食肉販売業,包装済みの食肉のみの販売,届出,,008-030_北海道_保健所_食品衛生()_2021年12月_末日,卸売業，小売業,飲食料品小売業,食肉小売業,,,,,,,,オホーツクバザール,オホツクバザル,オホーツクバザール株式会社
届出,その他の食料・飲料販売業,オホーツクバザール,網走市南三条東4丁目5-1,網走市南三条東４丁目５－１,,0152-61-0088,オホーツクバザール株式会社,高橋晃,網走市大曲1丁目14番19号,網走市大曲１丁目１４番１９号,,0152-44-3005,2021/12/16,,,,網走保健所,オホーツクバザール,0152,0152-61-0088,,,,網走市南三条東４丁目５－１,北海道網走市南三条東４丁目５－１,,12406,北海道,網走市,南三条東４,,2021/12/16,,,,オホーツクバザール株式会社,高橋晃,0152-44-3005,網走市大曲１丁目１４番１９号,北海道網走市大曲１丁目１４番１９号,,12220,北海道,網走市,大曲１,,,その他の食料品製造・加工業,(包装),届出,,008-030_北海道_保健所_食品衛生()_2021年12月_末日,製造業,食料品製造業,その他の食料品製造業,,,,,,,,オホーツクバザール,オホツクバザル,オホーツクバザール株式会社
届出,その他の食料・飲料販売業,ヴィクトリアステーション網走駅前店,網走市新町1丁目18-51,網走市新町１丁目１８－５１,,0152-61-2555,株式会社ビッグボーイジャパン,長久保文康,港区港南2丁目18番1号,港区港南２丁目１８番１号,,03-6833-8001,2021/12/20,,,,網走保健所,ヴィクトリアステーション網走駅前店,0152,0152-61-2555,,,,網走市新町１丁目１８－５１,北海道網走市新町１丁目１８－５１,,12350,北海道,網走市,新町１,,2021/12/20,,,,株式会社ビッグボーイジャパン,長久保文康,03-6833-8001,港区港南２丁目１８番１号,東京都港区港南２丁目１８番１号,,73073,東京都,港区,港南２,,,その他の食料品製造・加工業,(包装),届出,,008-030_北海道_保健所_食品衛生()_2021年12月_末日,製造業,食料品製造業,その他の食料品製造業,,,,,,,,ヴィクトリアステーション網走駅前店,ヴィクトリアステション網走駅前店,株式会社ビッグボーイジャパン
営業届出,㉖ 集団給食施設,ひまわり保育園,網走郡美幌町三橋南32番地の3,網走郡美幌町三橋南３２番地の３,,0152-72-0566,特定非営利活動法人ひまわり保育園,坂田美栄子 ,網走郡美幌町三橋南32番地の3 ,網走郡美幌町三橋南３２番地の３,,0152-72-0566,2021年12月28日,,,,北見保健所,ひまわり保育園,0152,0152-72-0566,,,,網走郡美幌町三橋南３２番地の３,北海道網走郡美幌町三橋南３２番地ノ３,,21081,北海道,網走郡美幌町,三橋南,,2021/12/28,,,,特定非営利活動法人ひまわり保育園,坂田美栄子 ,0152-72-0566,網走郡美幌町三橋南３２番地の３,北海道網走郡美幌町三橋南３２番地ノ３,,21081,北海道,網走郡美幌町,三橋南,,,給食施設,,営業届出,,008-030_北海道_保健所_食品衛生()_2021年12月_末日,宿泊業，飲食サービス業,持ち帰り・配達飲食サービス業,,,,,,,,,ひまわり保育園,ひまわり保育園,特定非営利活動法人ひまわり保育園
営業届出,㉖ 集団給食施設,学校法人北見大谷学園,北見市東相内町225番地の1,北見市東相内町２２５番地の１,,0157-36-2862,学校法人北見大谷学園,小川香潤 ,北見市東相内町225番地の1 ,北見市東相内町２２５番地の１ ,,0157-36-2862,2021年12月28日,,,,北見保健所,学校法人北見大谷学園,0157,0157-36-2862,,,,北見市東相内町２２５番地の１,北海道北見市東相内町２２５番地ノ１,,11084,北海道,北見市,東相内町,,2021/12/28,,,,学校法人北見大谷学園,小川香潤 ,0157-36-2862,北見市東相内町２２５番地の１ ,北海道北見市東相内町２２５番地ノ１,,11084,北海道,北見市,東相内町,,,給食施設,,営業届出,,008-030_北海道_保健所_食品衛生()_2021年12月_末日,宿泊業，飲食サービス業,持ち帰り・配達飲食サービス業,,,,,,,,,学校法人北見大谷学園,学校法人北見大谷学園,学校法人北見大谷学園
営業届出,⑩ コンビニエンスストア,セブンイレブン北見幸町店,北見市幸町4丁目1番31号,北見市幸町４丁目１番３１号,,0157-22-5517,株式会社フォカス,西垣智明 ,北見市幸町4丁目1番31号 ,北見市幸町４丁目１番３１号, ,0157-22-5517,2021年12月28日,,,,北見保健所,セブンイレブン北見幸町店,0157,0157-22-5517,,,,北見市幸町４丁目１番３１号,北海道北見市幸町４丁目１番３１号,,11028,北海道,北見市,幸町４,,2021/12/28,,,,株式会社フォカス,西垣智明 ,0157-22-5517,北見市幸町４丁目１番３１号,北海道北見市幸町４丁目１番３１号, ,11028,北海道,北見市,幸町４,,,コンビニエンスストア,,営業届出,,008-030_北海道_保健所_食品衛生()_2021年12月_末日,卸売業，小売業,飲食料品小売業,その他の飲食料品小売業,コンビニエンスストア（飲食料品を中心とするものに限る）,,,,,,,セブンイレブン北見幸町店,セブンイレブン北見幸町店,株式会社フォカス
営業許可,飲食店,Tutti Base（ﾃｭｯﾃｨ　ﾍﾞｰｽ）,北見市山下町1丁目2番地1　2番1,北見市山下町１丁目２番地１,２番１, ,重井睦,  ,  , ,, ,2021年12月24日,2021年12月24日,19-125,,北見保健所,Tutti Base（ﾃｭｯﾃｨ　ﾍﾞｰｽ）,0157,,,,,北見市山下町１丁目２番地１,北海道北見市山下町１丁目２番地１,２番１,11132,北海道,北見市,山下町１,,2021/12/24,2021/12/24,,,,重井睦   ,, ,,,,,,,19-125,,飲食店営業,,営業許可,,008-030_北海道_保健所_食品衛生()_2021年12月_末日,宿泊業，飲食サービス業,飲食店,,,,,,,,,Ｔｕｔｔｉ　Ｂａｓｅ（テュッティ　ベース）,ＴｕｔｔｉＢａｓｅテュッティベス,
営業届出,㉖ 集団給食施設,認定こども園みわ保育園,北見市東三輪２丁目１２７番地１,北見市東三輪２丁目１２７番地１,,0157252907,社会福祉法人北見福祉事業協会,齊藤孝司 ,北見市東三輪２丁目１２７番地１ ,北見市東三輪２丁目１２７番地１,,0157252907,2021年12月24日,,,,北見保健所,認定こども園みわ保育園,0157,0157-25-2907,,,,北見市東三輪２丁目１２７番地１,北海道北見市東三輪２丁目１２７番地１,,11246,北海道,北見市,東三輪２,,2021/12/24,,,,社会福祉法人北見福祉事業協会,齊藤孝司 ,0157-25-2907,北見市東三輪２丁目１２７番地１,北海道北見市東三輪２丁目１２７番地１,,11246,北海道,北見市,東三輪２,,,給食施設,,営業届出,,008-030_北海道_保健所_食品衛生()_2021年12月_末日,宿泊業，飲食サービス業,持ち帰り・配達飲食サービス業,,,,,,,,,認定こども園みわ保育園,認定こども園みわ保育園,社会福祉法人北見福祉事業協会
営業届出,㉖ 集団給食施設,認定こども園　北見わかば幼稚園,北見市若葉2丁目3番2号,北見市若葉２丁目３番２号,,0157-36-3001,学校法人白川学園,白川恭江 ,北見市若葉2丁目1番7号 ,北見市若葉２丁目１番７号, ,0157-36-3001,2021年12月24日,,,,北見保健所,認定こども園　北見わかば幼稚園,0157,0157-36-3001,,,,北見市若葉２丁目３番２号,北海道北見市若葉２丁目３番２号,,11139,北海道,北見市,若葉２,,2021/12/24,,,,学校法人白川学園,白川恭江 ,0157-36-3001,北見市若葉２丁目１番７号,北海道北見市若葉２丁目１番７号, ,11139,北海道,北見市,若葉２,,,給食施設,,営業届出,,008-030_北海道_保健所_食品衛生()_2021年12月_末日,宿泊業，飲食サービス業,持ち帰り・配達飲食サービス業,,,,,,,,,認定こども園　北見わかば幼稚園,認定こども園北見わかば幼稚園,学校法人白川学園
営業許可,水産製品製造業,紙谷水産,北見市常呂町字栄浦330-5,北見市常呂町字栄浦３３０－５,, ,紙谷裕樹,  ,  , ,, ,2021年12月22日,2021年12月22日,19-126,,北見保健所,紙谷水産,0152,,,,,北見市常呂町字栄浦３３０－５,北海道北見市常呂町字栄浦３３０－５,,11196,北海道,北見市,常呂町,,2021/12/22,2021/12/22,,,,紙谷裕樹   ,, ,,,,,,,19-126,,水産製品製造業,,営業許可,,008-030_北海道_保健所_食品衛生()_2021年12月_末日,製造業,食料品製造業,水産食料品製造業,,,,,,,,紙谷水産,紙谷水産,
