https://docs.google.com/spreadsheets/d/1Qy3el1DFIpxtm3-VIAdZlBmEHual1CU39oB_urGxiyI/edit#gid=508940504,,,,,,,,,,,,,,,,,,,,,,,,,,,,,,,,,,,,,,,,,,,,,,,,,,,,,,,,,,,,,,,,,
10,n処理終了,,,,,,,,,,,,,,,d08_import_license_datas,完了,,,,,,,,,,,,,,,,,,,,,,,,,,,,,,,,,,,,,,,,,,,,,,,,
その他,業種,施設名,施設-住所0,施設-住所1,施設-マンション名,施設-電話番号1,申請者1,申請者2,申請-住所0,申請-住所1,申請-マンション名,申請-電話番号1,開業年月日,許可年月日,確認番号,ここまで,,,,,,,,,,,,,,,,,,,,,,,,,,,,,,,,,,,,,,,,,,,,,,,,,
区分,営業の種類,施設名称,施設所在地,,,施設電話番号,営業者名,代表者名（法人）,営業者住所（法人）,,,営業者電話番号（法人）,初回許可（届出）年月日,許可年月日,営業許可番号,,管轄保健所,名称,市外局番,電話番号,施設の郵便番号,緯度,経度,施設の住所（元住所）,施設の住所（整備）,施設マンション名,施設-住所コード,施設-都道府県,施設-郡・政令市・市区町村名,施設-大字名・字名,申請年月日,開業年月日,許可年月日,許可期間開始日,許可期間終了日,申請法人,申請者氏名(個人名),申請者（開設者）の電話番号,申請者の住所（元住所）,申請者の住所（整備）,申請マンション名,申請-住所コード,申請-都道府県,申請-郡・政令市・市区町村名,申請-大字名・字名,確認番号,申請区分,業種,業態,その他,法人番号,シート名,産業分類大,産業分類中,産業分類小,産業分類詳細,facility_idを識別するための文字列,店舗コード,company_idを識別するための文字列,法人コード,ライセンスコード,検索用日付,整備名称,整備名称2,整備申請法人
届出,百貨店、総合スーパー,生活協同組合コープさっぽろ  べつかい店,野付郡別海町別海宮舞町26-1,野付郡別海町別海宮舞町２６－１,,,生活協同組合コープさっぽろ,大見　英明,札幌市西区発寒十一条5丁目10番1号,札幌市西区発寒十一条５丁目１０番１号,,011-671-5601,令和3年(2021年)12月1日,,,,24,生活協同組合コープさっぽろ  べつかい店,0153,,,,,野付郡別海町別海宮舞町２６－１,北海道野付郡別海町別海宮舞町２６－１,,24106,1,1691,別海宮舞町,,2021/12/01,,,,生活協同組合コープさっぽろ,大見　英明,011-671-5601,札幌市西区発寒十一条５丁目１０番１号,北海道札幌市西区発寒十一条５丁目１０番１号,,5093,北海道,札幌市西区,発寒十一条５,,,百貨店、総合スーパー,,届出,,024_北海道_中標津保健所_食品衛生()_2021年12月まで全件_末日,I,56,561,5611,生活協同組合コプさっぽろべつかい店241061691,acb68b91-b8dc-437b-8642-472670bfab4f,生活協同組合コープさっぽろ5093,5d2a6114-6538-460e-bebf-0eea11420272,7b9e2e0d-103d-4a07-8690-3f06bb3e3336,2021/12/01,生活協同組合コープさっぽろ　べつかい店,生活協同組合コプさっぽろべつかい店,生活協同組合コープさっぽろ
届出,その他の食料・飲料販売業,合田商店,標津郡標津町字川北60番地54 ,標津郡標津町字川北６０番地５４,,0153-85-2244,合田　泰之,,,,,,令和3年(2021年)12月2日,,,,24,合田商店,0153,0153-85-2244,,,,標津郡標津町字川北６０番地５４,北海道標津郡標津町字川北６０番地５４,,24114,1,1693,川北,,2021/12/02,,,,,合田　泰之 ,,,,,,,,,,,その他の食料品製造・加工業,(包装),届出,,024_北海道_中標津保健所_食品衛生()_2021年12月まで全件_末日,E,9,99,,合田商店0153-85-2244241141693,49b438fa-17a7-4d05-8c12-114e6ab39747,,personal,d518d576-d151-4579-85e6-43bdd8d41d62,2021/12/01,合田商店,合田商店,
届出,コンビニエンスストア,セイコーマート羅臼あしざき,目梨郡羅臼町八木浜町24番地1,目梨郡羅臼町八木浜町２４番地１,,0153-88-2002,有限会社あしざき商店,野  博暢,目梨郡羅臼町八木浜町24番地1,目梨郡羅臼町八木浜町２４番地１,,0153-88-2002,令和3年(2021年)12月3日,,,,24,セイコーマート羅臼あしざき,0153,0153-88-2002,,,,目梨郡羅臼町八木浜町２４番地１,北海道目梨郡羅臼町八木浜町２４番地１,,25092,1,1694,八木浜町,,2021/12/03,,,,有限会社あしざき商店,野  博暢,0153-88-2002,目梨郡羅臼町八木浜町２４番地１,北海道目梨郡羅臼町八木浜町２４番地１,,25092,北海道,目梨郡羅臼町,八木浜町,,,コンビニエンスストア,,届出,,024_北海道_中標津保健所_食品衛生()_2021年12月まで全件_末日,I,58,589,5891,セイコマト羅臼あしざき0153-88-2002250921694,e70c74b7-abda-42d4-aabe-1238b2d73694,有限会社あしざき商店25092,0067703f-f586-437e-92f4-e9ddce9ea2d5,e1558566-18d4-4e99-a68f-af237a8fd5ea,2021/12/01,セイコーマート羅臼あしざき,セイコマト羅臼あしざき,有限会社あしざき商店
届出,自動販売機による販売業（コップ式自動販売機（自動洗浄・屋内設置）及び営業許可の対象となる自動販売機を除く）,JAMES SEASONⅡ,標津郡中標津町西８条南４丁目２－１,標津郡中標津町西８条南４丁目２－１,,,篠原  奉行,,,,,,令和3年(2021年)12月4日,,,,24,JAMES SEASONⅡ,0153,,,,,標津郡中標津町西８条南４丁目２－１,北海道標津郡中標津町西八条南４丁目２－１,,24358,1,1692,西八条南４,,2021/12/04,,,,,篠原  奉行 ,,,,,,,,,,,コップ式自動販売機,コップ式自動販売機（自動洗浄・屋内設置）及び営業許可の対象となる自動販売機を除く,届出,,024_北海道_中標津保健所_食品衛生()_2021年12月まで全件_末日,I,61,612,,ＪＡＭＥＳＳＥＡＳＯＮⅡ243581692,caff904f-cbda-4201-82f5-a65ecf3b7c77,,personal,8edcc7fd-3df6-42ad-be3b-1f09b06a4c0a,2021/12/01,ＪＡＭＥＳ　ＳＥＡＳＯＮⅡ,ＪＡＭＥＳＳＥＡＳＯＮⅡ,
届出,コンビニエンスストア,セイコーマート東26条,標津郡中標津町東２６条南１丁目1番地,標津郡中標津町東２６条南１丁目１番地,,0153-79-2244,有限会社ジーショップ,合田　泰之,標津郡中標津町東２６条南１丁目1番地,標津郡中標津町東２６条南１丁目１番地,,0153-79-2244,令和3年(2021年)12月10日,,,,24,セイコーマート東26条,0153,0153-79-2244,,,,標津郡中標津町東２６条南１丁目１番地,北海道標津郡中標津町東二十六条南１丁目１番地,,24843,1,1692,東二十六条南１,,2021/12/10,,,,有限会社ジーショップ,合田　泰之,0153-79-2244,標津郡中標津町東２６条南１丁目１番地,北海道標津郡中標津町東二十六条南１丁目１番地,,24843,北海道,標津郡中標津町,東二十六条南１,,,コンビニエンスストア,,届出,,024_北海道_中標津保健所_食品衛生()_2021年12月まで全件_末日,I,58,589,5891,セイコマト東２６条0153-79-2244248431692,7ff480c1-b66c-419b-bd5d-1d0d1dadb211,有限会社ジーショップ24843,341e4bf6-7967-4c9d-a3c6-088b22b064a6,a29053e4-a406-4f7e-b855-918fb5f9e490,2021/12/01,セイコーマート東２６条,セイコマト東２６条,有限会社ジーショップ
届出,その他の食料・飲料販売業,町立別海病院売店,野付郡別海町別海常盤町１０７番地,野付郡別海町別海常盤町１０７番地,,,佐々木　有子,,,,,,令和3年(2021年)12月22日,,,,24,町立別海病院売店,0153,,,,,野付郡別海町別海常盤町１０７番地,北海道野付郡別海町別海常盤町１０７番地,,24103,1,1691,別海常盤町,,2021/12/22,,,,,佐々木　有子 ,,,,,,,,,,,その他の食料品製造・加工業,(包装),届出,,024_北海道_中標津保健所_食品衛生()_2021年12月まで全件_末日,E,9,99,,町立別海病院売店241031691,380c3382-d931-48a1-a26b-d03452633dc2,,personal,e0a18195-2fc8-497b-9fae-f1962b871bf0,2021/12/01,町立別海病院売店,町立別海病院売店,