届出,集団給食施設,軽費老人ホーム　ケアハウスやまざくら,釧路市桜ヶ岡４丁目９－１  ,釧路市桜ヶ岡４丁目９－１,,0154-92-3939,社会福祉法人釧路創生会,佐藤幹介,釧路市春採７丁目９番８号 ,釧路市春採７丁目９番８号, ,0154-47-2300,,2021.12.2,,,22,軽費老人ホーム　ケアハウスやまざくら,0154,0154-92-3939,,,,釧路市桜ヶ岡４丁目９－１,北海道釧路市桜が岡４丁目９－１,,9118,1,1206,桜が岡４,,,2021/12/02,,,社会福祉法人釧路創生会,佐藤幹介,0154-47-2300,釧路市春採７丁目９番８号,北海道釧路市春採７丁目９番８号, ,9242,北海道,釧路市,春採７,,,給食施設,,届出,,022_北海道_釧路保健所_食品衛生()_2021年12月まで全件_末日,M,77,,,軽費老人ホムケアハウスやまざくら0154-92-393991181206,8455f056-acfd-40ba-bab4-766eb4ad9bf6,社会福祉法人釧路創生会9242,c7c55fe5-3452-4327-848f-e4c9b3db8747,94ffca85-1b5e-465c-b74e-0eb4f74b621f,2021/12/02,軽費老人ホーム　ケアハウスやまざくら,軽費老人ホムケアハウスやまざくら,社会福祉法人釧路創生会
届出,集団給食施設,軽費老人ホームケアハウスよねまち,釧路市米町４丁目３－１５  ,釧路市米町４丁目３－１５,,0154-43-3343,社会福祉法人釧路創生会,佐藤幹介,釧路市春採７丁目９番８号 ,釧路市春採７丁目９番８号, ,0154-47-2300,,2021.12.2,,,22,軽費老人ホームケアハウスよねまち,0154,0154-43-3343,,,,釧路市米町４丁目３－１５,北海道釧路市米町４丁目３－１５,,9315,1,1206,米町４,,,2021/12/02,,,社会福祉法人釧路創生会,佐藤幹介,0154-47-2300,釧路市春採７丁目９番８号,北海道釧路市春採７丁目９番８号, ,9242,北海道,釧路市,春採７,,,給食施設,,届出,,022_北海道_釧路保健所_食品衛生()_2021年12月まで全件_末日,M,77,,,軽費老人ホムケアハウスよねまち0154-43-334393151206,a31f7792-5fc5-4cdc-a372-5514178ae75d,社会福祉法人釧路創生会9242,c7c55fe5-3452-4327-848f-e4c9b3db8747,b50ff650-e5c7-4ad6-a3ec-ae18c6786739,2021/12/02,軽費老人ホームケアハウスよねまち,軽費老人ホムケアハウスよねまち,社会福祉法人釧路創生会
届出,集団給食施設,特別養護老人ホームはるとりの里,釧路市春採７丁目９－７  ,釧路市春採７丁目９－７,,0154-47-2300,社会福祉法人釧路創生会,佐藤幹介,釧路市春採７丁目９－８ ,釧路市春採７丁目９－８,,0154-47-2300,,2021.12.2,,,22,特別養護老人ホームはるとりの里,0154,0154-47-2300,,,,釧路市春採７丁目９－７,北海道釧路市春採７丁目９－７,,9242,1,1206,春採７,,,2021/12/02,,,社会福祉法人釧路創生会,佐藤幹介,0154-47-2300,釧路市春採７丁目９－８,北海道釧路市春採７丁目９－８,,9242,北海道,釧路市,春採７,,,給食施設,,届出,,022_北海道_釧路保健所_食品衛生()_2021年12月まで全件_末日,M,77,,,特別養護老人ホムはるとりの里0154-47-230092421206,4ff3e2e4-3154-481c-920d-21c78072e682,社会福祉法人釧路創生会9242,c7c55fe5-3452-4327-848f-e4c9b3db8747,89ef10cf-56ee-4302-ac9e-1021291d8be2,2021/12/02,特別養護老人ホームはるとりの里,特別養護老人ホムはるとりの里,社会福祉法人釧路創生会
届出,集団給食施設,特別養護老人ホームさくらの里,釧路市桜ヶ岡４丁目１４番１０号  ,釧路市桜ヶ岡４丁目１４番１０号, ,0154-92-2151,社会福祉法人釧路創生会,佐藤幹介,釧路市春採７丁目９番８号 ,釧路市春採７丁目９番８号, ,0154-47-2300,,2021.12.2,,,22,特別養護老人ホームさくらの里,0154,0154-92-2151,,,,釧路市桜ヶ岡４丁目１４番１０号,北海道釧路市桜が岡４丁目１４番１０号, ,9118,1,1206,桜が岡４,,,2021/12/02,,,社会福祉法人釧路創生会,佐藤幹介,0154-47-2300,釧路市春採７丁目９番８号,北海道釧路市春採７丁目９番８号, ,9242,北海道,釧路市,春採７,,,給食施設,,届出,,022_北海道_釧路保健所_食品衛生()_2021年12月まで全件_末日,M,77,,,特別養護老人ホムさくらの里0154-92-215191181206,a0832fa7-1cde-4ea6-9605-8158b9eb7203,社会福祉法人釧路創生会9242,c7c55fe5-3452-4327-848f-e4c9b3db8747,c773fd88-70b4-4c78-9e68-976700da5d44,2021/12/02,特別養護老人ホームさくらの里,特別養護老人ホムさくらの里,社会福祉法人釧路創生会
届出,集団給食施設,白樺ディサービスセンター,釧路市白樺台２丁目１－１  ,釧路市白樺台２丁目１－１,,0154-91-3566,社会福祉法人釧路創生会,佐藤幹介,釧路市春採７丁目９番８号 ,釧路市春採７丁目９番８号, ,0154-47-2300,,2021.12.2,,,22,白樺ディサービスセンター,0154,0154-91-3566,,,,釧路市白樺台２丁目１－１,北海道釧路市白樺台２丁目１－１,,9133,1,1206,白樺台２,,,2021/12/02,,,社会福祉法人釧路創生会,佐藤幹介,0154-47-2300,釧路市春採７丁目９番８号,北海道釧路市春採７丁目９番８号, ,9242,北海道,釧路市,春採７,,,給食施設,,届出,,022_北海道_釧路保健所_食品衛生()_2021年12月まで全件_末日,M,77,,,白樺ディサビスセンタ0154-91-356691331206,73036cc5-29ac-4f55-8529-17af1a4d6fd6,社会福祉法人釧路創生会9242,c7c55fe5-3452-4327-848f-e4c9b3db8747,559f6f43-00bc-44da-a91d-578cb96607f8,2021/12/02,白樺ディサービスセンター,白樺ディサビスセンタ,社会福祉法人釧路創生会
届出,集団給食施設,釧路あさひ認定こども園,釧路市旭１２番２号  ,釧路市旭１２番２号, ,0154-25-2301,社会福祉法人釧路まりも学園,松原久幸,釧路市白樺台２丁目２番９号 ,釧路市白樺台２丁目２番９号, ,0154-91-3120,,2021.12.1,,,22,釧路あさひ認定こども園,0154,0154-25-2301,,,,釧路市旭１２番２号,北海道釧路市旭町１２番２号, ,8984,1,1206,旭町,,,2021/12/01,,,社会福祉法人釧路まりも学園,松原久幸,0154-91-3120,釧路市白樺台２丁目２番９号,北海道釧路市白樺台２丁目２番９号, ,9133,北海道,釧路市,白樺台２,,,給食施設,,届出,,022_北海道_釧路保健所_食品衛生()_2021年12月まで全件_末日,M,77,,,釧路あさひ認定こども園0154-25-230189841206,27a1edfc-6519-4986-9a8b-171bdb2e663e,社会福祉法人釧路まりも学園9133,a12b0257-9e89-4854-99de-23e7920ccf94,b04e7305-4b2f-4249-9eb0-9e122a49d6fd,2021/12/01,釧路あさひ認定こども園,釧路あさひ認定こども園,社会福祉法人釧路まりも学園
許可,飲食店営業,Ｄａｎｉｅｌ　２,釧路市栄町３－２  栄楽街,釧路市栄町３－２,栄楽街,  ,遠藤慎吾,  ,  , ,,  ,2021.12.1,2021.12.1,7-487,,22,Ｄａｎｉｅｌ　２,0154,,,,,釧路市栄町３－２,北海道釧路市栄町３－２,栄楽街,9105,1,1206,栄町３,,2021/12/01,2021/12/01,,,,遠藤慎吾   ,, ,,,,,,,7-487,,飲食店営業,,許可,,022_北海道_釧路保健所_食品衛生()_2021年12月まで全件_末日,M,76,,,Ｄａｎｉｅｌ２91051206,7670689f-88b6-43ce-a168-bd5382ce4934,,personal,06ba2e7b-6aa0-4eee-a931-d209ed8c5537,2021/12/01,Ｄａｎｉｅｌ　２,Ｄａｎｉｅｌ２,
届出,コンビニ,セブンイレブン釧路昭和４丁目店,釧路市昭和町４丁目８番２号  ,釧路市昭和町４丁目８番２号, ,0154-53-0036,合同会社Ｃ・Ｖ・Ｓ北海道,住尾盛,釧路市昭和町４丁目８番２号 ,釧路市昭和町４丁目８番２号, ,0154-53-0036,,2021.12.1,,,22,セブンイレブン釧路昭和４丁目店,0154,0154-53-0036,,,,釧路市昭和町４丁目８番２号,北海道釧路市昭和町４丁目８番２号, ,9131,1,1206,昭和町４,,,2021/12/01,,,合同会社Ｃ・Ｖ・Ｓ北海道,住尾盛,0154-53-0036,釧路市昭和町４丁目８番２号,北海道釧路市昭和町４丁目８番２号, ,9131,北海道,釧路市,昭和町４,,,コンビニエンスストア,,届出,,022_北海道_釧路保健所_食品衛生()_2021年12月まで全件_末日,I,58,589,5891,セブンイレブン釧路昭和４丁目店0154-53-003691311206,ab328e96-9c7c-4e86-91c2-3b57aa5e0430,合同会社Ｃ・Ｖ・Ｓ北海道9131,14dc76f2-73c0-4c5e-a3e0-1a91c4fc6527,55d2ccd2-aef8-4ad4-bb93-2fe9cf93decd,2021/12/01,セブンイレブン釧路昭和４丁目店,セブンイレブン釧路昭和４丁目店,合同会社Ｃ・Ｖ・Ｓ北海道
届出,コンビニ,セブンイレブン釧路昭和中央３丁目店,釧路市昭和中央３丁目５５番７号  ,釧路市昭和中央３丁目５５番７号, ,0154-51-3872,合同会社Ｃ・Ｖ・Ｓ北海道,住尾盛,釧路市昭和町４丁目８番２号 ,釧路市昭和町４丁目８番２号, ,0154-53-0036,,2021.12.1,,,22,セブンイレブン釧路昭和中央３丁目店,0154,0154-51-3872,,,,釧路市昭和中央３丁目５５番７号,北海道釧路市昭和中央３丁目５５番７号, ,9352,1,1206,昭和中央３,,,2021/12/01,,,合同会社Ｃ・Ｖ・Ｓ北海道,住尾盛,0154-53-0036,釧路市昭和町４丁目８番２号,北海道釧路市昭和町４丁目８番２号, ,9131,北海道,釧路市,昭和町４,,,コンビニエンスストア,,届出,,022_北海道_釧路保健所_食品衛生()_2021年12月まで全件_末日,I,58,589,5891,セブンイレブン釧路昭和中央３丁目店0154-51-387293521206,b593bfff-c8b3-40ad-9d89-5ad387e9ab9a,合同会社Ｃ・Ｖ・Ｓ北海道9131,14dc76f2-73c0-4c5e-a3e0-1a91c4fc6527,4096c252-2ca0-4343-968d-3104bfb9d632,2021/12/01,セブンイレブン釧路昭和中央３丁目店,セブンイレブン釧路昭和中央３丁目店,合同会社Ｃ・Ｖ・Ｓ北海道
届出,コンビニ,セブンイレブン釧路鶴見橋店,釧路市愛国西４丁目１番１号  ,釧路市愛国西４丁目１番１号, ,0154-38-7077,合同会社Ｃ・Ｖ・Ｓ北海道,住尾盛,釧路市昭和町４丁目８番２号 ,釧路市昭和町４丁目８番２号, ,0154-53-0036,,2021.12.1,,,22,セブンイレブン釧路鶴見橋店,0154,0154-38-7077,,,,釧路市愛国西４丁目１番１号,北海道釧路市愛国西４丁目１番１号, ,9336,1,1206,愛国西４,,,2021/12/01,,,合同会社Ｃ・Ｖ・Ｓ北海道,住尾盛,0154-53-0036,釧路市昭和町４丁目８番２号,北海道釧路市昭和町４丁目８番２号, ,9131,北海道,釧路市,昭和町４,,,コンビニエンスストア,,届出,,022_北海道_釧路保健所_食品衛生()_2021年12月まで全件_末日,I,58,589,5891,セブンイレブン釧路鶴見橋店0154-38-707793361206,ecc3fd4c-004c-4093-86b6-6121e7846c35,合同会社Ｃ・Ｖ・Ｓ北海道9131,14dc76f2-73c0-4c5e-a3e0-1a91c4fc6527,20060bf3-5119-4cb7-862d-7cc6008d0124,2021/12/01,セブンイレブン釧路鶴見橋店,セブンイレブン釧路鶴見橋店,合同会社Ｃ・Ｖ・Ｓ北海道